10.3389/fnins.2023.1163600,37123374,PMC10133512,The thalamus in psychosis spectrum disorder.,https://www.ncbi.nlm.nih.gov/pmc/articles/PMC10133512/,PMC,,
10.3390/ijms24119643,37298594,PMC10254002,Thyroid Hormone Transporters MCT8 and OATP1C1 Are Expressed in Projection Neurons and Interneurons of Basal Ganglia and Motor Thalamus in the Adult Human and Macaque Brains.,https://www.ncbi.nlm.nih.gov/pmc/articles/PMC10254002/,PMC,,
10.3389/fninf.2023.1170337,37377946,PMC10291062,Connectomes: from a sparsity of networks to large-scale databases.,https://www.ncbi.nlm.nih.gov/pmc/articles/PMC10291062/,PMC,,
10.1038/s41467-023-38582-7,37291094,PMC10250345,Functional gene delivery to and across brain vasculature of systemic AAVs with endothelial-specific tropism in rodents and broad tropism in primates.,https://www.ncbi.nlm.nih.gov/pmc/articles/PMC10250345/,PMC,,
10.3389/fnins.2023.1136500,37360183,PMC10288156,Current analysis of hypoxic-ischemic encephalopathy research issues and future treatment modalities.,https://www.ncbi.nlm.nih.gov/pmc/articles/PMC10288156/,PMC,,
10.1113/jp282626,35851953,PMC10087288,"Cortico-thalamocortical interactions for learning, memory and decision-making.",https://www.ncbi.nlm.nih.gov/pmc/articles/PMC10087288/,PMC,,
