10.1523/JNEUROSCI.4122-03.2004,,,Widespread thalamic terminations of fibers arising in the superficial medullary dorsal horn of monkeys and their relation to calbindin immunoreactivity,https://www.jneurosci.org/content/24/1/248.short,www.jneurosci.org,https://www.jneurosci.org/content/jneuro/24/1/248.full.pdf,www.jneurosci.org
10.1002/nbm.2789,,,Longitudinal 1H MRS assessment of the thalamus in a Coriaria lactone‐induced rhesus monkey status epilepticus model,https://analyticalsciencejournals.onlinelibrary.wiley.com/doi/abs/10.1002/nbm.2789,analyticalsciencejournals.onlinelibrary.wiley.com,https://analyticalsciencejournals.onlinelibrary.wiley.com/doi/pdf/10.1002/nbm.2789,analyticalsciencejournals.onlinelibrary.wiley.com
,,,Differential contributions of spinal pathways to body representation in postcentral gyrus of Macaca mulatta.,,,https://journals.physiology.org/doi/pdf/10.1152/jn.1974.37.1.119,journals.physiology.org
,,,Thalamic systems and the diversity of cortical areas,https://www.taylorfrancis.com/chapters/edit/10.1201/9780203299296-13/thalamic-systems-diversity-cortical-areas-catherine-cusick,www.taylorfrancis.com,,
10.1176/appi.ajp.158.9.1393,,,Expression of excitatory amino acid transporter transcripts in the thalamus of subjects with schizophrenia,https://ajp.psychiatryonline.org/doi/full/10.1176/appi.ajp.158.9.1393,ajp.psychiatryonline.org,,
10.1002/cne.903630408,,,Limbic connections of the orbital and medial prefrontal cortex in macaque monkeys,https://onlinelibrary.wiley.com/doi/abs/10.1002/cne.903630408,onlinelibrary.wiley.com,https://onlinelibrary.wiley.com/doi/pdf/10.1002/cne.903630408,onlinelibrary.wiley.com
10.1002/cne.21672,,,Retrograde analyses of spinothalamic projections in the macaque monkey: input to the ventral lateral nucleus,https://onlinelibrary.wiley.com/doi/abs/10.1002/cne.21672,onlinelibrary.wiley.com,https://onlinelibrary.wiley.com/doi/pdfdirect/10.1002/cne.21672,onlinelibrary.wiley.com
10.1126/science.282.5391.1121,,,Thalamic and brainstem contributions to large-scale plasticity of primate somatosensory cortex,https://www.science.org/doi/abs/10.1126/science.282.5391.1121,www.science.org,https://www.science.org/doi/pdf/10.1126/science.282.5391.1121,www.science.org
10.1073/pnas.0507729103,,,Neural connections of the posteromedial cortex in the macaque,https://www.pnas.org/doi/abs/10.1073/pnas.0507729103,www.pnas.org,,
10.1016/0014-4886(76)90260-0,,,Some connections of the posterior thalamus in monkey,https://www.sciencedirect.com/science/article/pii/0014488676902600,www.sciencedirect.com,,
10.1002/cne.901690307,,,Areal and laminar distribution of some pulvinar cortical efferents in rhesus monkey,https://onlinelibrary.wiley.com/doi/abs/10.1002/cne.901690307,onlinelibrary.wiley.com,https://onlinelibrary.wiley.com/doi/pdf/10.1002/cne.901690307,onlinelibrary.wiley.com
,,,The direct functional interrelation of sensory cortex and optic thalamus,,,https://journals.physiology.org/doi/pdf/10.1152/jn.1938.1.2.176,journals.physiology.org
10.1152/jn.1998.79.6.3143,,,A role for the dorsal column in nociceptive visceral input into the thalamus of primates,https://journals.physiology.org/doi/abs/10.1152/jn.1998.79.6.3143,journals.physiology.org,,
10.1038/34584,,,Constraints on cortical and thalamic projections: the no-strong-loops hypothesis,https://www.nature.com/articles/34584,www.nature.com,,
10.1016/0165-0173(83)90014-0,,,Cytoarchitectonic delineation of the ventral lateral thalamic region in the monkey,https://www.sciencedirect.com/science/article/pii/0165017383900140,www.sciencedirect.com,,
,,,The anatomy of manual dexterity: the new connectivity of the primate sensorimotor thalamus and cerebral cortex,https://books.google.de/books?hl=en&lr=&id=udH6CAAAQBAJ&oi=fnd&pg=PA1&dq=(macaque+OR+macaca+OR+%22rhesus+monkey%22)+(thalamus+OR+thalamic+OR+thalamocortical+OR+%22thalamo-cortical%22)&ots=hL5iwoU5ku&sig=zvJbwP900K7w_YWsd1m9y-nbtaA&redir_esc=y,books.google.de,,
10.1002/cne.903090302,,,Dual mode of corticothalamic synaptic termination in the mediodorsal nucleus of the rhesus monkey,https://onlinelibrary.wiley.com/doi/abs/10.1002/cne.903090302,onlinelibrary.wiley.com,https://onlinelibrary.wiley.com/doi/pdf/10.1002/cne.903090302,onlinelibrary.wiley.com
10.1113/jphysiol.1990.sp018307,,,Vestibular neurones in the parieto‐insular cortex of monkeys (Macaca fascicularis): visual and neck receptor responses.,https://physoc.onlinelibrary.wiley.com/doi/abs/10.1113/jphysiol.1990.sp018307,physoc.onlinelibrary.wiley.com,https://www.ncbi.nlm.nih.gov/pmc/articles/PMC1181753/pdf/jphysiol00456-0559.pdf,www.ncbi.nlm.nih.gov
10.3171/jns.1997.86.1.0077,,,Toward an agreement on terminology of nuclear and subnuclear divisions of the motor thalamus,https://thejns.org/view/journals/j-neurosurg/86/1/article-p77.xml,thejns.org,,
10.1002/cne.1340,,,Two types of projection neurons in the internal pallidum of primates: single‐axon tracing and three‐dimensional reconstruction,https://onlinelibrary.wiley.com/doi/abs/10.1002/cne.1340,onlinelibrary.wiley.com,https://onlinelibrary.wiley.com/doi/pdf/10.1002/cne.1340,onlinelibrary.wiley.com
10.1016/0306-4522(84)90166-0,,,Dual pathways connecting the dorsolateral prefrontal cortex with the hippocampal formation and parahippocampal cortex in the rhesus monkey,https://www.sciencedirect.com/science/article/pii/0306452284901660,www.sciencedirect.com,,
10.1002/cne.903260308,,,Thalamic connections of the vestibular cortical fields in the squirrel monkey (Saimiri sciureus),https://onlinelibrary.wiley.com/doi/abs/10.1002/cne.903260308,onlinelibrary.wiley.com,https://onlinelibrary.wiley.com/doi/pdf/10.1002/cne.903260308,onlinelibrary.wiley.com
10.1016/S0306-4522(00)00368-7,,,Functional plasticity in primate somatosensory thalamus following chronic lesion of the ventral lateral spinal cord,https://www.sciencedirect.com/science/article/pii/S0306452200003687,www.sciencedirect.com,,
10.1002/cne.902420102,,,"The afferent connections of the substantia innominata in the monkey, Macaca fascicularis",https://onlinelibrary.wiley.com/doi/abs/10.1002/cne.902420102,onlinelibrary.wiley.com,https://onlinelibrary.wiley.com/doi/pdf/10.1002/cne.902420102,onlinelibrary.wiley.com
10.1152/jn.90810.2008,,,Termination zones of functionally characterized spinothalamic tract neurons within the primate posterior thalamus,https://journals.physiology.org/doi/abs/10.1152/jn.90810.2008,journals.physiology.org,,
10.1016/j.neubiorev.2015.03.001,,,The mediodorsal thalamus as a higher order thalamic relay nucleus important for learning and decision-making,https://www.sciencedirect.com/science/article/pii/S0149763415000718,www.sciencedirect.com,,
10.1016/0165-0173(79)90008-0,,,Thalamocortical synaptic relations: a review with emphasis on the projections of specific thalamic nuclei to the primary sensory areas of the neocortex,https://www.sciencedirect.com/science/article/pii/0165017379900080,www.sciencedirect.com,,
10.1073/pnas.79.19.6098,,,Thalamic inputs to cytochrome oxidase-rich regions in monkey visual cortex.,https://www.pnas.org/doi/abs/10.1073/pnas.79.19.6098,www.pnas.org,https://www.pnas.org/doi/pdf/10.1073/pnas.79.19.6098,www.pnas.org
10.1016/0028-3908(85)90070-X,,,"Regional brain uptake of 2-deoxyglucose in N-methyl-4-phenyl-1, 2, 3, 6-tetrahydropyridine (MPTP)—induced parkinsonism in the macaque monkey",https://www.sciencedirect.com/science/article/pii/002839088590070X,www.sciencedirect.com,,
10.1159/000106279,,,The Thalamus of the Chimpanzee. pp. 99–109,https://karger.com/cfn/article-abstract/1/1/99/68904/The-Thalamus-of-the-Chimpanzee-pp-99-109I?redirectedFrom=PDF,karger.com,,
10.1002/hipo.20276,,,Origin and topography of fibers contributing to the fornix in macaque monkeys,https://onlinelibrary.wiley.com/doi/abs/10.1002/hipo.20276,onlinelibrary.wiley.com,https://onlinelibrary.wiley.com/doi/pdf/10.1002/hipo.20276,onlinelibrary.wiley.com
10.1002/ana.1119,,,Nigrostriatal collaterals to thalamus degenerate in parkinsonian animal models,https://onlinelibrary.wiley.com/doi/abs/10.1002/ana.1119,onlinelibrary.wiley.com,https://onlinelibrary.wiley.com/doi/pdf/10.1002/ana.1119,onlinelibrary.wiley.com
