3041,10.1098/rstb.1979.0005,36639.0,,https://royalsocietypublishing.org/doi/10.1098/rstb.1979.0005,royalsocietypublishing.org,://royalsocietypublishing.org/,royalsocietypublishing.org,An experimental electron microscopy study of afferent connections to the primate motor and somatic sensory cortices,An experimental electron microscope em study has been made of the termination of the afferent connections to the primate sensori-motor cortex Following large stereotaxically placed thalamic lesions degeneration in the motor and somatic sensory cortices was studied at survival periods of  and  days Degenerating thalamocortical terminals had asymmetric membrane specializations In the motor cortex  made synapses on to dendritic spines  on to dendritic shafts and  on to cell somata in the somatic sensory area  made synapses on to spines   on to dendritic shafts and one example contacted a cell soma and a spine A considerable number of the spines receiving synapses from degenerating thalamo-cortical terminals were traced to their parent dendrites and these were of the pyramidal type whereas the dendritic shafts and cell somata contacted by degenerating thalamo-cortical terminals were mostly of the large stellate type Most of the thalamo-cortical degeneration in both cortical areas occurred in a dense band in the upper two thirds of layer IV and the lower half of layer III but a number of degenerating terminals were found deep to this in the motor cortex a second less dense band of degeneration was present in the lower part of layer V and top of layer VI Degenerating thalamo-cortical terminals making synapses on to dendritic shafts and cell somata were scattered through the deep half of the cortex and not concentrated in the dense band of degeneration and so formed a greater proportion of the degeneration in the deep layers particularly in the motor cortex Sections cut parallel to the pial surface in layer IV of the motor cortex showed a statistically significant association between the degenerating thalamocortical axon terminals and the bundles of apical dendrites present at this level Degeneration of commissural fibres was studied after removal of the contralateral sensori-motor cortex Degenerating terminals had asymmetric membrane specializations In the motor cortex  made synapses on to dendritic spines  contacted dendritic shafts and one example made an axosomatic synapse in area   made synapses on to dendritic spines and  contacted dendritic shafts A number of the spines receiving synapses from degenerating commissural axon terminals were traced to their parent dendrites and these were of the pyramidal type The cell soma and the majority of the dendritic shafts receiving synapses from commissural terminals were of the large stellate type although some of the dendritic shafts were probably those of small stellate cells In the motor cortex degenerating commissural axon terminals were found in all cortical layers but were relatively more dense in layer I the upper part of layer III the upper part of layer V and the lowest part of layer V with layer V I in the somatic sensory cortex most degenerating commissural terminals were found in the superficial half of the cortex Following lesions of the primary somatic sensory cortex SI or of area  of the premotor cortex degenerating terminals making asymmetric synapses were found in the motor cortex Of the terminals of association fibres from SI  made synapses on to dendritic spines and  on to dendritic shafts of those fibres from area   made synapses on to dendritic spines and  on to dendritic shafts For both these association fibre connections a proportion of the dendritic shafts contacted were clearly identifiable as those of large stellate cells Terminals of both association connections occurred in all cortical layers with no obvious concentrations at any particular depth,
3045,10.1159/000143912,4630524.0,,https://karger.com/aan/article-abstract/84/1/76/7020/The-termination-of-optic-fibres-in-the-lateral?redirectedFrom=fulltext,karger.com,,,The termination of optic fibres in the lateral geniculate nucleus of some primates. An ultrastructural study,,
3048,10.1016/s0074-7742(08)60327-x,4347727.0,,https://linkinghub.elsevier.com/retrieve/pii/S007477420860327X,linkinghub.elsevier.com,://linkinghub.elsevier.com/,linkinghub.elsevier.com,Projection of Forelimb Group I Muscle Afferents to the Cat Cerebral Cortex,This chapter describes the projection of forelimb group I muscle afferents to the cat cerebral cortex A schematic diagram of the forelimb group I afferent pathway is illustrated Although the group I path and the cutaneous path in the dorsal funiculusmedial lemniscus system follow the same general course to the sensorimotor cortex a separation between them is maintained at all levels including the cortical projection areas Three separate groups of neurons monosynaptically activated by the ascending group I afferents have been identified by systematic recording from the dorsal column nuclei and the rostral cervical cord The second order neurons of the group I pathway to the cerebral cortex have been identified as cuneothalamic relay cells by antidromic stimulation of the medial lemniscus The interconnections of cortical neurons have been analyzed by stimulation of cortical afferent and efferent fibers in the white matter below the cortex of the projection area,
3054,10.1162/08997660360581886,12689385.0,,https://direct.mit.edu/neco/article-abstract/15/4/735/6721/Modeling-Reverse-Phi-Motion-Selective-Neurons-in?redirectedFrom=fulltext,direct.mit.edu,,,Modeling Reverse-Phi Motion-Selective Neurons in Cortex: Double Synaptic-Veto Mechanism,Reverse-phi motion is the illusory reversal of perceived direction of movement when the stimulus contrast is reversed in successive frames Livingstone Tsao and Conway  showed that direction-selective cells in striate cortex of the alert macaque monkey showed reversed excitatory and inhibitory regions when two different contrast bars were flashed sequentially during a two-bar interaction analysis While correlation or motion energy models predict the reverse-phi response it is unclear how neurons can accomplish this We carried out detailed biophysical simulations of a direction-selective cell model implementing a synaptic shunting scheme Our results suggest that a simple synaptic-veto mechanism with strong direction selectivity for normal motion cannot account for the observed reverse-phi motion effect Given the nature of reverse-phi motion a direct interaction between the ON and OFF pathway missing in the original shunting-inhibition model it is essential to account for the reversal of response We here propose a double synaptic-veto mechanism in which ON excitatory synapses are gated by both delayed ON inhibition at their null side and delayed OFF inhibition at their preferred side The converse applies to OFF excitatory synapses Mapping this scheme onto the dendrites of a direction-selective neuron permits the model to respond best to normal motion in its preferred direction and to reverse-phi motion in its null direction Two-bar interaction maps showed reversed excitation and inhibition regions when two different contrast bars are presented,
3057,10.1017/s0952523800011275,1450101.0,,https://www.cambridge.org/core/journals/visual-neuroscience/article/abs/monocular-enucleation-reduces-immunoreactivity-to-the-calciumbinding-protein-calbindin-28-kd-in-the-rhesus-monkey-lateral-geniculate-nucleus/01FBD363E9D26DCE1FAF7D5789A0BF88,www.cambridge.org,,,Monocular enucleation reduces immunoreactivity to the calcium-binding protein calbindin 28 kD in the Rhesus monkey lateral geniculate nucleus,The calcium-binding proteins calbindin CaBP and parvalbumin PV are important in regulating intracellular calcium in brain cells PV immunoreactivity is reduced by enucleation in the lateral geniculate nucleus LGN and by enucleation and visual deprivation in the striate cortex of adult monkeys The effects of enucleation and visual deprivation on CaBP immunoreactivity in the LGN are not known We therefore have studied cells and neuropil in the LGN that are labeled by antibodies to CaBP in normal and visually deprived Rhesus monkeys to determine if there is an effect on this calcium-binding protein One group of monkeys had one eye removed  weeks to  years before sacrifice A second group had one eye occluded with opaque lenses from infancy without enucleation A final group had one eye occluded long-term followed by short-term enucleation  weeks before sacrifice In normal monkeys CaBP-immunoreactive neurons were found throughout the LGN They were sparsely distributed within the six main laminae and more densely distributed within layer S and the interlaminar zones ILZ The labeled ILZ neurons had a distinct morphology with fusiform somata and elaborate dendritic trees that were confined primarily to the ILZ Most CaBP-labeled neurons in the main layers had dendrites that radiated in all directions from the soma ILZ and main layer cells labeled by CaBP thus probably represent two different cell types Monocular enucleation with or without occlusion produced a significant reduction in antibody labeling in the deafferented laminae Field measures revealed an average  reduction in optical density in each deafferented lamina compared to its adjacent nondeprived layer The differences in field optical density between deprived and nondeprived layers were statistically significant CaBP neurons were still visible but the optical density of antibody labeling in these cells also was reduced Occlusion without enucleation had no effect Thus deafferentation but not light deprivation reduces concentrations of CaBP in monkey LGN This effect is different than that seen in striate cortex of adult monkeys where visual deprivation as well as enucleation alters CaBP immunoreactivity,Calcium; Immunocytochemistry; Visual pathways; Enucleation; Occlusion;
3063,10.1017/s0952523898151015,9456504.0,,https://www.cambridge.org/core/journals/visual-neuroscience/article/abs/temporalchromatic-interactions-in-lgn-pcells/DA2EFFD87B70C49C1946DA7AFFE1154A,www.cambridge.org,,,Temporal-chromatic interactions in LGN P-cells,We studied the interaction between the chromatic and temporal properties of parvocellular P neurons in the lateral geniculate nucleus LGN of macaque monkeys We measured the amplitudes and phases of responses to stimulation by spatially uniform fields modulated sinusoidally about a white point in a three-dimensional color space at a range of temporal frequencies between  and  Hz Below about  Hz temporal frequency had relatively little effect on chromatic tuning At higher frequencies chromatic opponency was weakened in almost all cells The complex interactions between temporal and chromatic properties are represented by a linear filter model that describes response amplitude and phase as a function of temporal frequency and direction in color space along which stimuli are modulated The model stipulates the cone inputs to center and surround their temporal properties and the linear combination of center and surround signals It predicts the amplitudes and phases of responses of P-cells and the change of chromatic properties with temporal frequency We used the model to investigate whether or not the chromatic signature of the surround in a redgreen cell could be estimated from the change in the cells chromatic properties with temporal frequency Our findings could be equally well described by mixed cone surrounds as by pure cone surrounds and we conclude that with regard to temporal properties there is no benefit to be gained by segregating cone classes in center and surround,P-cells; Lateral geniculate nucleus LGN; Macaque monkey; Chromatic properties; Temporal properties;
3066,10.1016/j.bmc.2006.10.065,17123820.0,,https://linkinghub.elsevier.com/retrieve/pii/S0968089606009084,linkinghub.elsevier.com,://linkinghub.elsevier.com/,linkinghub.elsevier.com,Synthesis of 11C-labelled (R)-OHDMI and CFMME and their evaluation as candidate radioligands for imaging central norepinephrine transporters with PET,R---Dihydro-dibenzobfazepin--yl--methylamino-propan--ol R-OHDMI and SS--cyclopentyl---fluoro--methoxy-phenyl--morpholin--yl-ethanol CFMME were synthesized and found to be potent inhibitors of norepinephrine reuptake Each was labelled efficiently in its methyl group with carbon- t   min as a prospective radioligand for imaging brain norepinephrine transporters NET with positron emission tomography PET The uptake and distribution of radioactivity in brain following intravenous injection of each radioligand into cynomolgus monkey was examined in vivo with PET After injection of R-COHDMI the maximal whole brain uptake of radioactivity was very low  of injected dose ID For occipital cortex thalamus lower brainstem mesencephalon and cerebellum radioactivity ratios to striatum at  min after radioligand injection were     and  respectively After injection of CCFMME radioactivity readily entered brain  ID Ratios of radioactivity to cerebellum at  min for thalamus occipital cortex region of locus coeruleus mesencephalon and striatum were     and  respectively Radioactive metabolites in plasma were measured by radio-HPLC R-COHDMI represented  of plasma radioactivity at  min after injection and  at  min After injection of CCFMME  of the radioactivity in plasma represented parent at  min and  at  min Since the two new hydroxylated radioligands provide only modest regional differentiation in brain uptake and form potentially troublesome lipophilic radioactive metabolites they are concluded to be inferior to existing radioligands such as SS-CMeNER SS-FFMeNER-D and SS-FFRB-D for the study of brain NETs with PET in vivo,
3086,10.1017/s0952523813000370,24044878.0,,https://www.cambridge.org/core/journals/visual-neuroscience/article/spatial-sensitivity-responsivity-and-surround-suppression-of-lgn-cell-responses-in-the-macaque/85118DC59DC0F854FE74A4232F974F90,www.cambridge.org,,,Spatial sensitivity; responsivity; and surround suppression of LGN cell responses in the macaque,Responses of cells in the lateral geniculate nucleus LGN of the macaque monkey have been measured for different sizes of chromatic and achromatic stimuli with relative luminance spanning a range of  log units Homogeneous illuminated test fields centered on the receptive field were used Responses to these stimuli deviated from what is expected for the grating stimuli used to study the contrast-sensitive mechanisms in the visual pathway For test fields smaller than the center of the receptive field both the excitatory and the inhibitory cone-opponent components were present in the response and the sensitivity to both components increased with the same factor when the test field increased in size area summation For test field areas extending into the suppressive surround of the extraclassical receptive field the excitatory and the inhibitory cone opponents were both suppressed again by the same factor This suppression of the cells responsiveness as a function of test spot area was described by a logarithmic function and the spatial sensitivity of attenuation could therefore be described by a power function of radius The logarithmic suppression was clear for parvocellular and koniocellular cells but was more prominent for magnocellular cells The surround field suppression was also found for the prepotential inputs to LGN cells indicating a retinal origin The difference of Gaussian DOG model has been used successfully to describe the cells contrast behavior for grating stimuli However this model fails to describe the constant excitatoryinhibitory response balance needed to obtain color hue stability for light stimuli of different sizes but with the same Commission Internationale de lEclairage CIE chromaticity and luminance factor Neither the constant responsiveness found in the center of the receptive field nor the suppressive response in the surround can be described by the DOG model,LGN opponent cells; Receptive fields; DOG; Surround suppression; Color stability;
3098,10.1017/s0952523801182106,11417800.0,,https://www.cambridge.org/core/journals/visual-neuroscience/article/abs/effects-of-saccadic-eye-movements-on-the-activity-of-geniculate-relay-neurons-in-the-monkey/F90A2222D72F791FF09FA705ED11C12F,www.cambridge.org,,,The effects of saccadic eye movements on the activity of geniculate relay neurons in the monkey,Saccadic suppression is the reduced visibility that occurs during saccadic eye movements Recent psychophysical studies have suggested that this is due to a reduction in responsiveness of magnocellular M but not parvocellular P cells of the lateral geniculate nucleus To address this and other phenomena of responsiveness during saccades we recorded from geniculate neurons in the behaving monkey before during and after saccades Specifically we measured neuronal responses to a flashing whole-field illumination Contrary to the prediction most M neurons showed pronounced enhancement of visual activity during saccades whereas such responsiveness of parvocellular P neurons was not significantly affected by saccades We also analyzed the extent to which saccades affected burst firing which results from activation of a voltage-dependent Ca conductance We found that both M and P cells displayed a significant suppression of burst firing during saccades These results do not support the idea that saccadic suppression has an obvious substrate in reduced responsiveness of geniculate cells but this suppression may be related to an increased visual threshold for detection associated with reduced burst firing,Burst; Eye movement; Lateral geniculate nucleus; Vision; Low-threshold spike;
3128,10.1016/0304-3959(89)90198-x,2474142.0,,https://journals.lww.com/pain/abstract/1989/06000/a_dorsolateral_spinothalamic_tract_in_macaque.10.aspx,journals.lww.com,://journals.lww.com/,journals.lww.com,A dorsolateral spinothalamic tract in macaque monkey,Prior work has indicated the existence of a major spinal cord pathway made up of lamina I cell axons ascending in the dorsolateral funiculus in both rat and cat In cat a portion of this lamina I dorsolateral funiculus pathway terminates in the thalamus The purpose of this report is to demonstrate that a similar dorsolateral spinothalamic tract exists in macaque monkey Retrograde transport of horseradish peroxidase injected into the somatosensory thalamus of monkeys was used to identify the cells of origin of the spinothalamic tract in the cervical and lumbar enlargements In order to determine the funicular courses of the axons contributing to the spinothalamic pathway thalamic injections of horseradish peroxidase were combined with ipsilateral ventral or dorsolateral thoracic spinal cord lesions The results indicate that in macaque monkey many lamina I cell axons ascend to the thalamus in the dorsolateral funiculus contralateral to their parent cells Some lamina I cell axons as well as the majority of axons of spinothalamic cells located in deeper laminae ascend in the contralateral ventral quadrant to terminate in the thalamus The existence in macaque of a dorsolateral spinothalamic pathway comprised of lamina I cell axons strongly implies the presence of a similar pathway in humans and has important implications regarding the mechanisms underlying both clinical and experimental nociception,
3141,10.1017/s0952523800007914,7786845.0,,https://www.cambridge.org/core/journals/visual-neuroscience/article/abs/effects-of-wavelength-on-the-timing-and-laminar-distribution-of-illuminanceevoked-activity-in-macaque-v1/A6F43C4DE063E98F41A3A3526EF1849D,www.cambridge.org,,,Effects of wavelength on the timing and laminar distribution of illuminance-evoked activity in macaque V1,Responses to full-field colored flashes red blue and green were compared with those to illuminancematched white flashes in area V optic radiations and the lateral geniculate nucleus of two alert macaques Laminar profiles of visual evoked potentials VEPs current source density and multiunit activity were obtained using multicontact electrodes capable of sampling from all layers of cortex or lateral geniculate nucleus simultaneously In striate cortex stimulation with colored flash enhanced transmembrane current flow dramatically in both layer c and the supragranular laminae Stimulation with red evoked the largest enhancement in every electrode penetration The mean peak amplitudes of current sinks evoked by red were  and  of those evoked by white light in layer c and the supragranular laminae respectively Color effects in VI were preceded by an initial epoch of wavelength-insensitive activity In layer c the red effect reached significance on average at  ms or  ms after the onset of transmembrane current flow In the supragranular layers the red effect reached significance on average at  ms or  ms after the onset of current flow Recordings from optic radiations in the white matter below V and from lateral geniculate nucleus showed no significant difference in the responses to color and illuminance-matched white light Enhancement of supragranular current flow with color stimulation increased the contribution of these laminae to the generation of the surface VHP Comparison of the surface VHP wave forms evoked by white and color stimuli may therefore help to differentiate the responses of the granular and supragranular laminae,Color; Striate cortex; Current source density; Multiunit activity; VEP; Awake monkey; Lateral geniculate nucleus;
3148,10.1016/s0021-5155(00)00211-2,11033120.0,,https://linkinghub.elsevier.com/retrieve/pii/S0021515500002112,linkinghub.elsevier.com,://linkinghub.elsevier.com/,linkinghub.elsevier.com,Effects of Alertness on Three-Dimensional Eye Movements,Purpose To investigate effects of alertness on three-dimensional D eye movements Methods During drowsy and alert periods D eye movements were recorded with dual search coils in three normal rhesus monkeys and in two of these monkeys after placement of bilateral kainic acid lesions of the rostral interstitial nucleus of the medial longitudinal fasciculus riMLF Results When the three monkeys were in the normal state the average plane thickness standard deviation of all rotation vectors from the regressed plane during drowsy periods range  increased significantly compared with the plane thickness during alert periods range  in the light P   The plane thickness increased significantly in the monkey with asymmetric bilateral riMLF-lesions P   however the increase was not significant in the monkey with more symmetric bilateral riMLF-lesions After the bilateral riMLF-lesions the plane thickness also increased with drowsiness in both monkeys P   as it had in the normal state Conclusion The implementation of Listings law is independent of the presence of vertical-torsional burst neurons in the riMLF The increase in thickness of Listings plane during drowsy periods is not due to an imprecise signal from saccadic burst neurons to the D velocity-to-position integrator It is possible that this integrator itself controls Listings law depending on the state of alertness,
3149,10.1017/s0952523800007239,8731000.0,,https://www.cambridge.org/core/journals/visual-neuroscience/article/abs/relationship-between-numbers-of-retinal-ganglion-cells-and-lateral-geniculate-neurons-in-the-rhesus-monkey/E0C0AE5C5AA71C7A863C0A3A8F753A4D,www.cambridge.org,,,Relationship between numbers of retinal ganglion cells and lateral geniculate neurons in the rhesus monkey,Studies of the numbers of retinal ganglion cells and lateral geniculate nucleus LGN neurons in primates suggest that the numbers of both types of neurons may vary over a two-fold range from one individual to another This raises the question of whether the numbers of ganglion cells and LGN neurons are related or vary independently from individual to individual We used stereological procedures to obtain unbiased estimates of the numbers of both cell types in seven rhesus monkeys We found no significant correlation rs   between the numbers of retinal and LGN cells in the same animals In agreement with previous studies the average ratio of the number of retinal ganglion cells that project to the LGN and the number of LGN cells was approximately  However this ratio varied over a two-fold range from  to  in individual animals These results have important implications for understanding the mechanisms of retino-geniculate development and for understanding the connectional wiring between the retina and LGN,Retina; Lateral geniculate nucleus; Primate; Ganglion cells;
