"10.1007/bf00237265",,,"https://link.springer.com/article/10.1007/BF00237265","https://link.springer.com/content/pdf/10.1007/BF00237265.pdf","Topographical projections of the prestriate cortex to the pulvinar nuclei in the macaque monkey: an autoradiographic study"
"10.1016/0014-4886(76)90260-0",,,"https://www.sciencedirect.com/science/article/pii/0014488676902600",,"Some connections of the posterior thalamus in monkey"
,,,,"https://www.cell.com/neuron/pdf/S0896-6273(02)00718-3.pdf","Magnetic resonance imaging of neuronal connections in the macaque monkey"
"10.1001/archneur.1982.00510180003001",,,"https://jamanetwork.com/journals/jamaneurology/article-abstract/580777",,"Symmetry and asymmetry in the human posterior thalamus: I. Cytoarchitectonic analysis in normal persons"
"10.1016/s0306-4522(03)00064-2",,,"https://www.sciencedirect.com/science/article/pii/S0306452203000642",,"… and binding parameters of GABAA receptors in the thalamic nuclei of Macaca mulatta and changes caused by lesioning in the globus pallidus and reticular thalamic …"
"10.1016/0006-8993(79)90260-9",,,"https://www.sciencedirect.com/science/article/pii/0006899379902609",,"… of the projections of the dorsal lateral geniculate nucleus, the inferior pulvinar and adjacent lateral pulvinar to primary visual cortex (area 17) in the macaque monkey"
"10.1093/brain/123.3.601",,,"https://academic.oup.com/brain/article/123/3/601/348813",,"… and immunohistochemical characterization of a specific pain and temperature relay, the posterior portion of the ventral medial nucleus, in the human thalamus"
"10.1016/0006-8993(80)90340-6",,,"https://www.sciencedirect.com/science/article/pii/0006899380903406",,"Thalamic projections from lateral cervical nucleus in monkey. A degeneration study"
"10.1016/s0006-8993(03)02548-4",,,"https://www.sciencedirect.com/science/article/pii/S0006899303025484","https://projects.iq.harvard.edu/files/simonyanlab/files/1-s2.0-s0006899303025484-main.pdf","Efferent subcortical projections of the laryngeal motorcortex in the rhesus monkey"
"10.1016/j.brainresrev.2010.12.002",,,"https://www.sciencedirect.com/science/article/pii/S0165017311000026","https://os.unil.cloud.switch.ch/tind-customer-epfl/6792959e-90d7-4c69-bea0-239c48774f2c?response-content-disposition=attachment%3B%20filename%2A%3DUTF-8%27%27Lopez2011BRR.pdf&response-content-type=application%2Fpdf&AWSAccessKeyId=ded3589a13b4450889b2f728d54861a6&Expires=1692648161&Signature=%2FD9CKyTjlXMfHDbuDlYI4xQDm10%3D","The thalamocortical vestibular system in animals and humans"
,,,,"https://www.cell.com/neuron/pdf/S0896-6273(07)00768-4.pdf","Gain modulation by nicotine in macaque v1"
"10.1007/978-1-4684-5871-8_7",,,"https://link.springer.com/chapter/10.1007/978-1-4684-5871-8_7",,"… organization of the thalamostriatal projection in the Japanese monkey, Macaca fuscata, with special reference to the centromedian-parafascicular and motor thalamic …"
"10.1002/cne.902220106",,,"https://onlinelibrary.wiley.com/doi/abs/10.1002/cne.902220106","https://onlinelibrary.wiley.com/doi/pdf/10.1002/cne.902220106","Projections of the amygdala to the thalamus in the cynomolgus monkey"
"10.1016/s0079-6123(08)60486-0",,,"https://www.sciencedirect.com/science/article/pii/S0079612308604860",,"Some extra-striate corticothalamic connections in macaque monkeys"
"10.1152/jn.00729.2009",,,"https://journals.physiology.org/doi/abs/10.1152/jn.00729.2009","https://journals.physiology.org/doi/prev/20091202-aop/pdf/10.1152/jn.00729.2009","Responses of ventral posterior thalamus neurons to three-dimensional vestibular and optic flow stimulation"
"10.1016/0165-0173(89)90007-6",,,"https://www.sciencedirect.com/science/article/pii/0165017389900076",,"A new parcellation of the human thalamus on the basis of histochemical staining"
"10.3389/fncir.2015.00079",,,"https://www.frontiersin.org/articles/10.3389/fncir.2015.00079/full",,"Vestibular interactions in the thalamus"
"10.1002/(sici)1096-9861(19980427)394:1<118::aid-cne9>3.0.co;2-3",,,"https://onlinelibrary.wiley.com/doi/abs/10.1002/(SICI)1096-9861(19980427)394:1%3C118::AID-CNE9%3E3.0.CO;2-3","https://onlinelibrary.wiley.com/doi/pdf/10.1002/%28SICI%291096-9861%2819980427%29394%3A1%3C118%3A%3AAID-CNE9%3E3.0.CO%3B2-3","GABAB receptor gene expression in monkey thalamus"
"10.1016/0014-4886(69)90094-6",,,"https://www.sciencedirect.com/science/article/pii/0014488669900946",,"The thalamic projection of hypoglossal afferents in the rhesus monkey"
"10.1007/bf00523634",,,"https://link.springer.com/article/10.1007/BF00523634",,"Architectonic parcellation of the temporal operculum in rhesus monkey and its projection pattern"
"10.1002/cne.902420406",,,"https://onlinelibrary.wiley.com/doi/abs/10.1002/cne.902420406","https://onlinelibrary.wiley.com/doi/pdf/10.1002/cne.902420406","The primate mediodorsal (MD) nucleus and its projection to the frontal lobe"
"10.1038/199820a0",,,"https://www.nature.com/articles/199820a0","https://www.nature.com/articles/199820a0.pdf","Thalamic microneurones"
"10.1016/j.brainresbull.2008.09.013",,,"https://www.sciencedirect.com/science/article/pii/S0361923008003420",,"The cortico-basal ganglia integrative network: the role of the thalamus"
"10.1016/s0079-6123(08)62676-x",,,"https://www.sciencedirect.com/science/article/pii/S007961230862676X",,"Prefrontal cortex in relation to other cortical areas in rhesus monkey: architecture and connections"
"10.1002/cne.901980111",,,"https://onlinelibrary.wiley.com/doi/abs/10.1002/cne.901980111","https://onlinelibrary.wiley.com/doi/pdf/10.1002/cne.901980111","Direct and indirect pathways from the amygdala to the frontal lobe in rhesus monkeys"
"10.1016/0304-3940(95)11273-y",,,"https://www.sciencedirect.com/science/article/pii/030439409511273Y",,"Nucleus reticularis thalami input to the anterior thalamic nuclei in the monkey: a light and electron microscopic study"
"10.1016/j.neulet.2013.02.007",,,"https://www.sciencedirect.com/science/article/pii/S0304394013001171",,"Dose-dependent effect of isoflurane on regional cerebral blood flow in anesthetized macaque monkeys"
"10.1515/REVNEURO.2007.18.6.417",,,"https://www.degruyter.com/document/doi/10.1515/REVNEURO.2007.18.6.417/html",,"Circuits for multisensory integration and attentional modulation through the prefrontal cortex and the thalamic reticular nucleus in primates"
"10.1002/cne.902970304",,,"https://onlinelibrary.wiley.com/doi/abs/10.1002/cne.902970304","https://onlinelibrary.wiley.com/doi/pdf/10.1002/cne.902970304","Topographic intermingling of striatonigral and striatopallidal neurons in the rhesus monkey"
"10.1038/s41593-017-0020-1",,,"https://www.nature.com/articles/s41593-017-0020-1",,"Thalamic functions in distributed cognitive control"
"10.1093/cercor/2.3.217",,,"https://academic.oup.com/cercor/article/2/3/217/444951","https://watermark.silverchair.com/2-3-217.pdf?token=AQECAHi208BE49Ooan9kkhW_Ercy7Dm3ZL_9Cf3qfKAc485ysgAAA2swggNnBgkqhkiG9w0BBwagggNYMIIDVAIBADCCA00GCSqGSIb3DQEHATAeBglghkgBZQMEAS4wEQQMsjGNdpIXNzax8YTEAgEQgIIDHjfCGph7-LI6HUj7BFIFc9BtmyPyWVizA7stScqjhwFnTcBqfFJdoJx_3vV-6h_Fko1B8oBYJVz_ZFHXi9vObo4Zh6oiej4FHsM61sMI1aMLf3eUhHmlIVDYYAt3ggUIRYtsqEW75ddX-X9_zdHa3swYDdJ4kKUeRb-zDi1FTfXZpokGiy2M5dqPAwvaOrUs_OQ6N83_n2uJ5ZseeINV9MkWxFqhMo5W8_AccpHYbwUC2n5_cYYgjBUXH8qjTIXQ6fRFCHDILISyb6JExWNPFebG90UFvgo844Q-c1aHmodpFmC3JuU5NDufORun5Xg9xkhUoGZhp1wnhUs1MWm78Iv5HmYaM2i0qsVRwpEuSN11l_4veE6XxDHN-N1Li7HiqHhF6c9DO8mGEM5F6E6YNhC5XDMk9J4B8BHR5gW9s7jcT2Jk8_Ev6NqBW4uB8qA_90rrYeF9pXG64ZpFIS7xDRRKnw7QmK61GCmgPfXFDoheLBB87wUBARItfJC8pGWiFNgXfs7f5I3URS8Q3d7JKMEKppuRDGZTi7e06VbQax0PmmV-LgNHgjOjBq1r0ySERyjRiWR7GoymboaKN-qf5LOuoHI0iQI9n3KgLZz6xECEjMSXnJwHGEl3s3Q72XmgNx8ymx7ufegVQiMnLLOwwpNdd0mpcX070c8W3VmAcLNPhBxR9FtOQsBX10c5emmzIOGOlavQxf1G_UyxhazxGKaqgUnIw3WJ-XPBGhTH0lMBe8lAsyQLfVxvyTlEsSOcjoxW4QmBX8k_u67zF17BHaOLCcU-zN9N1XDxor9q7K6Rzb_6sRJ4vMLtKndduTpWTdaSJpInedHjPfy0UDXw2vfJ0nElhImRNR2qjHOnVDQ6vFdOcJ8pOcu4eSYOhp-5RKWCiopRIQfUhjgdEdpDLm-c9Ldbaul2c-8UTNBMxS63qbzX47qV9Qn3ZUVNEQrWAJvMcUm1yy75HsBacH1vDlHuFCErpSty-ybQUTrHBYYZKplDPZjEhbtGupEYLUXcg9_u67jyOJsMLz8XTHpFRrB_xMDeFphRlmBS8SHlag","The spatial distribution of pulvinar neurons that project to two subregions of the inferior parietal lobule in the macaque"
"10.1006/taap.1995.1193",,,"https://www.sciencedirect.com/science/article/pii/S0041008X85711933",,"Demethylation of methyl mercury in different brain sites of Macaca-fascicularis monkeys during long-term subclinical methyl mercury exposure"
"10.1016/0304-3940(95)12056-a",,,"https://www.sciencedirect.com/science/article/pii/030439409512056A",,"Prefrontal cortex projections to the basilar pons in rhesus monkey: implications for the cerebellar contribution to higher function"
"10.1002/cne.901440105",,,"https://onlinelibrary.wiley.com/doi/abs/10.1002/cne.901440105","https://onlinelibrary.wiley.com/doi/pdf/10.1002/cne.901440105","Nigrostriatal and nigrothalamic fibers in the rhesus monkey"
"10.1016/j.neuroscience.2009.04.034",,,"https://www.sciencedirect.com/science/article/pii/S0306452209006411",,"Laminar and modular organization of prefrontal projections to multiple thalamic nuclei"
"10.1016/b978-0-08-017007-7.50009-4",,,"https://www.sciencedirect.com/science/article/pii/B9780080170077500094",,"Idea of a new anatomy of the thalamus"
"10.1002/cne.22078",,,"https://onlinelibrary.wiley.com/doi/abs/10.1002/cne.22078","https://onlinelibrary.wiley.com/doi/pdf/10.1002/cne.22078","Selective reduction of neuron number and volume of the mediodorsal nucleus of the thalamus in macaques following irradiation at early gestational ages"
"10.1007/pl00005713",,,"https://link.springer.com/article/10.1007/PL00005713","https://link.springer.com/content/pdf/10.1007/PL00005713.pdf","Thalamic and temporal cortex input to medial prefrontal cortex in rhesus monkeys"
"10.1126/science.1114317",,,"https://www.science.org/doi/abs/10.1126/science.1114317","https://www.science.org/doi/pdf/10.1126/science.1114317","Basal forebrain and hypothalamic connection to frontal and parietal cortex in the Rhesus monkey"
"10.1093/cercor/13.1.15",,,"https://academic.oup.com/cercor/article/13/1/15/354634",,"Anatomical substrates for functional columns in macaque monkey primary visual cortex"
"10.1002/(sici)1096-9861(19970526)382:1<89::aid-cne6>3.0.co;2-g",,,"https://onlinelibrary.wiley.com/doi/abs/10.1002/(SICI)1096-9861(19970526)382:1%3C89::AID-CNE6%3E3.0.CO;2-G","https://onlinelibrary.wiley.com/doi/pdf/10.1002/(SICI)1096-9861(19970526)382:1%3C89::AID-CNE6%3E3.0.CO;2-G","Serial and parallel processing in rhesus monkey auditory cortex"
"10.1016/0006-8993(78)91103-4",,,"https://www.sciencedirect.com/science/article/pii/0006899378911034",,"Prenatal removal of frontal association cortex in the fetal rhesus monkey: anatomical and functional consequences in postnatal life"
"10.1073/pnas.97.22.11829",,,"https://www.pnas.org/doi/abs/10.1073/pnas.97.22.11829",,"Spatial processing in the auditory cortex of the macaque monkey"
"10.1007/978-1-4615-1235-6_7",,,"https://link.springer.com/chapter/10.1007/978-1-4615-1235-6_7",,"Neuroanatomical organization and connections of the motor thalamus in primates"
"10.1093/cercor/bhn228",,,"https://academic.oup.com/cercor/article/19/9/2025/279495",,"The thalamocortical projection systems in primate: an anatomical support for multisensory and sensorimotor interplay"
"10.1523/JNEUROSCI.1724-21.2021",,,"https://www.jneurosci.org/content/42/6/1068.abstract","https://www.jneurosci.org/content/jneuro/42/6/1068.full.pdf","Pathways for memory, cognition and emotional context: hippocampal, subgenual area 25, and amygdalar axons show unique interactions in the primate thalamic …"
"10.1016/S0960-9822(00)00043-9",,,"https://www.cell.com/fulltext/S0960-9822(00)00043-9",,"Independent parcellation of the embryonic visual cortex and thalamus revealed by combinatorial Eph/ephrin gene expression"
"10.1007/bf00237587",,,"https://link.springer.com/article/10.1007/BF00237587","https://link.springer.com/content/pdf/10.1007/BF00237587.pdf","Direct retinal pathways to the limbic thalamus of the monkey"
"10.1002/cne.902770209",,,"https://onlinelibrary.wiley.com/doi/abs/10.1002/cne.902770209","https://onlinelibrary.wiley.com/doi/pdf/10.1002/cne.902770209","Basal forebrain cholinergic and noncholinergic projections to the thalamus and brainstem in cats and monkeys"
"10.1046/j.1460-9568.2000.00262.x",,,"https://onlinelibrary.wiley.com/doi/abs/10.1046/j.1460-9568.2000.00262.x","https://onlinelibrary.wiley.com/doi/pdf/10.1046/j.1460-9568.2000.00262.x","Localization of nAChR subunit mRNAs in the brain of Macaca mulatta"
"10.1523/JNEUROSCI.04-02-00539.1984",,,"https://www.jneurosci.org/content/4/2/539.short","https://www.jneurosci.org/content/jneuro/4/2/539.full.pdf","The origin of thalamic inputs to the arcuate premotor and supplementary motor areas"
"10.1002/cne.902400103",,,"https://onlinelibrary.wiley.com/doi/abs/10.1002/cne.902400103","https://onlinelibrary.wiley.com/doi/pdf/10.1002/cne.902400103","Connections of area 2 of somatosensory cortex with the anterior pulvinar and subdivisions of the ventroposterior complex in macaque monkeys"
,8337932,,"https://europepmc.org/article/med/8337932",,"The degree of GABA immunoreactivity is related to neuronal size in the thalamic reticular nucleus of the Japanese monkey, Macaca fuscata."
"10.1073/pnas.1008054107",,,"https://www.pnas.org/doi/abs/10.1073/pnas.1008054107",,"Network architecture of the long-distance pathways in the macaque brain"
"10.1002/cne.903350205",,,"https://onlinelibrary.wiley.com/doi/abs/10.1002/cne.903350205","https://onlinelibrary.wiley.com/doi/pdf/10.1002/cne.903350205","Ipsilateral cortical projections to areas 3a, 3b, and 4 in the macaque monkey"
"10.1016/S0166-2236(99)01482-4",,,"https://www.cell.com/trends/neurosciences/fulltext/S0166-2236(99)01482-4","https://ruc.udc.es/dspace/bitstream/handle/2183/14590/Grieve_Primate.pdf?sequence=5","The primate pulvinar nuclei: vision and action"
"10.3389/fnsys.2015.00039",,,"https://www.frontiersin.org/articles/10.3389/fnsys.2015.00039/full",,"The cognitive thalamus"
"10.1038/nature07382",,,"https://www.nature.com/articles/nature07382",,"Guarding the gateway to cortex with attention in visual thalamus"
"10.1016/0006-8993(75)90079-7",,,,,"Subcortical afferents to the frontal lobe in the rhesus monkey studied by means of retrograde horseradish peroxidase transport"
"10.1523/JNEUROSCI.5511-05.2006",,,"https://www.jneurosci.org/content/26/28/7348.short","https://www.jneurosci.org/content/jneuro/26/28/7348.full.pdf","Prefrontal projections to the thalamic reticular nucleus form a unique circuit for attentional mechanisms"
"10.1002/cne.903350106",,,"https://onlinelibrary.wiley.com/doi/abs/10.1002/cne.903350106","https://onlinelibrary.wiley.com/doi/pdf/10.1002/cne.903350106","Subcortical connections of inferior temporal areas TE and TEO in macaque monkeys"
"10.1016/s0079-6123(02)36031-x",,,"https://www.sciencedirect.com/science/article/pii/S007961230236031X","https://www.cns.nyu.edu/~tony/vns/readings/angelucci-levitt-lund-2002.pdf","Anatomical origins of the classical receptive field and modulatory surround field of single neurons in macaque visual cortical area V1"
,,,,"https://journals.physiology.org/doi/pdf/10.1152/jn.1953.16.5.499","Cortical organization in gustation (Macaca mulatta)"
"10.1016/b978-0-08-042274-9.50017-1",,,"https://www.sciencedirect.com/science/article/pii/B9780080422749500171",,"Neuron populations in sensorimotor thalamic space: Connections, parcellation, and relation to corticospinal projections in the macaque monkey"
"10.1016/0006-8993(77)90474-7",,,"https://www.sciencedirect.com/science/article/pii/0006899377904747",,"Heterogeneous afferents to the inferior parietal lobule of the rhesus monkey revealed by the retrograde transport method"
,,,,"https://journals.physiology.org/doi/pdf/10.1152/jn.1981.45.1.59","Thalamic input to areas 3a and 2 in monkeys."
"10.1007/s00429-015-1091-y",,,"https://link.springer.com/article/10.1007/s00429-015-1091-y",,"The origins of thalamic inputs to grasp zones in frontal cortex of macaque monkeys"
"10.1016/0006-8993(79)90240-3",,,"https://www.sciencedirect.com/science/article/pii/0006899379902403",,"Organization of somatic thalamus in monkeys with and without section of dorsal spinal tracts"
"10.1016/0006-8993(77)90090-7",,,"https://www.sciencedirect.com/science/article/pii/0006899377900907",,"Morphological organization of catecholamine terminals in the diencephalon of the rhesus monkey"
"10.1002/cne.903110402",,,"https://onlinelibrary.wiley.com/doi/abs/10.1002/cne.903110402","https://onlinelibrary.wiley.com/doi/pdf/10.1002/cne.903110402","Architecture of superior and mesial area 6 and the adjacent cingulate cortex in the macaque monkey"
"10.1007/978-1-349-11597-6_12",,,"https://link.springer.com/chapter/10.1007/978-1-349-11597-6_12",,"Distribution of thalamic input to the sensorimotor cortex of the macaque monkey"
"10.1016/0306-4522(91)90151-d",,,"https://www.sciencedirect.com/science/article/pii/030645229190151D",,"Restricted cortical termination fields of the midline and intralaminar thalamic nuclei in the rat"
"10.1002/cne.902170307",,,"https://onlinelibrary.wiley.com/doi/abs/10.1002/cne.902170307","https://onlinelibrary.wiley.com/doi/pdf/10.1002/cne.902170307","… retinorecipient and nonretinorecipient nuclei of the pretectal complex and layers of the superior colliculus to the lateral pulvinar and medial pulvinar in the macaque …"
"10.1038/387281a0",,,"https://www.nature.com/articles/387281a0","https://www.nature.com/articles/387281a0.pdf","Dynamics of orientation tuning in macaque primary visual cortex"
"10.1002/cne.901680204",,,"https://onlinelibrary.wiley.com/doi/abs/10.1002/cne.901680204","https://onlinelibrary.wiley.com/doi/pdf/10.1002/cne.901680204","The posterior thalamic region and its cortical projection in New World and Old World monkeys"
"10.1371/journal.pone.0000848",,,"https://journals.plos.org/plosone/article?id=10.1371/journal.pone.0000848",,"Parallel driving and modulatory pathways link the prefrontal cortex and thalamus"
"10.1176/appi.ajp.160.6.1100",,,"https://ajp.psychiatryonline.org/doi/full/10.1176/appi.ajp.160.6.1100","https://ajp.psychiatryonline.org/doi/pdf/10.1176/appi.ajp.160.6.1100","Altered transcript expression of NMDA receptor-associated postsynaptic proteins in the thalamus of subjects with schizophrenia"
"10.1016/0165-0173(94)00007-c",,,"https://www.sciencedirect.com/science/article/pii/016501739400007C",,"Functional anatomy of the basal ganglia. I. The cortico-basal ganglia-thalamo-cortical loop"
"10.1007/978-1-4899-0194-1_3",,,"https://link.springer.com/chapter/10.1007/978-1-4899-0194-1_3",,"The basal ganglia-thalamo-cortical connections with special reference to output neuronal distributions in macaque monkeys"
"10.1016/b978-0-08-042274-9.50021-3",,,"https://www.sciencedirect.com/science/article/pii/B9780080422749500213",,"Cortical projections of motor thalamus"
"10.1016/s0361-9230(96)00107-4",,,"https://www.sciencedirect.com/science/article/pii/S0361923096001074",,"GABAergic neurons in mammalian thalamus: a marker of thalamic complexity?"
"10.1016/0014-4886(70)90196-2",,,"https://www.sciencedirect.com/science/article/pii/0014488670901962",,"Projections from the body of the caudate nucleus in the rhesus monkey"
"10.1002/cne.901680203",,,"https://onlinelibrary.wiley.com/doi/abs/10.1002/cne.901680203","https://onlinelibrary.wiley.com/doi/pdf/10.1002/cne.901680203","Areal differences in the laminar distribution of thalamic afferents in cortical fields of the insular, parietal and temporal regions of primates"
"10.1046/j.1460-9568.1999.00672.x",,,"https://onlinelibrary.wiley.com/doi/abs/10.1046/j.1460-9568.1999.00672.x","https://onlinelibrary.wiley.com/doi/pdf/10.1046/j.1460-9568.1999.00672.x","Architecture and connections of retrosplenial area 30 in the rhesus monkey (Macaca mulatta)."
"10.1093/cercor/bhl067",,,"https://academic.oup.com/cercor/article/17/7/1561/404540",,"Functional anatomy and interaction of fast and slow visual pathways in macaque monkeys"
"10.1002/cne.902540403",,,"https://onlinelibrary.wiley.com/doi/abs/10.1002/cne.902540403","https://onlinelibrary.wiley.com/doi/pdf/10.1002/cne.902540403","Afferent and efferent connections of the dorsolateral precentral gyrus (area 4, hand/arm region) in the macaque monkey, with comparisons to area 8"
"10.1093/cercor/bhv063",,,"https://academic.oup.com/cercor/article/25/11/4477/2367339",,"White matter connectivity of the thalamus delineates the functional architecture of competing thalamocortical systems"
"10.1016/0306-4522(84)90163-5",,,"https://www.sciencedirect.com/science/article/pii/0306452284901635",,"Atlas of cholinergic neurons in the forebrain and upper brainstem of the macaque based on monoclonal choline acetyltransferase immunohistochemistry and …"
"10.1016/0306-4522(88)90339-9",,,"https://www.sciencedirect.com/science/article/pii/0306452288903399",,"Organization of the afferent connections of the mediodorsal thalamic nucleus in the rat, related to the mediodorsal-prefrontal topography"
"10.1002/cne.901900406",,,"https://onlinelibrary.wiley.com/doi/abs/10.1002/cne.901900406","https://onlinelibrary.wiley.com/doi/pdf/10.1002/cne.901900406","Topographical organization of ascending cerebellar projections from the dentate and interposed nuclei in Macaca mulatta: An anterograde degeneration study"
"10.1523/JNEUROSCI.11-09-02644.1991",,,"https://www.jneurosci.org/content/11/9/2644.short","https://www.jneurosci.org/content/jneuro/11/9/2644.full.pdf","The origin of thalamic inputs to the"" hand"" representation in the primary motor cortex"
"10.1002/cne.901690307",,,"https://onlinelibrary.wiley.com/doi/abs/10.1002/cne.901690307","https://onlinelibrary.wiley.com/doi/pdf/10.1002/cne.901690307","Areal and laminar distribution of some pulvinar cortical efferents in rhesus monkey"
"10.1002/cne.902190405",,,"https://onlinelibrary.wiley.com/doi/abs/10.1002/cne.902190405","https://onlinelibrary.wiley.com/doi/pdf/10.1002/cne.902190405","Transient cholinesterase staining in the mediodorsal nucleus of the thalamus and its connections in the developing human and monkey brain"
"10.1002/nbm.2789",,,"https://analyticalsciencejournals.onlinelibrary.wiley.com/doi/abs/10.1002/nbm.2789","https://analyticalsciencejournals.onlinelibrary.wiley.com/doi/pdf/10.1002/nbm.2789","Longitudinal 1H MRS assessment of the thalamus in a Coriaria lactone‐induced rhesus monkey status epilepticus model"
"10.1176/appi.ajp.158.9.1393",,,"https://ajp.psychiatryonline.org/doi/full/10.1176/appi.ajp.158.9.1393",,"Expression of excitatory amino acid transporter transcripts in the thalamus of subjects with schizophrenia"
,,,,"https://journals.physiology.org/doi/pdf/10.1152/jn.1974.37.1.119","Differential contributions of spinal pathways to body representation in postcentral gyrus of Macaca mulatta."
"10.1002/cne.903630408",,,"https://onlinelibrary.wiley.com/doi/abs/10.1002/cne.903630408","https://onlinelibrary.wiley.com/doi/pdf/10.1002/cne.903630408","Limbic connections of the orbital and medial prefrontal cortex in macaque monkeys"
"10.1126/science.282.5391.1121",,,"https://www.science.org/doi/abs/10.1126/science.282.5391.1121","https://www.science.org/doi/pdf/10.1126/science.282.5391.1121","Thalamic and brainstem contributions to large-scale plasticity of primate somatosensory cortex"
"10.1073/pnas.0507729103",,,"https://www.pnas.org/doi/abs/10.1073/pnas.0507729103",,"Neural connections of the posteromedial cortex in the macaque"
,,,,"https://journals.physiology.org/doi/pdf/10.1152/jn.1938.1.2.176","The direct functional interrelation of sensory cortex and optic thalamus"
"10.1152/jn.1998.79.6.3143",,,"https://journals.physiology.org/doi/abs/10.1152/jn.1998.79.6.3143",,"A role for the dorsal column in nociceptive visceral input into the thalamus of primates"
"10.1038/34584",,,"https://www.nature.com/articles/34584",,"Constraints on cortical and thalamic projections: the no-strong-loops hypothesis"
"10.1016/0165-0173(83)90014-0",,,"https://www.sciencedirect.com/science/article/pii/0165017383900140",,"Cytoarchitectonic delineation of the ventral lateral thalamic region in the monkey"
"10.1113/jphysiol.1990.sp018307",,,"https://physoc.onlinelibrary.wiley.com/doi/abs/10.1113/jphysiol.1990.sp018307","https://www.ncbi.nlm.nih.gov/pmc/articles/PMC1181753/pdf/jphysiol00456-0559.pdf","Vestibular neurones in the parieto‐insular cortex of monkeys (Macaca fascicularis): visual and neck receptor responses."
"10.3171/jns.1997.86.1.0077",,,"https://thejns.org/view/journals/j-neurosurg/86/1/article-p77.xml",,"Toward an agreement on terminology of nuclear and subnuclear divisions of the motor thalamus"
"10.1002/cne.1340",,,"https://onlinelibrary.wiley.com/doi/abs/10.1002/cne.1340","https://onlinelibrary.wiley.com/doi/pdf/10.1002/cne.1340","Two types of projection neurons in the internal pallidum of primates: single‐axon tracing and three‐dimensional reconstruction"
"10.1016/0306-4522(84)90166-0",,,"https://www.sciencedirect.com/science/article/pii/0306452284901660",,"Dual pathways connecting the dorsolateral prefrontal cortex with the hippocampal formation and parahippocampal cortex in the rhesus monkey"
"10.1002/cne.903260308",,,"https://onlinelibrary.wiley.com/doi/abs/10.1002/cne.903260308","https://onlinelibrary.wiley.com/doi/pdf/10.1002/cne.903260308","Thalamic connections of the vestibular cortical fields in the squirrel monkey (Saimiri sciureus)"
"10.1016/j.neubiorev.2015.03.001",,,"https://www.sciencedirect.com/science/article/pii/S0149763415000718",,"The mediodorsal thalamus as a higher order thalamic relay nucleus important for learning and decision-making"
"10.1016/s0306-4522(00)00368-7",,,"https://www.sciencedirect.com/science/article/pii/S0306452200003687",,"Functional plasticity in primate somatosensory thalamus following chronic lesion of the ventral lateral spinal cord"
