10.1159/000456658,28343228,PMC5519439,,,Focal Brain Injury Associated with a Model of Severe Hypoxic-Ischemic Encephalopathy in Nonhuman Primates.,,
10.1002/cne.21919,19105198,PMC3292218,,,Developmentally regulated and evolutionarily conserved expression of SLITRK1 in brain circuits implicated in Tourette syndrome.,,
10.3389/fnmol.2022.1071719,36583080,PMC9792990,,,Neonatal oxytocin gives the tempo of social and feeding behaviors.,,
10.7759/cureus.10436,33072446,PMC7557112,,,Cannabinoid Receptors and Their Relationship With Chronic Pain: A Narrative Review.,,
10.3389/fnana.2021.746057,34744642,PMC8564400,,,Interpreting the Entire Connectivity of Individual Neurons in Micropatterned Neural Culture With an Integrated Connectome Analyzer of a Neuronal Network (iCANN).,,
10.1111/cns.12333,25312583,PMC6495198,,,The relevance of human fetal subplate zone for developmental neuropathology of neuronal migration disorders and cortical dysplasia.,,
10.1002/cne.23907,26399201,PMC4747840,,,Ultrastructure of geniculocortical synaptic connections in the tree shrew striate cortex.,,
10.1016/j.nbd.2018.08.002,30086388,,,,Spike discharge characteristic of the caudal mesencephalic reticular formation and pedunculopontine nucleus in MPTP-induced primate model of Parkinson disease.,,
10.3390/bs7020029,28475130,PMC5485459,,,Universal Connection through Art: Role of Mirror Neurons in Art Production and Reception.,,
10.1080/01658107.2016.1217028,27928407,PMC5122972,,,Vergence Neural Pathways: A Systematic Narrative Literature Review.,,
10.1111/cns.12844,29582587,PMC5875736,,,Disrupted striatal neuron inputs and outputs in Huntington's disease.,,
10.1152/jn.01129.2015,27582298,PMC5116485,,,"Robust modulation of arousal regulation, performance, and frontostriatal activity through central thalamic deep brain stimulation in healthy nonhuman primates.",,
10.1038/s41467-023-36555-4,36918567,PMC10015009,,,Working memory control dynamics follow principles of spatial computing.,,
,28690447,PMC5480854,,,The Missing Manuscript of Dr. Jose Delgado's Radio Controlled Bulls.,,
10.1038/s42003-023-04803-4,37311857,PMC10262152,,,From fossils to mind.,,
10.1007/s00429-020-02080-z,32415413,PMC7270985,,,Perspectives given by structural connectivity bridge the gap between structure and function.,,
10.3390/cells11213476,36359871,PMC9655836,,,Stem-Cell-Based Therapy: The Celestial Weapon against Neurological Disorders.,,
10.3389/fnins.2018.00475,30061809,PMC6054994,,,"Rhesus Monkeys (<i>Macaca mulatta</i>) Sense Isochrony in Rhythm, but Not the Beat: Additional Support for the Gradual Audiomotor Evolution Hypothesis.",,
10.1093/cercor/bhp077,19447861,PMC2792186,,,Functional organization of the somatosensory cortical layer 6 feedback to the thalamus.,,
10.1038/s42003-022-04109-x,36329176,PMC9633704,,,The complexity of the stream of consciousness.,,
10.1007/s00213-021-05793-z,33594504,PMC8177744,,,Alprazolam-induced EEG spectral power changes in rhesus monkeys: a translational model for the evaluation of the behavioral effects of benzodiazepines.,,
10.2147/eb.s51817,25774086,PMC4356996,,,Metabotropic glutamate receptor 5 shows different patterns of localization within the parallel visual pathways in macaque and squirrel monkeys.,,
10.1016/j.media.2019.101543,31670139,PMC6935166,,,Mitigating gyral bias in cortical tractography via asymmetric fiber orientation distributions.,,
10.1002/dneu.22878,35427439,PMC9119968,,,Characterization of neurological disease progression in a canine model of CLN5 neuronal ceroid lipofuscinosis.,,
10.3389/fnint.2019.00032,31396059,PMC6664014,,,The Role of Neuronal Oscillations in Visual Active Sensing.,,
10.1523/jneurosci.22-18-08117.2002,12223566,PMC6758100,,,"Thalamic relay nuclei of the basal ganglia form both reciprocal and nonreciprocal cortical connections, linking multiple frontal cortical areas.",,
10.1016/j.mri.2016.10.019,27989909,,,,Altered regional homogeneity of brain spontaneous signals in SIV infected rhesus macaque model.,,
10.3389/fncel.2022.1095787,36687522,PMC9853061,,,Burning the candle at both ends: Intraretinal signaling of intrinsically photosensitive retinal ganglion cells.,,
10.1016/j.neuroimage.2022.118989,35151851,PMC8940652,,,Longitudinal assessment of early-life white matter development with quantitative relaxometry in nonhuman primates.,,
10.1038/s41398-021-01629-8,34593760,PMC8482959,,,"Neuropsychiatric manifestations of COVID-19, potential neurotropic mechanisms, and therapeutic interventions.",,
10.3390/life12050640,35629308,PMC9143229,,,Modulation by Estradiol of L-Dopa-Induced Dyskinesia in a Rat Model of Post-Menopausal Hemiparkinsonism.,,
10.3389/fnagi.2020.00267,33005147,PMC7479213,,,Age-Related Regional Network Covariance of Magnetic Resonance Imaging Gray Matter in the Rat.,,
10.1016/j.ymthe.2019.07.017,31420242,PMC6838922,,,AAV-PHP.B Administration Results in a Differential Pattern of CNS Biodistribution in Non-human Primates Compared with Mice.,,
,,PMC7208347,,,SUN-035 A Role for GNRH-II in the Control of Puberty?,,
10.1093/cercor/bhac085,35235642,PMC9890474,,,"The human vestibular cortex: functional anatomy of OP2, its connectivity and the effect of vestibular disease.",,
10.1038/s42003-021-01804-z,33664430,PMC7933420,,,The posterior parietal cortex contributes to visuomotor processing for saccades in blindsight macaques.,,
10.1007/s11259-020-09778-9,32651761,PMC7348560,,,"Infectivity, virulence, pathogenicity, host-pathogen interactions of SARS and SARS-CoV-2 in experimental animals: a systematic review.",,
10.1159/000481085,29065406,PMC5687995,,,Midsagittal Brain Variation among Non-Human Primates: Insights into Evolutionary Expansion of the Human Precuneus.,,
10.1021/acschemneuro.8b00183,29763549,PMC6249062,,,Development of Positron Emission Tomography Radiotracers for the GABA Transporter 1.,,
10.1016/j.toxrep.2023.02.014,36923444,PMC10009680,,,"Safety, pharmacokinetics and CNS distribution of tralesinidase alfa administered via intracerebroventricular infusion to juvenile cynomolgus monkeys.",,
10.1186/s12917-021-02745-9,33455577,PMC7812730,,,Aquaporin-4 protein expression in normal canine brains.,,
10.1186/s13041-021-00755-0,33832520,PMC8034164,,,Phosphorylation of GAP-43 T172 is a molecular marker of growing axons in a wide range of mammals including primates.,,
10.1016/j.neuron.2015.05.040,26087167,PMC4534089,,,Optogenetic Activation of Normalization in Alert Macaque Visual Cortex.,,
10.1007/s00702-017-1713-z,28324169,PMC5608633,,,Roles of centromedian parafascicular nuclei of thalamus and cholinergic interneurons in the dorsal striatum in associative learning of environmental events.,,
10.1038/s41398-018-0178-7,30013068,PMC6048172,,,Serotonin concentration enhancers at clinically relevant doses reduce [<sup>11</sup>C]AZ10419369 binding to the 5-HT<sub>1B</sub> receptors in the nonhuman primate brain.,,
10.1038/s41598-020-67752-6,32632196,PMC7338380,,,Histological assessment of optogenetic tools to study fronto-visual and fronto-parietal cortical networks in the rhesus macaque.,,
10.3390/e21030308,33267023,PMC7514789,,,The Understanding Capacity and Information Dynamics in the Human Brain.,,
10.4137/jen.s40197,27578996,PMC4991577,,,Plasticity and Recovery After Dorsal Column Spinal Cord Injury in Nonhuman Primates.,,
10.1016/j.tins.2021.09.001,34654556,PMC9087306,,,50 years of mnemonic persistent activity: quo vadis?,,
10.3389/fpsyt.2019.01016,32047448,PMC6997554,,,"Sensory Abnormalities in Autism Spectrum Disorders: A Focus on the Tactile Domain, From Genetic Mouse Models to the Clinic.",,
10.1038/s41434-022-00380-z,36635457,PMC10284706,,,Improving adeno-associated viral (AAV) vector-mediated transgene expression in retinal ganglion cells: comparison of five promoters.,,
10.3389/fnins.2014.00077,24795553,PMC3997038,,,"Specialized prefrontal ""auditory fields"": organization of primate prefrontal-temporal pathways.",,
10.3389/fnbeh.2020.548856,33328917,PMC7732428,,,Repetitive Religious Chanting Invokes Positive Emotional Schema to Counterbalance Fear: A Multi-Modal Functional and Structural MRI Study.,,
10.1016/j.neuron.2020.06.035,32707082,PMC7529949,,,Neural Stem Cells Direct Axon Guidance via Their Radial Fiber Scaffold.,,
10.1093/ons/opy261,30260428,PMC6887702,,,A Connectomic Atlas of the Human Cerebrum-Chapter 7: The Lateral Parietal Lobe.,,
10.1002/cne.24087,27490949,PMC5177538,,,Cholinergic profiles in the Goettingen miniature pig (Sus scrofa domesticus) brain.,,
10.1523/jneurosci.5511-05.2006,16837581,PMC6674204,,,Prefrontal projections to the thalamic reticular nucleus form a unique circuit for attentional mechanisms.,,
10.7554/elife.83971,37204300,PMC10259453,,,Neural dynamics underlying self-control in the primate subthalamic nucleus.,,
10.1016/j.neures.2017.10.009,29111135,,,,Digital gene atlas of neonate common marmoset brain.,,
10.3389/fphys.2021.624317,33889086,PMC8055937,,,Coordinated Reset Vibrotactile Stimulation Induces Sustained Cumulative Benefits in Parkinson's Disease.,,
10.1007/s00702-018-1849-5,29423879,PMC5826894,,,Non-human primate research of basal ganglia and movement disorders: advances and challenges.,,
10.3389/fncir.2017.00027,28487637,PMC5404610,,,"Silencing ""Top-Down"" Cortical Signals Affects Spike-Responses of Neurons in Cat's ""Intermediate"" Visual Cortex.",,
10.1002/brb3.2037,33438834,PMC8035470,,,"Cortical morphometric changes associated with completeness, level, and duration of spinal cord injury in humans: A case-control study.",,
10.1038/s41598-021-91391-0,34083732,PMC8175342,,,Electrical stimulation of the nucleus basalis of meynert: a systematic review of preclinical and clinical data.,,
10.3389/fnsys.2018.00070,30687030,PMC6335321,,,A Key Role for Subiculum-Fornix Connectivity in Recollection in Older Age.,,
10.1038/s41582-023-00809-y,37198436,PMC10191412,,,Single-cell and spatial transcriptomics: deciphering brain complexity in health and disease.,,
10.1093/cercor/bhv277,26620266,PMC5890908,,,Intrinsic Connections of the Core Auditory Cortical Regions and Rostral Supratemporal Plane in the Macaque Monkey.,,
10.3389/fncir.2021.696060,34366794,PMC8334735,,,Persistent Activity During Working Memory From Front to Back.,,
10.7554/elife.57484,32915134,PMC7521927,,,Neural variability determines coding strategies for natural self-motion in macaque monkeys.,,
10.1016/j.neuroscience.2017.06.052,28687313,PMC6063080,,,Two different mirror neuron networks: The sensorimotor (hand) and limbic (face) pathways.,,
10.3389/fnana.2022.809446,35185482,PMC8854186,,,Conservation of the Direct and Indirect Pathway Dichotomy in Mouse Caudal Striatum With Uneven Distribution of Dopamine Receptor D1- and D2-Expressing Neurons.,,
10.1017/s0952523817000050,28965504,PMC6050011,,,The mouse pulvinar nucleus: Organization of the tectorecipient zones.,,
10.1002/cne.24445,29658111,PMC5990457,,,Architectonic characteristics of the visual thalamus and superior colliculus in titi monkeys.,,
10.1016/j.resuscitation.2010.03.030,20418008,PMC2893290,,,Evolution of Somatosensory Evoked Potentials after Cardiac Arrest induced hypoxic-ischemic injury.,,
10.3389/fnana.2011.00025,21519390,PMC3078748,,,Hypothesis on the dual origin of the Mammalian subplate.,,
10.3389/fnsys.2022.885304,35707745,PMC9190244,,,Future Directions for Chemosensory Connectomes: Best Practices and Specific Challenges.,,
10.1523/jneurosci.1306-19.2019,31969490,PMC6975298,,,Diverse Spatiotemporal Scales of Cholinergic Signaling in the Neocortex.,,
10.3390/cells10010190,33477896,PMC7833373,,,White Matter Interstitial Neurons in the Adult Human Brain: 3% of Cortical Neurons in Quest for Recognition.,,
10.1007/s00259-017-3621-8,28120003,PMC5400702,,,"PET imaging of α<sub>7</sub> nicotinic acetylcholine receptors: a comparative study of [<sup>18</sup>F]ASEM and [<sup>18</sup>F]DBT-10 in nonhuman primates, and further evaluation of [<sup>18</sup>F]ASEM in humans.",,
10.1016/j.nucmedbio.2012.09.009,23141552,PMC3514651,,,"Nicotinic α4β2 receptor imaging agents. Part IV. Synthesis and biological evaluation of 3-(2-(S)-3,4-dehydropyrrolinyl methoxy)-5-(3'-¹⁸F-fluoropropyl)pyridine (¹⁸F-Nifrolene) using PET.",,
10.1002/cne.23937,26715195,PMC4860035,,,Human-specific increase of dopaminergic innervation in a striatal region associated with speech and language: A comparative analysis of the primate basal ganglia.,,
10.3389/fmed.2021.688486,34222292,PMC8253308,,,The Enterovirus Theory of Disease Etiology in Myalgic Encephalomyelitis/Chronic Fatigue Syndrome: A Critical Review.,,
10.1038/s41598-019-38833-y,30816142,PMC6395775,,,Reward cues readily direct monkeys' auditory performance resulting in broad auditory cortex modulation and interaction with sites along cholinergic and dopaminergic pathways.,,
10.1007/s00018-016-2264-4,27193323,PMC5002041,,,Inhibitory interneurons in visual cortical plasticity.,,
10.1007/s00401-022-02482-9,35996016,PMC9468132,,,Transmission of cervid prions to humanized mice demonstrates the zoonotic potential of CWD.,,
10.1523/jneurosci.2335-17.2017,29358360,PMC5824744,,,Functional Segmentation of the Anterior Limb of the Internal Capsule: Linking White Matter Abnormalities to Specific Connections.,,
10.1152/jn.01016.2014,26224780,PMC4579293,,,Connectivity between the superior colliculus and the amygdala in humans and macaque monkeys: virtual dissection with probabilistic DTI tractography.,,
10.1152/jn.00997.2014,25673744,PMC4416594,,,Modulation of motor cortex neuronal activity and motor behavior during subthalamic nucleus stimulation in the normal primate.,,
10.3390/jimaging8030076,35324631,PMC8953095,,,"Microsaccades, Drifts, Hopf Bundle and Neurogeometry.",,
10.1038/s41583-018-0013-4,29795133,PMC6432632,,,Specializations for reward-guided decision-making in the primate ventral prefrontal cortex.,,
10.1038/s41531-023-00469-1,36806219,PMC9938150,,,Common and distinct roles of amygdala subregional functional connectivity in non-motor symptoms of Parkinson's disease.,,
10.3389/fnmol.2019.00255,31680859,PMC6813225,,,Is There a Role for GPCR Agonist Radiotracers in PET Neuroimaging?,,
10.1073/pnas.1211168109,23112179,PMC3503233,,,Anatomical evidence for the involvement of medial cerebellar output from the interpositus nuclei in cognitive functions.,,
10.1177/0271678x18797328,30149778,PMC6282216,,,Perinatal hypoxic-ischemic brain injury in large animal models: Relevance to human neonatal encephalopathy.,,
10.1016/j.neubiorev.2022.104522,34995646,PMC8872632,,,Sex differences in opioid receptor mediated effects: Role of androgens.,,
10.1002/mds.28566,33847406,PMC8422942,,,High-Frequency Oscillations in the Pallidum: A Pathophysiological Biomarker in Parkinson's Disease?,,
10.3389/fendo.2023.1150222,37260446,PMC10229096,,,Biological and pharmacological functions of the FGF19- and FGF21-coreceptor beta klotho.,,
10.3389/fnins.2021.684800,34248486,PMC8260987,,,Differences in the Structure and Function of the Vestibular Efferent System Among Vertebrates.,,
10.1016/j.schres.2013.06.024,23830684,PMC3756893,,,Intracortical excitatory and thalamocortical boutons are intact in primary auditory cortex in schizophrenia.,,
10.1002/cne.22078,19459221,PMC2716797,,,Selective reduction of neuron number and volume of the mediodorsal nucleus of the thalamus in macaques following irradiation at early gestational ages.,,
10.1111/ejn.14076,30019413,PMC6175011,,,In vitro characterization of intrinsic properties and local synaptic inputs to pyramidal neurons in macaque primary motor cortex.,,
,,PMC7742693,,,Mediterranean versus Western diet effects on cerebral cortical thickness and volume in cynomolgus monkeys,,
10.3389/fnint.2022.856207,35391754,PMC8979825,,,The Ecological View of Selective Attention.,,
10.3389/fnhum.2019.00340,31649516,PMC6794422,,,Brainstem Modulation of Large-Scale Intrinsic Cortical Activity Correlations.,,
10.1002/cne.24515,30078198,PMC6506188,,,Cortical projections to the two retinotopic maps of primate pulvinar are distinct.,,
10.1111/j.1460-9568.2010.07420.x,21039953,PMC3058925,,,Central thalamic deep brain stimulation for cognitive neuromodulation - a review of proposed mechanisms and investigational studies.,,
10.1038/sdata.2017.163,29087374,PMC5663209,,,Transcription start site profiling of 15 anatomical regions of the Macaca mulatta central nervous system.,,
10.1089/aid.2014.0029,24697643,PMC3976595,,,TRIM19-positive and TRIM19-negative cells in and around a perivascular cuff of CD68-positive macrophages.,,
10.3390/molecules25040977,32098280,PMC7070523,,,"PET Radiopharmaceuticals for Alzheimer's Disease and Parkinson's Disease Diagnosis, the Current and Future Landscape.",,
10.3389/fncom.2022.836532,35465268,PMC9026167,,,Physics Clues on the Mind Substrate and Attributes.,,
10.1016/j.brs.2014.04.007,24933029,PMC4108508,,,Subthalamic nucleus deep brain stimulation induces motor network BOLD activation: use of a high precision MRI guided stereotactic system for nonhuman primates.,,
10.1016/j.conb.2020.10.004,33227602,PMC7853322,,,Approaches to inferring multi-regional interactions from simultaneous population recordings: Inferring multi-regional interactions from simultaneous population recordings.,,
10.1016/j.cub.2021.09.042,34637748,PMC8612995,,,Distinct recruitment of feedforward and recurrent pathways across higher-order areas of mouse visual cortex.,,
10.1007/s00429-021-02439-w,35113243,PMC9046345,,,Additional fiber orientations in the sagittal stratum-noise or anatomical fine structure?,,
10.1523/jneurosci.5851-11.2012,22457488,PMC6622047,,,The lhx2 transcription factor controls thalamocortical axonal guidance by specific regulation of robo1 and robo2 receptors.,,
10.1038/s41467-017-02815-3,29374172,PMC5786066,,,Subcortical evidence for a contribution of arousal to fMRI studies of brain activity.,,
10.1007/s00204-018-2222-z,29785638,PMC6015623,,,Intermittent convection-enhanced delivery of GDNF into rhesus monkey putamen: absence of local or cerebellar toxicity.,,
10.1093/cercor/bhv019,25715284,PMC4612443,,,Complementary Patterns of Direct Amygdala and Hippocampal Projections to the Macaque Prefrontal Cortex.,,
10.1016/j.neuron.2019.02.030,30946820,PMC6734550,,,Learning How Neurons Fail Inside of Networks: Nonhuman Primates Provide Critical Data for Psychiatry.,,
10.1002/cne.24453,29663384,PMC6191384,,,Cortical connections of area 2 and posterior parietal area 5 in macaque monkeys.,,
10.1038/s41467-018-08058-0,30635570,PMC6329824,,,Dissecting the circuit for blindsight to reveal the critical role of pulvinar and superior colliculus.,,
10.1038/s41467-021-27892-3,35022404,PMC8755737,,,Coding strategy for surface luminance switches in the primary visual cortex of the awake monkey.,,
10.4103/1673-5374.274324,31997796,PMC7059570,,,Large animal ischemic stroke models: replicating human stroke pathophysiology.,,
10.1155/2021/6510383,35003307,PMC8741380,,,Transcranial Ultrasound Stimulation of the Anterior Cingulate Cortex Reduces Neuropathic Pain in Mice.,,
10.3389/fnins.2022.831055,35310095,PMC8930827,,,Consistent Changes in Cortico-Subthalamic Directed Connectivity Are Associated With the Induction of Parkinsonism in a Chronically Recorded Non-human Primate Model.,,
10.1371/journal.pone.0127953,26010745,PMC4444358,,,1-Methyl-4-phenylpyridinium stereotactic infusion completely and specifically ablated the nigrostriatal dopaminergic pathway in rhesus macaque.,,
10.1007/s00429-013-0538-2,23529193,,,,Amygdalar connections of the macaque areas 45A and 45B.,,
10.1073/pnas.1710323115,29339471,PMC5798320,,,Laminar recordings in frontal cortex suggest distinct layers for maintenance and control of working memory.,,
10.1111/jir.12558,30450801,PMC6385863,,,Self-injurious behaviours in rhesus macaques: Potential glial mechanisms.,,
10.1038/s41598-017-15611-2,29127394,PMC5681572,,,Systematic population spike delays across cortical layers within and between primary sensory areas.,,
10.1073/pnas.1604135113,27469163,PMC4995995,,,"Neural mechanisms of transient neocortical beta rhythms: Converging evidence from humans, computational modeling, monkeys, and mice.",,
10.1007/s40122-021-00288-3,34278548,PMC8586130,,,Microglia in the Pathophysiology of Hemorrhagic Stroke and the Relationship Between Microglia and Pain After Stroke: A Narrative Review.,,
10.1038/tp.2012.88,23010765,PMC3565210,,,The associative and limbic thalamus in the pathophysiology of obsessive-compulsive disorder: an experimental study in the monkey.,,
10.3389/fphar.2019.01612,32116664,PMC7020441,,,Alterations of Astrocytes in the Context of Schizophrenic Dementia.,,
10.2967/jnumed.112.103846,22851633,PMC3580212,,,PET imaging of α4β2* nicotinic acetylcholine receptors: quantitative analysis of 18F-nifene kinetics in the nonhuman primate.,,
10.3389/fnsys.2017.00025,28496402,PMC5406748,,,Cortico-Striatal-Thalamic Loop Circuits of the Orbitofrontal Cortex: Promising Therapeutic Targets in Psychiatric Illness.,,
10.1126/sciadv.aba0682,33115731,PMC7608785,,,Genome integrity and neurogenesis of postnatal hippocampal neural stem/progenitor cells require a unique regulator Filia.,,
10.3389/fnana.2018.00036,29867376,PMC5962671,,,The Suprachiasmatic Nucleus and the Intergeniculate Leaflet of the Flat-Faced Fruit-Eating Bat (Artibeus planirostris): Retinal Projections and Neurochemical Anatomy.,,
10.1007/s10162-021-00789-0,34014416,PMC8329114,,,"Visual Influences on Auditory Behavioral, Neural, and Perceptual Processes: A Review.",,
10.1007/s00429-017-1554-4,29143946,PMC5869897,,,Multi-scale account of the network structure of macaque visual cortex.,,
10.1186/s12974-016-0706-4,27596440,PMC5011884,,,Intra-amniotic LPS causes acute neuroinflammation in preterm rhesus macaques.,,
10.1016/j.drugalcdep.2014.01.027,24602361,PMC3992705,,,Changes in the α4β2* nicotinic acetylcholine system during chronic controlled alcohol exposure in nonhuman primates.,,
10.1016/j.conb.2010.08.022,20850966,PMC3025075,,,Basal ganglia contributions to motor control: a vigorous tutor.,,
10.3390/brainsci9060129,31163643,PMC6627335,,,A Focus on the Functions of Area 25.,,
10.1016/j.tins.2017.03.005,28390699,PMC5434457,,,Deciphering Neural Codes of Memory during Sleep.,,
10.1016/j.neulet.2004.01.008,15016432,,,,The dual pattern of corticothalamic projection of the primary auditory cortex in macaque monkey.,,
10.3389/fnins.2020.00156,32184706,PMC7058659,,,Restoring Somatosensation: Advantages and Current Limitations of Targeting the Brainstem Dorsal Column Nuclei Complex.,,
10.3389/fnhum.2021.635611,33859557,PMC8042213,,,Learned Overweight Internal Model Can Be Activated to Maintain Equilibrium When Tactile Cues Are Uncertain: Evidence From Cortical and Behavioral Approaches.,,
10.1007/s00415-018-8828-5,29549469,PMC5937880,,,Why acute unilateral vestibular midbrain lesions rarely manifest with rotational vertigo: a clinical and modelling approach to head direction cell function.,,
10.1002/hbm.25196,32885895,PMC7670637,,,High-gamma oscillations precede visual steady-state responses: A human electrocorticography study.,,
10.1111/ejn.14429,31063250,PMC6777996,,,Ultrastructural localization of DREADDs in monkeys.,,
10.3389/fnins.2018.00180,29628873,PMC5876299,,,Combined rTMS/fMRI Studies: An Overlooked Resource in Animal Models.,,
10.3389/fncom.2022.929348,35874317,PMC9298461,,,Efficient Temporal Coding in the Early Visual System: Existing Evidence and Future Directions.,,
10.1016/j.neuroimage.2020.117479,33099005,PMC8244994,,,"Cortical hierarchy, dual counterstream architecture and the importance of top-down generative networks.",,
10.1016/j.neuroscience.2017.08.022,28842187,PMC5653451,,,Connectome-scale functional intrinsic connectivity networks in macaques.,,
10.1038/s41467-018-08151-4,30644391,PMC6333835,,,The mediodorsal pulvinar coordinates the macaque fronto-parietal network during rhythmic spatial attention.,,
10.3389/fncir.2015.00015,25926774,PMC4396532,,,"A commentary on: ""Cortical and thalamic excitation mediate the multiphasic responses of striatal cholinergic interneurons to motivationally salient stimuli"".",,
10.1016/j.neuroimage.2018.10.005,30291973,PMC6230501,,,"Gustatory responses in macaque monkeys revealed with fMRI: Comments on taste, taste preference, and internal state.",,
10.1016/j.nicl.2021.102906,34891045,PMC8670854,,,Effective connectivity in subcortical visual structures in de novo Patients with Parkinson's Disease.,,
10.3791/55133,28287546,PMC5409292,,,"Large-scale Reconstructions and Independent, Unbiased Clustering Based on Morphological Metrics to Classify Neurons in Selective Populations.",,
10.1002/cphy.c170021,32163202,PMC9255899,,,Anatomical Markers of Activity in Hypothalamic Neurons.,,
10.1074/jbc.ra119.010027,31492750,PMC6816094,,,Phosphorylation of the HCN channel auxiliary subunit TRIP8b is altered in an animal model of temporal lobe epilepsy and modulates channel function.,,
10.1093/cercor/bhv135,26088968,,,,"Corticostriate Projections from Areas of the ""Lateral Grasping Network"": Evidence for Multiple Hand-Related Input Channels.",,
10.1016/j.cub.2019.10.008,31794754,PMC8407371,,,Fear: It's All in Your Line of Sight.,,
10.1523/jneurosci.4788-11.2012,22496550,PMC6622108,,,Comparative anatomy of marmoset and mouse cortex from genomic expression.,,
10.1007/s00422-019-00795-9,30820663,PMC6510841,,,Explaining event-related fields by a mechanistic model encapsulating the anatomical structure of auditory cortex.,,
10.1371/journal.pone.0083766,24392094,PMC3879270,,,The gene expression profile of peripheral blood mononuclear cells from EV71-infected rhesus infants and the significance in viral pathogenesis.,,
10.1002/cne.23012,22120205,PMC3812935,,,Using text mining to link journal articles to neuroanatomical databases.,,
10.1186/s13059-020-02074-4,32778141,PMC7419210,,,An evolutionary driver of interspersed segmental duplications in primates.,,
10.1016/j.jneumeth.2015.07.005,26192326,,,,An assumption-free quantification of neural responses to electrical stimulations.,,
