10.1016/0304-3940(96)12319-3,8929980,not found,Crossed thalamo-cortical and cortico-thalamic projections in adult mice,D Carretta,https://linkinghub.elsevier.com/retrieve/pii/0304-3940(96)12319-3,Elsevier Science
10.1016/0304-3940(93)90180-S,7689715,not found,THE RETICULAR THALAMIC NUCLEUS PROJECTS TO THE CONTRALATERAL DORSAL THALAMUS IN MACAQUE MONKEY,D Paré,https://linkinghub.elsevier.com/retrieve/pii/0304-3940(93)90180-S,Elsevier Science
10.1002/cne.903440403,7523458,not found,CONTRALATERAL THALAMIC PROJECTIONS PREDOMINANTLY REACH TRANSITIONAL CORTICES IN THE RHESUS-MONKEY,C R Dermon,https://onlinelibrary.wiley.com/resolve/openurl?genre=article&sid=nlm:pubmed&issn=0021-9967&date=1994&volume=344&issue=4&spage=508,Wiley
10.1111/j.1460-9568.2005.04020.x,15869482,not found,Neurochemical characterization of the cerebellar-recipient motor thalamic territory in the macaque monkey,Roberta Calzavara,https://doi.org/10.1111/j.1460-9568.2005.04020.x,Wiley
10.1016/j.neuropsychologia.2013.11.025,24321272,not found,Multiple thalamo-cortical disconnections in anterior thalamic infarction: Implications for thalamic mechanisms of memory and language,Yoshiyuki Nishio,https://linkinghub.elsevier.com/retrieve/pii/S0028-3932(13)00423-5,Elsevier Science
10.1016/S0028-3908(99)00130-6,10587083,not found,Distribution of GABA(B) binding sites in the thalamus and basal ganglia of the rhesus monkey (Macaca mulatta),N G Bowery,https://linkinghub.elsevier.com/retrieve/pii/S0028390899001306,Elsevier Science
10.1002/nbm.2789,22389048,not found,Longitudinal 1H MRS assessment of the thalamus in a Coriaria lactone-induced rhesus monkey status epilepticus model,Xiao-Yun Zhang,https://doi.org/10.1002/nbm.2789,Wiley
0.0,9407703,not found,Thalamic and amygdaloid connections of the auditory association cortex of the superior temporal gyrus in rhesus monkey (Macaca mulatta),A Kosmal,https://ane.pl/linkout.php?vol=57&no=3&fpp=165,Nencki Institute of Experimental Biology and Polish Neuroscience Society
10.1002/cne.24389,29322527,not found,Thalamo-cortical projections to the macaque superior parietal lobule areas PEc and PE,Daniele Impieri,https://doi.org/10.1002/cne.24389,Wiley
10.1016/0006-8993(94)91125-8,7922539,not found,"PRESERVED FEATURES OF THALAMOCORTICAL PROJECTION NEURON DENDRITIC ARCHITECTURE IN THE SOMATOSENSORY THALAMUS OF THE RAT, CAT AND MACAQUE",P T Ohara,https://linkinghub.elsevier.com/retrieve/pii/0006-8993(94)91125-8,Elsevier Science
0.0,1722758,not found,TOPOGRAPHICAL MAPPING OF THE THALAMOCORTICAL PROJECTIONS IN RODENTS AND COMPARISON WITH THAT IN PRIMATES,J C Höhl-Abrahão,not found,not found
10.1016/j.bandl.2012.10.001,23211411,PMC3615046,Frontal-thalamic circuits associated with language,Helen Barbas,https://www.ncbi.nlm.nih.gov/pmc/articles/PMC3615046/,PMC
10.1113/JP282626,35851953,PMC10087288,"Cortico-thalamocortical interactions for learning, memory and decision-making",Brook A L Perry,https://www.ncbi.nlm.nih.gov/pmc/articles/PMC10087288/,PMC
10.1093/brain/awh551,15947061,not found,Thalamic infarctions cause side-specific suppression of vestibular cortex activations,M Dieterich,https://academic.oup.com/brain/article-lookup/doi/10.1093/brain/awh551,Silverchair Information Systems
10.1016/0891-0618(95)00050-H,7545406,not found,"ACETYLCHOLINESTERASE HISTOCHEMISTRY IN THE MACAQUE THALAMUS REVEALS TERRITORIES SELECTIVELY CONNECTED TO FRONTAL, PARIETAL AND TEMPORAL ASSOCIATION CORTICES",C Cavada,https://linkinghub.elsevier.com/retrieve/pii/089106189500050H,Elsevier Science
10.1007/s00429-020-02045-2,32078035,not found,Thalamic afferents emphasize the different functions of macaque precuneate areas,Michela Gamberini,https://dx.doi.org/10.1007/s00429-020-02045-2,Springer
10.1002/cne.903130106,1761756,not found,DIVERSE THALAMIC PROJECTIONS TO THE PREFRONTAL CORTEX IN THE RHESUS-MONKEY,H Barbas,https://onlinelibrary.wiley.com/resolve/openurl?genre=article&sid=nlm:pubmed&issn=0021-9967&date=1991&volume=313&issue=1&spage=65,Wiley
10.1152/jn.91287.2008,19692504,not found,Substantia Nigra Output to Prefrontal Cortex Via Thalamus in Monkeys. I. Electrophysiological Identification of Thalamic Relay Neurons,Ikuo Tanibuchi,https://journals.physiology.org/doi/10.1152/jn.91287.2008?url_ver=Z39.88-2003&rfr_id=ori:rid:crossref.org&rfr_dat=cr_pub  0pubmed,Atypon
10.1016/0304-3940(94)90853-2,8190351,not found,EXTRACELLULAR SIGNAL-REGULATED KINASE (MAP KINASE) IMMUNOREACTIVITY IN THE RHESUS-MONKEY BRAIN,B T Hyman,https://linkinghub.elsevier.com/retrieve/pii/0304-3940(94)90853-2,Elsevier Science
10.1016/S0006-8993(03)02548-4,12742623,not found,Efferent subcortical projections of the laryngeal motorcortex in the rhesus monkey,Kristina Simonyan,https://linkinghub.elsevier.com/retrieve/pii/S0006899303025484,Elsevier Science
10.1016/j.neubiorev.2015.03.001,25757689,not found,The mediodorsal thalamus as a higher order thalamic relay nucleus important for learning and decision-making,Anna S Mitchell,https://linkinghub.elsevier.com/retrieve/pii/S0149-7634(15)00071-8,Elsevier Science
10.1016/0304-3940(95)11273-Y,7540266,not found,NUCLEUS-RETICULARIS THALAMI INPUT TO THE ANTERIOR THALAMIC NUCLEI IN THE MONKEY - A LIGHT AND ELECTRON-MICROSCOPIC STUDY,K Kultas-Ilinsky,https://linkinghub.elsevier.com/retrieve/pii/030439409511273Y,Elsevier Science
10.3109/08990221003646736,20141408,PMC2839898,Organization and morphology of thalamocortical neurons of mouse ventral lateral thalamus,Aileen P Tlamsa,https://www.ncbi.nlm.nih.gov/pmc/articles/PMC2839898/,PMC
10.1002/cne.903350204,8227513,not found,"THALAMIC PROJECTIONS TO AREA-3A, AREA-3B, AND AREA-4 IN THE SENSORIMOTOR CORTEX OF THE MATURE AND INFANT MACAQUE MONKEY",C Darian-Smith,https://onlinelibrary.wiley.com/resolve/openurl?genre=article&sid=nlm:pubmed&issn=0021-9967&date=1993&volume=335&issue=2&spage=173,Wiley
10.1016/j.neuroimage.2006.07.032,17140815,not found,Distribution of the dopamine innervation in the macaque and human thalamus,Miguel Angel García-Cabezas,https://linkinghub.elsevier.com/retrieve/pii/S1053-8119(06)00760-9,Elsevier Science
10.1111/j.1460-9568.2005.03921.x,15787707,not found,Divergence and convergence of thalamocortical projections to premotor and supplementary motor cortex: a multiple tracing study in the macaque monkey,Anne Morel,https://doi.org/10.1111/j.1460-9568.2005.03921.x,Wiley
10.1002/(SICI)1096-9861(19990621)409:1<131::AID-CNE10>3.0.CO;2-A,10363716,not found,"Origin of thalamic inputs to the primary, premotor, and supplementary motor cortical areas and to area 46 in macaque monkeys: A multiple retrograde tracing study",E M Rouiller,https://onlinelibrary.wiley.com/resolve/openurl?genre=article&sid=nlm:pubmed&issn=0021-9967&date=1999&volume=409&issue=1&spage=131,Wiley
10.1016/0006-8993(94)90641-6,8199853,not found,DENDRITIC ORIENTATION OF THALAMOCORTICAL PROJECTION NEURONS IN THE VENTROBASAL COMPLEX OF MACAQUES,L A Havton,https://linkinghub.elsevier.com/retrieve/pii/0006-8993(94)90641-6,Elsevier Science
0.0,7514207,PMC6577493,MEDIAL LEMNISCAL AND SPINAL PROJECTIONS TO THE MACAQUE THALAMUS - AN ELECTRON-MICROSCOPIC STUDY OF DIFFERING GABAERGIC CIRCUITRY SERVING THALAMIC SOMATOSENSORY MECHANISMS,H J Ralston 3rd,https://www.ncbi.nlm.nih.gov/pmc/articles/PMC6577493/,PMC
0.0,1385203,not found,PALLIDAL INPUTS TO THALAMOCORTICAL NEURONS PROJECTING TO THE SUPPLEMENTARY MOTOR AREA - AN ANTEROGRADE AND RETROGRADE DOUBLE LABELING STUDY IN THE MACAQUE MONKEY,H Tokuno,not found,not found
10.1016/j.neuroimage.2019.01.078,30711468,PMC6506175,Topographic organization of connections between prefrontal cortex and mediodorsal thalamus: Evidence for a general principle of indirect thalamic pathways between directly connected cortical areas,Jessica M Phillips,https://www.ncbi.nlm.nih.gov/pmc/articles/PMC6506175/,PMC
10.1046/j.1460-9568.1999.00672.x,10383640,not found,Architecture and connections of retrosplenial area 30 in the rhesus monkey (macaca mulatta).,R Morris,https://onlinelibrary.wiley.com/resolve/openurl?genre=article&sid=nlm:pubmed&issn=0953-816X&date=1999&volume=11&issue=7&spage=2506,Wiley
10.1523/JNEUROSCI.2344-19.2020,32680937,PMC7424873,Organization of Corollary Discharge Neurons in Monkey Medial Dorsal Thalamus,James Cavanaugh,https://www.ncbi.nlm.nih.gov/pmc/articles/PMC7424873/,PMC
0.0,9067827,not found,Topographic organization of medial pulvinar connections with the prefrontal cortex in the rhesus monkey,L M Romanski,https://onlinelibrary.wiley.com/resolve/openurl?genre=article&sid=nlm:pubmed&issn=0021-9967&date=1997&volume=379&issue=3&spage=313,Wiley
10.1111/j.1460-9568.2007.05773.x,17880392,not found,"Distinct, parallel pathways link the medial mammillary bodies to the anterior thalamus in macaque monkeys",Seralynne D Vann,https://doi.org/10.1111/j.1460-9568.2007.05773.x,Wiley
10.1002/(SICI)1096-9861(19981019)400:2<271::AID-CNE8>3.0.CO;2-6,9766404,not found,Thalamocortical connections of the parabelt auditory cortex in macaque monkeys,T A Hackett,https://onlinelibrary.wiley.com/resolve/openurl?genre=article&sid=nlm:pubmed&issn=0021-9967&date=1998&volume=400&issue=2&spage=271,Wiley
10.1177/107385840100700408,11488397,not found,The place of the thalamus in frontal cortical-basal ganglia circuits,S Haber,https://journals.sagepub.com/doi/10.1177/107385840100700408?url_ver=Z39.88-2003&rfr_id=ori:rid:crossref.org&rfr_dat=cr_pub  0pubmed,Atypon
10.1016/S0304-3940(01)02018-3,11489539,not found,Cerebello-thalamo-cortical projections to the posterior parietal cortex in the macaque monkey,Y Amino,https://linkinghub.elsevier.com/retrieve/pii/S0304394001020183,Elsevier Science
10.1007/s00429-015-1018-7,25924563,PMC6363530,Functional topography of the thalamocortical system in human,Rui Yuan,https://www.ncbi.nlm.nih.gov/pmc/articles/PMC6363530/,PMC
10.3389/fnins.2022.812837,35250454,PMC8888535,Similarities Between Somatosensory Cortical Responses Induced via Natural Touch and Microstimulation in the Ventral Posterior Lateral Thalamus in Macaques,Joseph Thachil Francis,https://www.ncbi.nlm.nih.gov/pmc/articles/PMC8888535/,PMC
10.1046/j.1460-9568.1998.00246.x,9749763,not found,A population of cholinergic neurons is present in the macaque monkey thalamus,B Rico,https://onlinelibrary.wiley.com/resolve/openurl?genre=article&sid=nlm:pubmed&issn=0953-816X&date=1998&volume=10&issue=7&spage=2346,Wiley
10.1523/JNEUROSCI.5602-05.2006,16624964,PMC6674014,Attentional modulation of thalamic reticular neurons,Kerry McAlonan,https://www.ncbi.nlm.nih.gov/pmc/articles/PMC6674014/,PMC
10.1002/aur.1726,27896947,PMC5444966,Reduced Modulation of Thalamocortical Connectivity during Exposure to Sensory Stimuli in ASD,Shulamite A Green,https://www.ncbi.nlm.nih.gov/pmc/articles/PMC5444966/,PMC
10.1016/j.biopsych.2019.10.029,31924325,PMC7103554,The Thalamocortical Circuit of Auditory Mismatch Negativity,Peter Lakatos,https://www.ncbi.nlm.nih.gov/pmc/articles/PMC7103554/,PMC
10.1523/JNEUROSCI.1724-21.2021,34903572,PMC8824507,"Pathways for Memory, Cognition and Emotional Context: Hippocampal, Subgenual Area 25, and Amygdalar Axons Show Unique Interactions in the Primate Thalamic Reuniens Nucleus",Mary Kate P Joyce,https://www.ncbi.nlm.nih.gov/pmc/articles/PMC8824507/,PMC
10.1016/j.jns.2014.11.017,25579413,not found,Pretreatment with intravenous levetiracetam in the rhesus monkey Coriaria lactone-induced status epilepticus model,Lan Cheng,https://linkinghub.elsevier.com/retrieve/pii/S0022-510X(14)00731-X,Elsevier Science
0.0,not found,not found,Longitudinal Metabolic Changes in the Thalamus of Macaque Brain During 42-Day Head Down Tilt,not found,not found,not found
10.1002/cne.10720,12761828,not found,Thalamocortical and intracortical connections of monkey cingulate motor areas,Nobuhiko Hatanaka,https://doi.org/10.1002/cne.10720,Wiley
10.1002/cne.23386,23873330,PMC3893768,"Thalamic Input to Representations of the Teeth, Tongue, and Face in Somatosensory Area 3b of Macaque Monkeys",Christina M Cerkevich,https://www.ncbi.nlm.nih.gov/pmc/articles/PMC3893768/,PMC
10.1093/cercor/bhv063,25899706,PMC4816794,White Matter Connectivity of the Thalamus Delineates the Functional Architecture of Competing Thalamocortical Systems,Jonathan O'Muircheartaigh,https://www.ncbi.nlm.nih.gov/pmc/articles/PMC4816794/,PMC
10.1016/j.jneumeth.2017.10.009,29042259,not found,"Widespread optogenetic expression in macaque cortex obtained with MR-guided, convection enhanced delivery (CED) of AAV vector to the thalamus",Azadeh Yazdan-Shahmorad,https://linkinghub.elsevier.com/retrieve/pii/S0165-0270(17)30363-1,Elsevier Science
10.1017/S0952523817000049,28965507,PMC5716341,Thalamocortical processing in vision,Reece Mazade,https://www.ncbi.nlm.nih.gov/pmc/articles/PMC5716341/,PMC
10.1016/j.neuroimage.2010.02.062,20206702,PMC2877805,Topography of connections between human prefrontal cortex and mediodorsal thalamus studied with diffusion tractography,Johannes C Klein,https://www.ncbi.nlm.nih.gov/pmc/articles/PMC2877805/,PMC
10.1038/nn.4423,27775722,PMC5791896,Gravity orientation tuning in macaque anterior thalamus,Jean Laurens,https://www.ncbi.nlm.nih.gov/pmc/articles/PMC5791896/,PMC
10.1007/s004410050847,9182596,not found,A morphological anomaly of the dorsal lateral geniculate nucleus in Macaca fascicularis,B J O'Brien,https://dx.doi.org/10.1007/s004410050847,Springer
10.1002/cne.903570110,7673471,not found,SPATIAL-DISTRIBUTION OF THALAMIC PROJECTIONS TO THE SUPPLEMENTARY MOTOR AREA AND THE PRIMARY MOTOR CORTEX - A RETROGRADE MULTIPLE LABELING STUDY IN THE MACAQUE MONKEY,K Shindo,https://onlinelibrary.wiley.com/resolve/openurl?genre=article&sid=nlm:pubmed&issn=0021-9967&date=1995&volume=357&issue=1&spage=98,Wiley
10.1007/s00429-015-1091-y,26254903,PMC4747860,The origins of thalamic inputs to grasp zones in frontal cortex of macaque monkeys,Omar A Gharbawie,https://www.ncbi.nlm.nih.gov/pmc/articles/PMC4747860/,PMC
10.1002/mds.27921,31800134,PMC7154739,Changes in thalamic dopamine innervation in a progressive Parkinson's disease model in monkeys,Mariana H G Monje,https://www.ncbi.nlm.nih.gov/pmc/articles/PMC7154739/,PMC
10.1016/S0960-9822(00)00043-9,11166178,not found,Independent parcellation of the embryonic visual cortex and thalamus revealed by combinatorial Eph/ephrin gene expression,N Sestan,https://linkinghub.elsevier.com/retrieve/pii/S0960-9822(00)00043-9,Elsevier Science
0.0,7540670,PMC6577703,EXTENT OF INTRACORTICAL ARBORIZATION OF THALAMOCORTICAL AXONS AS A DETERMINANT OF REPRESENTATIONAL PLASTICITY IN MONKEY SOMATIC SENSORY CORTEX,E Rausell,https://www.ncbi.nlm.nih.gov/pmc/articles/PMC6577703/,PMC
