1764,10.1016/s0304-3959(97)00138-3,9469535.0,,https://journals.lww.com/pain/abstract/1997/12000/pain_processing_during_three_levels_of_noxious.19.aspx,journals.lww.com,://journals.lww.com/,journals.lww.com,Pain processing during three levels of noxious stimulation produces differential patterns of central activity,Previous functional imaging studies have demonstrated a number of discrete brain structures that increase activity with noxious stimulation Of the commonly identified central structures only the anterior cingulate cortex shows a consistent response during the experience of pain The insula and thalamus demonstrate reasonable consistency while all other regions including the lentiform nucleus somatosensory cortex and prefrontal cortex are active in no more than half the current studies The reason for such discrepancy is likely to be due in part to methodological variability and in part to individual variability One aspect of the methodology which is likely to contribute is the stimulus intensity Studies vary considerably regarding the intensity of the noxious and non-noxious stimuli delivered This is likely to produce varying activation of central structures coding for the intensity affective and cognitive components of pain Using twelve healthy volunteers and positron emission tomography PET the regional cerebral blood flow rCBF responses to four intensities of stimulation were recorded The stimulation was delivered by a CO laser and was described subjectively as either warm not painful pain threshold just painful mildly painful or moderately painful The following group subtractions were made to examine the changing cerebral responses as the stimulus intensity increased  just painful  warm  mild pain  warm and  moderate pain  warm In addition rCBF changes were correlated with the subjective stimulus ratings The results for comparison  indicated activity in the contralateral prefrontal area  bilateral inferior parietal area  and ipsilateral premotor cortices area  possibly reflecting initial orientation and plans for movement The latter comparisons and correlation analysis indicated a wide range of active regions including bilateral prefrontal inferior parietal and premotor cortices and thalamic responses contralateral hippocampus insula and primary somatosensory cortex and ipsilateral perigenual cingulate cortex area  and medial frontal cortex area  Decreased rCBF was observed in the amygdala region These responses were interpreted with respect to their contribution to the multidimensional aspects of pain including fear avoidance affect sensation and motivation or motor initiation It is suggested that future studies examine the precise roles of each particular region during the central processing of pain,pain processing; noxious stimulation; stimulus intensity; regional cerebral blood flow; POSITRON EMISSION TOMOGRAPHY; ANTERIOR CINGULATE CORTEX; RHESUS-MONKEY; PET IMAGES; BRAIN; AMYGDALA; AFFERENTS; NUCLEUS; REGIONS
1771,10.1016/j.neuroimage.2018.10.010,30326295.0,,https://linkinghub.elsevier.com/retrieve/pii/S1053811918319694,linkinghub.elsevier.com,://linkinghub.elsevier.com/,linkinghub.elsevier.com,A 3D population-based brain atlas of the mouse lemur primate with examples of applications in aging studies and comparative anatomy,The gray mouse lemur Microcebus murinus is a small prosimian of growing interest for studies of primate biology and evolution and notably as a model organism of brain aging As brain atlases are essential tools for brain investigation the objective of the current work was to create the first D digital atlas of the mouse lemur brain For this a template image was constructed from in vivo magnetic resonance imaging MRI data of  animals This template was then manually segmented into  cortical  subcortical and  cerebro-spinal fluid CSF regions Additionally we generated probability maps of gray matter white matter and CSF The template manual segmentation and probability maps as well as imaging tools used to create and manipulate the template can all be freely downloaded The atlas was first used to automatically assess regional age-associated cerebral atrophy in a cohort of mouse lemurs previously studied by voxel based morphometry VBM Results based on the atlas were in good agreement with the VBM ones showing age-associated atrophy in the same brain regions such as the insular parietal or occipital cortices as well as the thalamus or hypothalamus The atlas was also used as a tool for comparative neuroanatomy To begin with we compared measurements of brain regions in our MRI data with histology-based measures from a reference article largely used in previous comparative neuroanatomy studies We found large discrepancies between our MRI-based data and those of the reference histology-based article Next regional brain volumes were compared amongst the mouse lemur and several other mammalian species where high quality volumetric MRI brain atlases were available including rodents mouse rat and primates marmoset macaque and human Unlike those based on histological atlases measures from MRI atlases indicated similar cortical to cerebral volume indices in all primates including in mouse lemurs and lower values in mice On the other hand white matter to cerebral volume index increased from rodents to small primates mouse lemurs and marmosets to macaque reaching their highest values in humans,Atlas; Cerebral atrophy; Comparative anatomy; MRI; Mouse lemur; Template; TEMPLATE IMAGES; SEGMENTATION; MODEL; EVOLUTION; ATROPHY
1795,10.1016/j.neures.2017.02.007,28257798.0,,https://linkinghub.elsevier.com/retrieve/pii/S0168010216303236,linkinghub.elsevier.com,://linkinghub.elsevier.com/,linkinghub.elsevier.com,The use of an optimized chimeric envelope glycoprotein enhances the efficiency of retrograde gene transfer of a pseudotyped lentiviral vector in the primate brain,Lentiviral vectors have been used not only for various basic research experiments but also for a wide range of gene therapy trials in animal models The development of a pseudotyped lentiviral vector with the property of retrograde infection allows us to introduce foreign genes into neurons that are localized in regions innervating the site of vector injection Here we report the efficiency of retrograde gene transfer of a recently developed FuG-E pseudotyped lentiviral vector in the primate brain by comparing its transduction pattern with that of the parental FuG-C pseudotyped vector After injection of the FuG-E vector encoding green fluorescent protein GFP into the striatum of macaque monkeys many GFP-immunoreactive neurons were found in regions projecting to the striatum such as the cerebral cortex thalamus and substantia nigra Quantitative analysis revealed that in all regions the number of neurons retrogradely transduced with the FuG-E vector was larger than in the FuG-C vector injection case It was also confirmed that the FuG-E vector displayed explicit neuronal specificity to the same extent as the FuG-C vector This vector might promote approaches to pathway-selective gene manipulation and provide a powerful tool for effective gene therapy trials against neurological disorders through enhanced retrograde delivery,Lentivirus; Viral vector; Neuron; Retrograde transport; Nonhuman primates; Striatum; PARKINSONS-DISEASE; BASAL GANGLIA; SUBTHALAMIC NUCLEUS; FUNCTIONAL-ANATOMY; SQUIRREL-MONKEY; RAT; SYSTEM; EXPRESSION; PROJECTION; DELIVERY
1814,10.1016/s0079-6123(05)49005-6,16226576.0,,https://linkinghub.elsevier.com/retrieve/pii/S0079612305490056,linkinghub.elsevier.com,://linkinghub.elsevier.com/,linkinghub.elsevier.com,Neural substrates within primary visual cortex for interactions between parallel visual pathways,Parallel processing is a common feature of sensory systems in the mammalian brain Specialized sensory receptors and neural circuits extract behaviorally relevant information from the environment and the brain integrates this information to generate perception and behavior At the broadest level parallel pathways are apparent in the specialized systems that extract information pertaining to each of the individual senses The creation of behaviorally relevant feature detectors as well as the generation of a coherent visual percept requires integration of information across streams and this integration begins in the primary visual cortex V The parallel visual pathways that originate in the primate macaque monkey retina the functional organization of input from the lateral geniculate nucleus of the thalamus LGN to V the local circuits within V that mediate integration of information across streams and the relationships between each of Vs separate subcircuits and the extrastriate visual areas to which they project are reviewed in this chapter The chapter demonstrates that the sites of termination of LGN input within V correspond to the zones that stain dark for cytochrome oxidase and each functionally distinct pathway provides input to a distinct zone within V The chapter also presents anatomical studies which show that the layer B of V is not the sole source of input to dorsal visual areas nor does it receive exclusively magnocellular input Moreover ventral visual areas receive input from layer B as well as from blobs and interblobs and the blobs and interblobs receive convergent input from multiple visual pathways,LATERAL GENICULATE-NUCLEUS; MACAQUE STRIATE CORTEX; CYTOCHROME-OXIDASE; GANGLION-CELL; PARVOCELLULAR CONTRIBUTIONS; RHESUS-MONKEY; LAYER 4B; AREA V4; RETINA; NEURONS
1838,10.1016/j.neures.2010.05.005,20561955.0,,https://linkinghub.elsevier.com/retrieve/pii/S0168010210001422,linkinghub.elsevier.com,://linkinghub.elsevier.com/,linkinghub.elsevier.com,Neural substrates of phasic alertness: A functional magnetic resonance imaging study,The warning effect refers to the decrease in motor response reaction times to a target when its presentation is preceded by a stimulus indicating that the target will appear shortly We hypothesized that cue presentation phasically enhances alertness which in turn facilitates the preparation of a motor response To test this hypothesis we conducted functional magnetic resonance imaging during a GoNoGo task with a warning stimulus Fifteen subjects completed a visual GoNoGo task and  completed an analogous task in the auditory modality After a warning stimulus was presented a Go or NoGo stimulus was presented with equal probability Both auditory and visual warning stimuli activated the midbrain thalamus and the anterior cingulate cortex ACC extending to the pre-supplementary motor area pre-SMA The warning-related activation in the pre-SMA and thalamus was greater when warnings were followed by Go events with faster reaction times than when followed by events with slower reaction times The midbrain thalamus and ACC are known to be associated with vigilance or intrinsic alertness and the pre-SMA is involved in movement selection and preparation Thus the warning effect may be partly mediated by the potentiation of the pre-SMA through the midbrainthalamusACC alerting network,Alerting; Attention; fMRI; Functional magnetic resonance imaging; Warning stimuli; ADJACENT CINGULATE CORTEX; SUPPLEMENTARY MOTOR AREA; EVENT-RELATED FMRI; ATTENTIONAL NETWORKS; NEURONAL-ACTIVITY; MACAQUE MONKEY; FRONTAL-LOBE; CORTICOSPINAL PROJECTIONS; PREMOTOR CORTEX; MESIAL AREA-6
1839,10.1016/j.nucmedbio.2019.10.004,31891882.0,,https://linkinghub.elsevier.com/retrieve/pii/S096980511930037X,linkinghub.elsevier.com,://linkinghub.elsevier.com/,linkinghub.elsevier.com,Fluselenamyl: Evaluation of radiation dosimetry in mice and pharmacokinetics in brains of non-human primate,To allow quantitative assessment of therapeutic efficacy for therapeutic interventions either approved or undergoing FDA approvals for either inhibiting or reducing development of Aβ pathophysiology in vivo F-labelled tracers such as Florbetapir Florbetaben and Flutemetamol have been approved Previously we have reported on development and preclinical validation of F-Fluselenamyl comprising traits of translatable Aβ imaging agents Herein we report the dosimetry data for F-Fluselenamyl to provide radiation dose deposited within organs and determine effective dose ED for human studies while also evaluating its pharmacokinetics in the nonhuman primate brains To evaluate safety profiles of F-Fluselenamyl for enabling its deployment as a PET imaging agent for monitoring Aβ pathophysiology in vivo we estimated the human radiation dosimetry extrapolated from rodent biodistribution data obtained by standard method of organ dissection Animal biodistribution studies were performed in FVBNCR mice  males  females following tail-vein injection of the tracer Following euthanasia of mice organs were harvested counted radiation dose to each organ and whole body was determined using the standard MIRD methodology For evaluation of pharmacokinetics in non-human primates following intravenous injection of the tracer dynamic PET scan of rhesus monkey brains were performed and co-registered with MR for anatomical reference Parametric images of tracer transport rate constant and distribution volume relative to cerebellum were generated using a simplified reference tissue model and a spatially-constraint linear regression algorithm The critical organ in humans has been determined to be the gall bladder with a gender average radiation absorbed dose of mGyMBq with an effective dose of mSvMBq and mSvMBq in males and females respectively Therefore these data provide preliminary projections on human dosimetry derived from rodent estimates thereby defining safe imaging conditions for further validations in human subjects Additionally the tracer penetrated the non-human primate brain and excreted to background levels at later-time points thus pointing to the potential for high signalnoise ratios during noninvasive imaging Tissue time activity curves TACs also show fast initial uptake with maximum projection of activity at min post administration followed by clearance of activity at later time-points from cortex cerebellum and white matter of nonhuman primate brain Parametric images confirmed that the F-Fluselenamyl has relative high transport rate constant at striatum thalamus and cortex The data obtained from radiation dosimetry studies in mice indicate that F-Fluselenamyl can be safely used for further evaluation in humans Additionally F-Fluselenamyl demonstrated ability to traverse the blood brain barrier BBB and indicated high initial influx followed by clearance to background levels in non-human primate brains Combined information indicates that F-Fluselenamyl would be a potential candidate for detecting amyloid plaques in the living human brain,ALZHEIMERS-DISEASE; SPATIAL CONSTRAINT; BIOMARKERS; BETA; TAU; PET; DIAGNOSIS; MODEL
1842,10.1016/s0079-6123(05)49012-3,16226583.0,,https://linkinghub.elsevier.com/retrieve/pii/S0079612305490123,linkinghub.elsevier.com,://linkinghub.elsevier.com/,linkinghub.elsevier.com,Neural mechanisms underlying target selection with saccadic eye movements,In exploring the visual scene we make about three saccadic eye movements per second During each fixation in addition to analyzing the object at which we are looking a decision has to be made as to where to look next Although we perform this task with the greatest of ease the computations to perform the task are complex and involve numerous brain structures We have applied several investigative tools that include single-cell recordings microstimulation pharmacological manipulations and lesions to learn more about the neural control of visually guided eye saccadic movements Electrical stimulation of the superior colliculus SC areas V and V the lateral intraparietal sulcus LIP the frontal eye fields FEF and the medial eye fields MEF produces saccadic eye movements at low current levels After ablation of the SC electrical microstimulation of V V and LIP no longer elicits saccadic eye movements whereas stimulation of the FEF and MEF continues to be effective Ablation of the SC but not of the FEF eliminates short-latency saccadic eye movements to visual targets called express saccades whereas lesions of the FEF selectively interfere with target selection Bilateral removal of both the SC and the FEF causes major long lasting deficits all visually elicited saccadic eye movements are eliminated In intact monkeys subthreshold electrical microstimulation of the FEF and MEF as well as the lower layers of V and V and of some subregions of LIP greatly facilitates the choice of targets presented in the receptive fields of the stimulated neurons By contrast stimulation of the upper layers of V and V and other sub-regions of LIP produces a dramatic interference in target selection Examination of the role of inhibitory circuits in eye-movement generation reveals that local infusion of muscimol a GABA gamma-aminobutyric acid agonist or bicuculline a GABA antagonist interferes with target selection in V On the other hand infusion of bicuculline into the FEF produces facilitation in target choice and irrepressible saccades It appears therefore that inhibitory circuits play a central role in visual analysis in V and in the generation of saccadic eye movements in the FEF It is proposed that two major streams can be discerned in visually guided eye-movement control the posterior from occipital and parietal cortex that reaches the brainstem via the SC and the anterior from the FEF and MEF that has direct access to the brainstem oculomotor centers,LATERAL GENICULATE-NUCLEUS; SINGLE-CELL PROPERTIES; MONKEY STRIATE CORTEX; DORSOMEDIAL FRONTAL-CORTEX; POSTERIOR PARIETAL CORTEX; SUPERIOR COLLICULUS; RHESUS-MONKEY; RECEPTIVE-FIELDS; MACAQUE MONKEY; STIMULATION
1846,10.1016/j.pscychresns.2004.04.005,15854788.0,,https://linkinghub.elsevier.com/retrieve/pii/S0925492705000272,linkinghub.elsevier.com,://linkinghub.elsevier.com/,linkinghub.elsevier.com,Abnormal effective connectivity of dopamine D2 receptor binding in schizophrenia,Receptor binding has been examined region by region in both in vitro and in vivo studies but less attention has been paid to the connectivity of regional receptor binding despite the fact that neurophysiological studies have indicated an extensive inter-regional connectivity In this study we investigated the connectivity of regional dopamine D receptor binding in positron emission tomography data from  drug-naïve patients with schizophrenia and  healthy controls We applied a structural equation method to regional receptor binding The results indicated that the network models of the patients and normal subjects were significantly different As to the individual path coefficients a connectivity between cortical regions was different between groups b connectivity from the prefrontal cortex parietal cortex and thalamus to the anterior cingulate differed from that in controls and c connectivity from the prefrontal cortex to the anterior cingulate and thalamus via the hippocampus was observed in normal subjects but not in patients These results suggest that a systems-level change reflected in the connectivity of D receptor binding is present in schizophrenia,PET; structural equation modeling; dopamine; D2 receptor; schizophrenia; PREFRONTAL CORTEX; CINGULATE CORTEX; HUMAN BRAIN; <C-11>FLB-457 BINDING; ANTERIOR CINGULATE; NUCLEUS ACCUMBENS; NETWORK ANALYSIS; VISUAL PATHWAYS; RHESUS-MONKEY; PET
1848,10.1016/j.jchemneu.2003.07.005,14729127.0,,https://linkinghub.elsevier.com/retrieve/pii/S0891061803000802,linkinghub.elsevier.com,://linkinghub.elsevier.com/,linkinghub.elsevier.com,The human cerebellum,This short review deals with observations on the gross morphology and internal structure of the human cerebellum and with studies of cerebellar fiber connections in non-human primates Attention is focussed on its gross anatomy the zonal organization of the primate cerebellum the brain stem thalamic and cortical connections of the cerebellar nuclei and on the cortico-ponto-cerebellar pathway The presence of important reciprocal nucleo-mesencephalo-olivary loops as part of the circuitry of the dentate and globose posterior interposed nuclei and their absence among the connections of other cerebellar nuclei is emphasized,cerebellar zones; cerebellar nuclei; cerebellar circuitry; pontocerebellar pathway; central tegmental tract; red nucleus; RETROGRADE FLUORESCENT; MEDULLA-OBLONGATA; PONTINE NUCLEI; INFERIOR OLIVE; RHESUS-MONKEY; RED NUCLEUS; PROJECTIONS; CORTEX; RAT; MOTOR
1852,10.1016/j.jneumeth.2012.08.004,22971353.0,,https://linkinghub.elsevier.com/retrieve/pii/S0165027012002932,linkinghub.elsevier.com,://linkinghub.elsevier.com/,linkinghub.elsevier.com,A glass-coated tungsten microelectrode enclosing optical fibers for optogenetic exploration in primate deep brain structures,The optogenetic approach to primate brain circuitry has unparalleled potential for uncovering genetically and temporally resolved neuronal mechanisms of higher brain functions In order to optogenetically investigate the large and complex primate brain an optical-electrical probe or optrode must be inserted deeply which requires the optrode to be not only long and stiff but also sharp and smooth to reduce possible tissue damage This study presents a tungsten microelectrode-based optrode that encloses optical fibers within its insulation glass Optical fibers and a tungsten wire were tightly bound to each other and integrally coated with a smooth thin layer of glass This design satisfied the structural requirements for use in deep brain structures The performance of the optrode was then examined in the thalamus of the rat and macaque monkeys which were injected with lentiviral vectors carrying the channelrhodopsin--enhanced yellow fluorescent protein ChR-EYFP transgene With fluorescence measurements via the optical fiber ChR-EYFP expression was detected clearly in vivo which was confirmed by histological analysis in the rat With photostimulation and extracellular recording photo-responsive single-unit activities were isolated in the monkeys The depth distribution of these units and the peak of the EYFP fluorescence profile overlapped consistently with each other Thus by developing a new probe optogenetic methodology was successfully applied to a primate subcortical structure This smooth glass-coated optrode is a promising tool for chronic in vivo experiments with various research targets including deep brain structures in behaving monkeys,Optogenetics; Optrode; Photostimulation; Monkey; Deep brain structure; Single-unit activity; Glass coating; Microelectrode; IN-VIVO; TEMPORAL CORTEX; NEURAL CIRCUITS; SINGLE NEURONS; MEMORY; ACTIVATION; DYNAMICS; OPTRODE; NETWORK; VECTOR
1869,10.1016/s0079-6123(03)43042-2,14653187.0,,https://linkinghub.elsevier.com/retrieve/pii/S0079612303430422,linkinghub.elsevier.com,://linkinghub.elsevier.com/,linkinghub.elsevier.com,Macro-architecture of basal ganglia loops with the cerebral cortex: use of rabies virus to reveal multisynaptic circuits,We have used retrograde transneuronal transport of rabies virus to examine basal ganglia connections with the cerebral cortex We injected rabies into the primary motor cortex M or into Area  of cebus monkeys A -day survival time was long enough to allow transport of rabies from the injection site to third-order neurons in the basal ganglia After either M or Area  injections third-order neurons were found in the external segment of the globus pallidus GPe striatum and subthalamic nucleus STN In each of these nuclei the third-order neurons that innervate M were spatially separated from those that innervate Area  Thus distinct basal gangliathalamocortical circuits innervate M and Area  Next we injected a conventional tracer into M to define its terminations in the putamen and STN We found that the regions of the putamen and STN that receive input from M are the same as those that contain third-order neurons after M injections of virus On the other hand virus injections into M also labeled a relatively dense group of third-order neurons in a region of the ventral putamen that is not innervated by M This region of the putamen is the target of efferents from the amygdala Thus the ventral putamen may provide a route for the limbic system to influence motor output Overall our results indicate that basal ganglia circuits with the cerebral cortex can be characterized by both open- and closed-loop macro-architectures,PRIMARY MOTOR CORTEX; PRIMATE SUBTHALAMIC NUCLEUS; CENTRAL-NERVOUS-SYSTEM; CORTICOSTRIATAL PROJECTIONS; TRANSNEURONAL TRANSPORT; GLOBUS PALLIDUS; MACAQUE MONKEY; FUNCTIONAL-PROPERTIES; FRONTAL-CORTEX; RHESUS-MONKEY
