897,,823649.0,,https://europepmc.org/article/med/823649,europepmc.org,://europepmc.org/,europepmc.org,The diencephalon of the vervet monkey (Cercopithecus aethiops). Part I: thalamus and metathalamus.,The diencephalon of the vervet monkey Cercopithecus aethiops is described and compared with that of other primates particularly the macaque monkey Macaca mulatta In the vervet monkey the thalamus is divided into six nuclear groups anterior midline medial dorsolateral ventrolateral and posterior The anterior nuclear group shows a regressive nucleus anterodorsalis and a poorly defined demarcation between the nuclei anteromedialis and anteroventralis There is a large interthalamic adhesion in which the ventral region containing nuclei centralis medialis interventralis and reuniens shows more regression than the dorsal region consisting of nuclei parataenialis and paraventralis As the nucleus medialis ventralis is not present the nucleus medialis dorsalis is described as the nucleus medialis this is clearly differentiated into three parts each part showing different cytological and architectonic features The nucleus centrum medianum is larger and better developed than that of lower primates but is not entirely demarcated from the nucleus parafascicularis The pulvinar is an enormous outgrowth from the dorsolateral thalamic nuclei The ventrolateral thalamic nuclei are well differentiated from one another a distinct nucleus ventralis dorsomedialis is present and appears to possess definite topographical and cytological differences from those of the other ventrolateral nuclei The nucleus ventralis posteromedialis is further differentiated into a magno- and a parvocellular part The nucleus ventralis posteroinferioris is a distinct entity The lateral geniculate body shows a definite differentiation into two nuclei pregeniculate and lateral geniculate nuclei The lateral geniculate nucleus is a six-layered structure which is of the inverted type it has undergone a lateral rotation through an anteroposterior axis from a dorsal position in the prosimian thalamus to its present ventral position in the higher primate thalamus The medial geniculate body is not laminated as is the lateral geniculate nucleus it consists of a small dorsomedial magnocellular and a large ventrolateral parvocellular part,
918,10.1016/j.jns.2014.11.017,25579413.0,,https://linkinghub.elsevier.com/retrieve/pii/S0022510X1400731X,linkinghub.elsevier.com,://linkinghub.elsevier.com/,linkinghub.elsevier.com,Pretreatment with intravenous levetiracetam in the rhesus monkey Coriaria lactone-induced status epilepticus model,To investigate the antiepileptic and protective effects of intravenous levetiracetam iv LEV in the rhesus monkey model of acute status epilepticus SE Thirty minutes before intraperitoneal induction of SE by Coriaria lactone CL rhesus monkeys were treated with LEV  or  mgkg delivered intravenously as a single bolus CL dose and epileptic behavior were recorded Electroencephalography EEG was performed before and during the experiment All rhesus monkeys were killed after -month video monitoring and processed for pathological investigation of neuronal injury terminal deoxynucleotidyl transferase-mediated dUTP nick end-labeling TUNEL staining and glial fibrillary acidic protein GFAP staining No animal exhibited spontaneous seizures during -month video monitoring Development of acute SE was significantly inhibited in the group given  mgkg LEV compared with controls and the  mgkg LEV group Delayed latency reduction of SE duration decreased cumulative time of tonic convulsions slight severity of SE and a high CL induction dose were observed in the high LEV dose group p   The EEG showed less frequent epileptic discharges in the group administered with  mgkg LEV Hematoxylin and eosin HE staining ultrastructural examination TUNEL and GFAP staining revealed serious damage including neuron loss swollen mitochondrion and strong positivity for TUNEL in the hippocampus and thalamus of controls whereas moderate damage in the group administered with  mgkg LEV and very mild damage in the  mgkg LEV group Gliosis was found in the hippocampus of controls not in the LEV groups and normal rhesus monkey The study supports the antiepileptic and protective effect of pretreatment with intravenous LEV in rhesus monkey model with SE,SE; status epilepticus; AEDs; antiepileptic drugs; LEV; levetiracetam; iv LEV; intravenous levetiracetam; CL; Coriaria lactone; EEG; electroencephalography; TUNEL; terminal deoxynucleotidyl transferase-mediated dUTP nick end-labeling staining; GFAP; glial fibrillary acidic protein; SSSE; self-sustaining status epilepticus; Intravenous levetiracetam; Pretreatment; Coriaria lactone; Rhesus monkey; Status epilepticus; Neuronal injury;
922,,8883918.0,,https://linkinghub.elsevier.com/retrieve/pii/S0165017396000033,linkinghub.elsevier.com,://linkinghub.elsevier.com/,linkinghub.elsevier.com,The primate motor thalamus,The functional parcellation of the motor thalamus of primates has suffered from serious historical and technical drawbacks; which have led to extreme confusion. This is a problem when thalamic stereotaxy is again being use clinically. The cause usually imputed is the historical conflict between two main schools; the Vogt and the 'Anglo-American' (Michigan); which used different nomenclatures. In fact; the reasons are more profound and serious. A combination of them led to: an archaic; rigid conception of the 'thalamic nucleus'; overexploitation of cytoarchitectonic technique; comparative anatomy and cortical connections; under exploitation of subcortical afferent territories; recent misuse of these territories; hesitations in the use of the VA-VL system; and opposition between ventral ('relay') and dorsal ('associative') 'nuclei'. Previous and current parcellations and nomenclatures for the lateral region finally appeared inappropriate. Before presenting a new parcellation and nomenclature for the lateral region; we explain why we did not adopt one of most common or of recently proposed nomenclatures; and were led to make our own. This is established according to rational and historically grounded rules. Precise definition of thalamic elements is provided. A thalamic 'region' is a gross topographic division corresponding to the former nuclei. A 'territory' is defined as the cerebral space filled by afferent endings from one source. When having a distinct topography in a region; a given territory makes a 'subregion'. For each of the studied 'motor' territories a review was made of its known cortical projections. The thalamic space where neurons project to a given cortical target constitutes a 'source space'. Topographical comparison of the sources spaces with territories reveals that there is often no coincidence between different (afferent or efferent) neuronal set spaces. It appears that source spaces are coincident in the pallidal and nigral territories but not in the cerebellar territory where two topographically distinct source spaces could be distinguished. A 'thalamic nucleus' is defined as the intersection of a thalamocortical source space with one territory. A rapid review of the general anatomy of the diencephalon is made. The ('dorsal') thalamus is divided into 'allo-' and 'isothalamus'; the latter with 'bushy' and 'microneurons'. The lateral region is isothalamic. The 'motor thalamus' makes the anterior part of the lateral region. The present work aims to analyse the functional anatomy of the 'motor thalamus' by using precise topography and three-dimensional analysis of the subcortical territories receiving from the cerebellar nuclei (part II); the medial nucleus of the pallidum (part III) and the pars reticulata and mixta of the substantia nigra (part IV). Large injections were used to obtain the maximal extent of each territory. A major deficiency of previous studies was inadequate cartography. Reliance on ventricular (CA-CP) landmarks observed by use of orthogonal teleradiography is mandatory. A study was made of intra- and interspecific variations and their effect on stereotactic and cartographic precision in macaques. All three subcortical motor afferent territories to the motor thalamus of macaques are examined in precise cartography with three dimensional reconstructions; rotations and 'reslicing'. The motor thalamus is made up of three topographically distinct and separate territories: cerebellar; pallidal territory and nigral. They cover the entire anterior part of the lateral region. There is no polar subdivision without lower afferents in front of the pallidal and nigral territories and thus no reason for isolating a nucleus lateralis polaris or a polar VA. The cerebellar territory is continuous and dense; in front of the somesthetic nucleus and everywhere separate from it. It has a complex three-dimensional shape; strongly convex anteriorly. Its caudal portion is dorsal to the somesthetic nucleus. In the lateral dimension it extends from the lateral region to the paralaminar region of the medial complex. The cerebellar territory; primarily dentate; also contains islands of axons from the interposed and fastigial nuclei; the vestibular nuclei and the spinothalamic tract. It corresponds to at least five previously isolated 'cytoarchitectonic nuclei'. It cannot be seen as a single entity but contains distinct ventrolateral and a mediodorsal source spaces. Its complex three-dimensional shape; its particular intersection with different cytoarchitectonic nuclei and source spaces; can be simplified into two nuclei: nucleus lateralis intermedius lateralis (LIL) and nucleus intermedius mediodorsalis (LIM). The stereotacticians' ventralis intermedius (Vim) is discussed at length. Tremorosynchronous and kinesthetic neurons are essentially located ventrally and laterally. The intrathalamic topography observed in human patients indicates that the stereotacticians's target (where tremorosynchronous neurons are found) is within lateral cerebellar territory receiving cerebellar afferents and projecting to the motor cortex. The hypothesis that the nucleus interpositus could be particularly involved is presented. The nucleus lateralis intermedius lateralis (LIL) of the present study is equivalent in macaques to the stereotacticians' 'V.im.e'; object to interspecific differences. The pallidal territory is anterior to and separate from the cerebellar territory; in the oral part of the lateral region. It covers the whole ventrodorsal extent of the thalamus. It is crescent shaped; strongly curved in the anteroposterior dimension; and ends dorsally over the cerebellar territory. It is also curved in the mediolateral dimension following the lateral border of the thalamus. The territorial border does not coincide with cytoarchitectonic borders. The pallidal territory includes various cytoarchitectonic nuclei. Only the cloud-like ventral oral part is easily recognizable on purely cytoarchitectonic criteria. The others are cytoarchitectonically ill defined. The pallidal territory may be delineated using calbindin immunostaining. Other targets of the medial pallidum are the central (centre-median-parafascicular) complex; the pedunculo-pontine complex and the lateral habenula. In relation to its afferent and efferent connections; the pallidal thalamus seems to be made up of a single piece and could be considered as the lateral oral subregion or nucleus (LO). The nigrothalamic connection has been ignored for a long time and remains undervalued. Precise topographic description shows that the nigral territory is much more extensive than usually thought. It is located medial to the pallidal territory; and as the most rostral of all three subcortical afferent territories; is named nucleus lateralis rostralis (LR). Orally the nigral territory covers the whole ventrodorsal extent of the lateral region of the thalamus. A posterior part ends ventrally and medially just in front of the central complex. A topographically distinct amygdalar forms a subdivision named nucleus Lateralis Rostralis pars medialis (LRM). A posterodorsal part ends in the anterior paralaminar part of the medial complex; in front of the cerebellar territory. Islands of nigral terminations are observed within the medial nucleus. Three dimensional studies and artificial reslicing shows a posteroanterior sequence of the lemniscal; cerebellar; pallidal and nigral territories. The three motor territories extend over the whole ventrodorsal extent of the dorsal region. There appears to be no opposition of ventral to dorsal nuclei. Nuclei of the lateral region are thus given the first adjective Lateralis. The second adjective is from the initial sequence devisted by C. Vogt; caudalis-intermedia-oralis; to which we add rostralis. The lemniscal territory is named subregio Lateralis Caudalis with two parts: nucleus Laeralis Caudalis Lateralis (LCL) and nucleus Laeralis Caudalis Medialis (LCM). The cerebellar territory is named subregio Lateralis Intermedia with two nuclei: nucleus Laterlis Intermedius Lateralis (LIL); which is the main source to the motor cortex; and nucleus Lateralis Intremedius Medialis (LIM). The pallidal territory is subregio or nucleus Lateralis Oralis (LO). The nigral territory is subregio or nucleus Lateralis Rostralis (LR) with a paricular pars made by the amygdalar coterritory (LRM). An atlas of the macaque motor thalamus; comprising twelve levels; is presented; with mean dimensions for Macaca mulatta. Boundaries are not primarily cytoarchitectonic but topographic territories and sources spaces. This produces a modified parcellation of the macaque thalamus. Each level is described and compared to Olszewski's equivalent level. The new atlas can be used confidently for stereotactic purpose in macaques of various species.,primate; motor system; cerebellum; basal ganglia; thalamus; SINGLE-UNIT ANALYSIS; POSITRON EMISSION TOMOGRAPHY; THALAMOCORTICAL PROJECTION NEURONS; VENTRAL SPINOTHALAMIC PATHWAYS; MEDIAN-PARAFASCICULAR COMPLEX; MONKEY SOMATOSENSORY CORTEX; POSTERIOR PARIETAL CORTEX; SUPPLEMENTARY EYE FIELD; SOMATIC SENSORY CORTEX; DORSAL COLUMN NUCLEI
930,10.1017/s0952523899165131,10580729.0,,https://www.cambridge.org/core/journals/visual-neuroscience/article/abs/stereological-analysis-of-the-lateral-geniculate-nucleus-in-adult-macaca-nemestrina-monkeys/5A9421925ACCBFADACA1A79A41D42C09,www.cambridge.org,,,A stereological analysis of the lateral geniculate nucleus in adult Macaca nemestrina monkeys,The Cavalieri method and the optical fractionator were employed to estimate the volume and neuron numbers respectively of the dorsal lateral geniculate nucleus dLGN in seven adult male pigtail monkeys Macaca nemestrina Unbiased estimates were selectively obtained for the parvocellular P magnocellular M and interlaminar plus superficial I  S layers of the nucleus The dLGN had a mean volume of  mm and contained on average  million neurons The P layers contributed  of the volume and  of the neurons in the dLGN the corresponding proportions for the other layers were  and  M and  and  I  S Interindividual variability was large for neuron counts which varied within a two-fold range and lower for volume estimates Since no published data are available for the pigtail dLGN the present results are compared with quantitative studies of the dLGN in other macaque species placing special emphasis in the discussion of the methodologies used,Stereology; Neuron number; Thalamus; Visual pathways; Macaque;
939,10.1016/s0940-9602(03)80051-1,12924469.0,,https://linkinghub.elsevier.com/retrieve/pii/S0940960203800511,linkinghub.elsevier.com,://linkinghub.elsevier.com/,linkinghub.elsevier.com,Three-dimensional reconstruction of a Rhesus monkey brain from the Friedrich Sanides collection,For this study serial sections of a rhesus monkey brain prepared by Friedrich Sanides  were used to examine the architectonic parcellation of the cerebral cortex The sections through the anterior part of a rhesus monkey brain  sections stained for myeloarchitecture and  sections stained for cytoarchitecture were digitally photographed three-dimensionally aligned to each other and three-dimensionally reconstructed For three-dimensional registration of the sections rigid transformations were applied with the Euclidian distance as fit criterion Afterwards the derived volume was used for manual segmentation of several central structures of the monkey brain caudate nucleus putamen pallidum thalamus ventricles cortex hippocampus amygdala etc Thus a three-dimensional model of the rhesus monkey brain was developed which can be used as a three-dimensional framework for mapping morphological structures as basis for a digital atlas,Sanides; monkey brain; atlas; three-dimensional reconstruction; registration; SPEECH
960,10.1016/j.brainres.2006.07.043,16935269.0,,https://linkinghub.elsevier.com/retrieve/pii/S0006899306021457,linkinghub.elsevier.com,://linkinghub.elsevier.com/,linkinghub.elsevier.com,Metabolic thalamocortical correlations during a verbal learning task and their comparison with correlations among regional volumes,Methods based on the analysis of metabolic and volumetric interregional correlations have been used in neuroimaging research yet metabolic and volumetric interregional correlations for identical regions of interest have never been compared in the same group of subjects Magnetic resonance and F-fluorodeoxyglucose positron emission tomography brain images were acquired in  healthy subject Correlation matrices for relative glucose metabolic rates during a verbal learning task and for relative gray matter volumes were compiled between the manually traced mediodorsal centromedian and pulvinar nuclei of the thalamus and  cortical Brodmanns areas Metabolic correlations between the cortex and these thalamic nuclei followed the known patterns of anatomical connectivity in non-human primates Intercorrelations of the mediodorsal nucleus were widespread with the prefrontal cortex  out of  Brodmanns areas in the left hemisphere and temporal lobe  out of  Brodmanns areas in the left hemisphere while the pulvinar correlated only with the parietal and occipital cortical areas Different correlation patterns were observed for the regional gray matter volumes whereby only the pulvinar yielded extensive cortical intercorrelations primarily with the occipital parietal anterior cingulate and orbitofrontal areas in the right hemisphere Metabolic thalamocortical correlations were much more extensive for the mediodorsal and centromedian nuclei whereas structural correlations were more extensive for the pulvinar Therefore metabolic and volumetric correlational methods are sensitive to different aspects of interregional relations in the brain and their comparison in the same group of subjects may render complementary and only partially overlapping connectivity information,magnetic resonance imaging; positron emission tomography; interregional correlation; thalamic nuclei; verbal learning; CEREBRAL GLUCOSE-METABOLISM; CORTICAL BRODMANNS AREAS; SCHIZOTYPAL PERSONALITY-DISORDER; THALAMIC MEDIODORSAL NUCLEUS; MEDIAL PULVINAR CONNECTIONS; POSTERIOR PARIETAL CORTEX; RHESUS-MONKEY; PREFRONTAL CORTEX; MACAQUE MONKEY; CORTICOTHALAMIC CONNECTIONS
993,10.1016/s0197-4580(03)00044-7,14749136.0,,https://linkinghub.elsevier.com/retrieve/pii/S0197458003000447,linkinghub.elsevier.com,://linkinghub.elsevier.com/,linkinghub.elsevier.com,Effects of age and sex on volumes of the thalamus; pons; and cortex,Volumes of thalamus pons cortical gray matter and white matter were derived from MR brain images of healthy men and women spanning the adult age range in order to delineate patterns of aging and to compare age and sex effects in thalamus and pons with such effects in cortical gray and white matter volumes Men had larger intracranial volume ICV than women but ICV did not correlate with age in either sex Thalamic pontine and cortical white matter volumes did not differ between men and women once ICV differences were taken into account but men had more cortical gray matter than women even after accounting for ICV Volumes of pons and thalamus were associated independent of ICV in women but not in men Thalamic volume declined linearly with age at a similar rate in both men and women whereas cortical gray matter volume declined more steeply with age in men than women Both pontine and cortical white matter volumes remained stable across the age span in both men and women,MRI; age; pons; thalamus; white matter; gray matter; cortex; sex; WHITE-MATTER CHANGES; OBSERVED IN-VIVO; GRAY-MATTER; CORPUS-CALLOSUM; BRAIN-STEM; ALZHEIMER-DISEASE; PREFRONTAL GRAY; RHESUS-MONKEY; BASAL GANGLIA; MR
995,10.1016/j.jchemneu.2004.09.003,15589702.0,,https://linkinghub.elsevier.com/retrieve/pii/S0891061804001218,linkinghub.elsevier.com,://linkinghub.elsevier.com/,linkinghub.elsevier.com,Sex differences in cytochrome P450 1B1; an estrogen-metabolizing enzyme; in the rhesus monkey telencephalon,The metabolic enzyme CYPB is a recently cloned member of the cytochrome P superfamily expressed widely throughout primate tissue including the CNS Although CYPB protein is known to metabolize estradiol to catecholestrogens in the uterus its localization and function in brain have not yet been described To better understand CYPB distribution we have combined in situ hybridization ISH for its mRNA with immunohistochemistry IHC for the CYPB protein in selected brain regions of male and female adult rhesus monkeys Macaca mulatta Blocks of formalin-fixed tissue obtained from the frontal cortex hippocampus thalamus and amygdala were processed and embedded in paraffin They were then sectioned and stained as described for human tissue Muskhelishvili L Thompson PA Kusewitt DF Wang C Kadlubar FF  In situ hybridization and immunohistochemical analysis of cytochrome P B expression in human normal tissues J Histochem Cytochem   Results indicated widespread distribution of CYPB mRNA in both male and female monkey frontal cortex hippocampus thalamus and amygdala In contrast although CYPB protein was co-localized with its mRNA in the female brains it was primarily restricted to hippocampal pyramidal neurons in the male brains These results suggest that CYPB may subserve widespread metabolic functions in the female primate brain but have more restricted actions within the hippocampal pyramidal neurons of the male,in situ hybridization; immunohistochemistry; sex differences; catecholestrogen; estrogen; dopamine; CATECHOL-O-METHYLTRANSFERASE; MESSENGER-RNA; PITUITARY-GLAND; ESTRADIOL; RECEPTOR; CATECHOLESTROGENS; EXPRESSION; BINDING; BRAIN; 2-HYDROXYESTRADIOL
997,10.1016/j.jocn.2008.03.018,19167229.0,,https://linkinghub.elsevier.com/retrieve/pii/S096758680800218X,linkinghub.elsevier.com,://linkinghub.elsevier.com/,linkinghub.elsevier.com,Cortical and subcortical connections within the pedunculopontine nucleus of the primate Macaca mulatta determined using probabilistic diffusion tractography,The anatomical connections of the pedunculopontine nucleus PPN a brainstem structure associated with locomotion have been determined recently in healthy humans using probabilistic diffusion tractography PDT In order to compare these with histologically demonstrated connections of the PPN in monkeys and thus to support the use of PDT in humans we have carried out PDT in a fixed rhesus monkey Macaca mulatta brain Probabilistic diffusion tractography was carried out in a fixed post-mortem rhesus monkey brain using diffusion data acquired at T MRI  directions   averages b   smm matrix size            μm voxels We identified the major connections of the PPN from single seed voxels that could be confidently located within the nucleus on the diffusion images The organisation of these connections within a      voxel  mm region surrounding the initial seed voxel was then examined PDT confirmed that the rhesus monkey PPN connections with the basal ganglia and motor cortical areas matched those previously demonstrated using conventional anatomical tracing techniques Furthermore although the organisation of subcortical connections within the PPN has not been extensively demonstrated in animals we show here in a rhesus monkey that there are clearly separated connections of the PPN with the thalamus substantia nigra and subthalamic nucleus Thus in addition to increasing confidence in the accuracy of PDT for tracing PPN connections and determining the organisation of these connections within the PPN in vivo our observations suggest that diffusion tractography will be a useful new technique to rapidly identify connections in animal brains pre-mortem and post-mortem,MESENCEPHALIC LOCOMOTOR REGION; DEEP BRAIN-STIMULATION; CENTRAL-NERVOUS-SYSTEM; TEGMENTAL NUCLEUS; SQUIRREL-MONKEY; EXPERIMENTAL PARKINSONISM; MESOPONTINE TEGMENTUM; HUMAN THALAMUS; BASAL-GANGLIA; PROJECTIONS
