10.1152/jn.2001.85.1.219,11152722,,Effect of attentive fixation in macaque thalamus and cortex,https://journals.physiology.org/doi/10.1152/jn.2001.85.1.219,journals.physiology.org,https://journals.physiology.org/doi/pdf/10.1152/jn.2001.85.1.219
,,,"The thalamus of the Macaca, mulatta. An atlas for use with the stereotaxic instrument.",https://www.cabdirect.org/cabdirect/welcome/?target=%2Fcabdirect%2Fabstract%2F19522203025,www.cabdirect.org,
10.1016/j.neuroimage.2006.07.032,17140815,,Distribution of the dopamine innervation in the macaque and human thalamus,https://linkinghub.elsevier.com/retrieve/pii/S1053811906007609,linkinghub.elsevier.com,
10.1523/jneurosci.14-05-02485.1994,7514207,PMC6577493,Medial lemniscal and spinal projections to the macaque thalamus: an electron microscopic study of differing GABAergic circuitry serving thalamic somatosensory …,https://www.ncbi.nlm.nih.gov/pmc/articles/PMC6577493/,www.ncbi.nlm.nih.gov,https://www.jneurosci.org/content/jneuro/14/5/2485.full.pdf
10.1038/372770a0,7695716,,A thalamic nucleus specific for pain and temperature sensation,https://www.nature.com/articles/372770a0,www.nature.com,https://www.nature.com/articles/372770a0.pdf
10.1093/brain/93.1.37,4984909,,Connexions of the somatic sensory cortex of the rhesus monkey: III.—thalamic connexions,https://academic.oup.com/brain/article/93/1/37/257010,academic.oup.com,https://citeseerx.ist.psu.edu/document?repid=rep1&type=pdf&doi=086111ccf8db5585f16a54ba754ea75ebac97d6c
