url,title,full_text_url,full_text_type,full_text_source
https://journals.physiology.org/doi/abs/10.1152/jn.2001.85.1.219,Effect of attentive fixation in macaque thalamus and cortex,https://journals.physiology.org/doi/pdf/10.1152/jn.2001.85.1.219,[PDF],physiology.org
https://www.cabdirect.org/cabdirect/abstract/19522203025,"The thalamus of the Macaca, mulatta. An atlas for use with the stereotaxic instrument.",not found,not found,not found
https://www.sciencedirect.com/science/article/pii/S1053811906007609,Distribution of the dopamine innervation in the macaque and human thalamus,https://www.sciencedirect.com/science/article/pii/S1053811906007609,[HTML],sciencedirect.com
https://www.jneurosci.org/content/14/5/2485.short,Medial lemniscal and spinal projections to the macaque thalamus: an electron microscopic study of differing GABAergic circuitry serving thalamic somatosensory …,https://www.jneurosci.org/content/jneuro/14/5/2485.full.pdf,[PDF],jneurosci.org
https://onlinelibrary.wiley.com/doi/abs/10.1002/cne.903130106,Diverse thalamic projections to the prefrontal cortex in the rhesus monkey,https://onlinelibrary.wiley.com/doi/pdf/10.1002/cne.903130106,[PDF],wiley.com
https://www.nature.com/articles/372770a0,A thalamic nucleus specific for pain and temperature sensation,https://www.nature.com/articles/372770a0.pdf,[PDF],nature.com
https://citeseerx.ist.psu.edu/document?repid=rep1&type=pdf&doi=086111ccf8db5585f16a54ba754ea75ebac97d6c,Connexions of the somatic sensory cortex of the rhesus monkey: III.—thalamic connexions,https://citeseerx.ist.psu.edu/document?repid=rep1&type=pdf&doi=086111ccf8db5585f16a54ba754ea75ebac97d6c,[PDF],psu.edu
https://onlinelibrary.wiley.com/doi/abs/10.1002/(SICI)1096-9861(19981019)400:2%3C271::AID-CNE8%3E3.0.CO;2-6,Thalamocortical connections of the parabelt auditory cortex in macaque monkeys,https://onlinelibrary.wiley.com/doi/pdf/10.1002/(SICI)1096-9861(19981019)400:2%3C271::AID-CNE8%3E3.0.CO;2-6,[PDF],wiley.com
https://onlinelibrary.wiley.com/doi/abs/10.1002/(SICI)1096-9861(19960812)372:1%3C59::AID-CNE6%3E3.0.CO;2-L,Thalamic input to mesial and superior area 6 in the macaque monkey,https://onlinelibrary.wiley.com/doi/pdf/10.1002/(SICI)1096-9861(19960812)372:1%3C59::AID-CNE6%3E3.0.CO;2-L,[PDF],wiley.com
https://www.sciencedirect.com/science/article/pii/0165017396000033,The primate motor thalamus,https://www.sciencedirect.com/science/article/pii/0165017396000033,[HTML],sciencedirect.com
https://www.nature.com/articles/nn.4423,Gravity orientation tuning in macaque anterior thalamus,https://www.nature.com/articles/nn.4423,[HTML],nature.com
https://onlinelibrary.wiley.com/doi/abs/10.1002/cne.902570211,Crossed corticothalamic and thalamocortical connections of macaque prefrontal cortex,https://onlinelibrary.wiley.com/doi/pdf/10.1002/cne.902570211,[PDF],wiley.com
https://onlinelibrary.wiley.com/doi/abs/10.1002/cne.902620207,Cingulate cortex of the rhesus monkey: I. Cytoarchitecture and thalamic afferents,https://onlinelibrary.wiley.com/doi/pdf/10.1002/cne.902620207,[PDF],wiley.com
https://onlinelibrary.wiley.com/doi/abs/10.1002/cne.902440208,"Projections of thalamic gustatory and lingual areas in the monkey, Macaca fascicularis",https://onlinelibrary.wiley.com/doi/pdf/10.1002/cne.902440208,[PDF],wiley.com
https://link.springer.com/article/10.1007/s00429-022-02463-4,Spatial–temporal topography in neurogenesis of the macaque thalamus,https://link.springer.com/article/10.1007/s00429-022-02463-4,[HTML],springer.com
https://www.sciencedirect.com/science/article/pii/0006899377905364,… study of the projections of the pretectum in the rhesus monkey (Macaca mulatta): evidence for sensorimotor links to the thalamus and oculomotor nuclei,"/scholar?output=instlink&q=info:5ATFj1W-4xAJ:scholar.google.com/&hl=en&as_sdt=0,5&scillfp=18393026530847078361&oi=lle",UB,RWTH-Link
https://link.springer.com/article/10.1007/bf00236173,Organization of the thalamo-cortical connexions to the frontal lobe in the rhesus monkey,https://link.springer.com/content/pdf/10.1007/BF00236173.pdf,[PDF],springer.com
https://onlinelibrary.wiley.com/doi/abs/10.1002/cne.902620303,Sagittal cytoarchitectonic maps of the Macaca mulatta thalamus with a revised nomenclature of the motor‐related nuclei validated by observations on their …,https://onlinelibrary.wiley.com/doi/pdf/10.1002/cne.902620303,[PDF],wiley.com
https://onlinelibrary.wiley.com/doi/abs/10.1002/cne.902360304,Organization of the nigrothalamocortical system in the rhesus monkey,https://onlinelibrary.wiley.com/doi/pdf/10.1002/cne.902360304,[PDF],wiley.com
https://journals.physiology.org/doi/abs/10.1152/jn.1989.61.1.1,Neural coding of gustatory information in the thalamus of Macaca mulatta,https://journals.physiology.org/doi/pdf/10.1152/jn.1989.61.1.1,[PDF],physiology.org
https://www.sciencedirect.com/science/article/pii/S0168010298000212,Distribution of nociceptive neurons in the ventrobasal complex of macaque thalamus,https://www.sciencedirect.com/science/article/pii/S0168010298000212,[HTML],sciencedirect.com
https://link.springer.com/article/10.1007/BF00250573,Motor learning in monkeys (Macaca fascicularis) with lesions in motor thalamus,https://link.springer.com/content/pdf/10.1007/BF00250573.pdf,[PDF],springer.com
https://onlinelibrary.wiley.com/doi/abs/10.1002/cne.902520305,Thalamic connectivity of the second somatosensory area and neighboring somatosensory fields of the lateral sulcus of the macaque,https://onlinelibrary.wiley.com/doi/pdf/10.1002/cne.902520305,[PDF],wiley.com
https://onlinelibrary.wiley.com/doi/abs/10.1002/cne.901950105,Projections of the cerebellar and dorsal column nuclei upon the thalamus of the rhesus monkey,https://onlinelibrary.wiley.com/doi/pdf/10.1002/cne.901950105,[PDF],wiley.com
https://link.springer.com/article/10.1007/BF00237252,Vestibular responses in the rhesus monkey ventroposterior thalamus. II. Vestibulo-proprioceptive convergence at thalamic neurons,https://link.springer.com/content/pdf/10.1007/BF00237252.pdf,[PDF],springer.com
https://onlinelibrary.wiley.com/doi/abs/10.1002/cne.903370102,The organization of projections from the mediodorsal nucleus of the thalamus to orbital and medial prefrontal cortex in macaque monkeys,https://onlinelibrary.wiley.com/doi/pdf/10.1002/cne.903370102,[PDF],wiley.com
https://onlinelibrary.wiley.com/doi/abs/10.1002/cne.902950212,Anatomical investigation of projections from thalamus to posterior parietal cortex in the rhesus monkey: A WGA‐HRP and fluorescent tracer study,https://onlinelibrary.wiley.com/doi/pdf/10.1002/cne.902950212,[PDF],wiley.com
https://www.cambridge.org/core/journals/visual-neuroscience/article/segregated-thalamocortical-pathways-to-inferior-parietal-and-inferotemporal-cortex-in-macaque-monkey/D15415AF6BF28483F6B6676F4EA32B81,Segregated thalamocortical pathways to inferior parietal and inferotemporal cortex in macaque monkey,not found,not found,not found
https://europepmc.org/article/med/816421,Thalamic projections from the precentral motor cortex in Macaca fascicularis.,"/scholar?output=instlink&q=info:Oy7d_i9ryd0J:scholar.google.com/&hl=en&as_sdt=0,5&scillfp=2537219714019887435&oi=lle",UB,RWTH-Link
https://link.springer.com/article/10.1007/bf00237670,The thalamic connections with medial area 6 (supplementary motor cortex) in the monkey (macaca fascicularis),https://link.springer.com/content/pdf/10.1007/BF00237670.pdf,[PDF],springer.com
