"10.1002/(sici)1096-9861(20000529)421:2<172::aid-cne4>3.0.co;2-8",,,"https://onlinelibrary.wiley.com/doi/abs/10.1002/(SICI)1096-9861(20000529)421:2%3C172::AID-CNE4%3E3.0.CO;2-8","https://onlinelibrary.wiley.com/doi/pdfdirect/10.1002/%28SICI%291096-9861%2820000529%29421%3A2%3C172%3A%3AAID-CNE4%3E3.0.CO%3B2-8","Subcortical projections of area 25 (subgenual cortex) of the macaque monkey"
"10.1016/0304-3940(75)90003-8",,,"https://www.sciencedirect.com/science/article/pii/0304394075900038",,"Evidence for a projection to the thalamus from the external cuneate nucleus in the monkey"
"10.1002/cne.902140206",,,"https://onlinelibrary.wiley.com/doi/abs/10.1002/cne.902140206","https://onlinelibrary.wiley.com/doi/pdf/10.1002/cne.902140206","… : cytochemistry and cortical connections of the septal area, diagonal band nuclei, nucleus basalis (substantia innominata), and hypothalamus in the rhesus monkey"
"10.1007/bf00236848",,,"https://link.springer.com/article/10.1007/BF00236848","https://link.springer.com/content/pdf/10.1007/BF00236848.pdf","Extent of the ipsilateral representation in the ventral posterior medial nucleus of the monkey thalamus"
"10.1002/cne.22197",,,"https://onlinelibrary.wiley.com/doi/abs/10.1002/cne.22197","https://onlinelibrary.wiley.com/doi/pdf/10.1002/cne.22197","Localization of relaxin‐3 in brain of Macaca fascicularis: Identification of a nucleus incertus in primate"
"10.1002/cne.901040106",,,"https://onlinelibrary.wiley.com/doi/abs/10.1002/cne.901040106","https://onlinelibrary.wiley.com/doi/pdf/10.1002/cne.901040106","Cortical projection of the thalamic ventrolateral nuclear group in monkeys"
"10.1016/b978-0-08-042274-9.50020-1",,,"https://www.sciencedirect.com/science/article/pii/B9780080422749500201",,"Anatomical organisation of internal neuronal circuits in the motor thalamus"
"10.1038/s41467-018-08151-4",,,"https://www.nature.com/articles/s41467-018-08151-4",,"The mediodorsal pulvinar coordinates the macaque fronto-parietal network during rhythmic spatial attention"
"10.1016/s0361-9230(99)00245-2",,,"https://www.sciencedirect.com/science/article/pii/S0361923099002452",,"Connections underlying the synthesis of cognition, memory, and emotion in primate prefrontal cortices"
"10.1016/j.neuroscience.2004.08.016",,,"https://www.sciencedirect.com/science/article/pii/S0306452204007353",,"Subcortical afferents to the lateral mediodorsal thalamus in cynomolgus monkeys"
"10.1016/s0361-9230(00)00364-6",,,"https://www.sciencedirect.com/science/article/pii/S0361923000003646",,"A comparative analysis of the morphology of corticothalamic projections in mammals"
"10.1002/cne.903490404",,,"https://onlinelibrary.wiley.com/doi/abs/10.1002/cne.903490404","https://onlinelibrary.wiley.com/doi/pdf/10.1002/cne.903490404","Architectonic subdivisions of the motor thalamus of owl monkeys: Nissl, acetylcholinesterase, and cytochrome oxidase patterns"
,,,"https://open.bu.edu/handle/2144/12127",,"Orexin axon density and bouton quantification in the aging rhesus macaque thalamus: a novel methodology"
"10.1002/cne.21096",,,"https://onlinelibrary.wiley.com/doi/abs/10.1002/cne.21096","https://onlinelibrary.wiley.com/doi/pdf/10.1002/cne.21096","Differential expression of muscarinic acetylcholine receptors across excitatory and inhibitory cells in visual cortical areas V1 and V2 of the macaque monkey"
"10.1523/JNEUROSCI.5580-10.2011",,,"https://www.jneurosci.org/content/31/13/4935.short","https://www.jneurosci.org/content/jneuro/31/13/4935.full.pdf","Neuronal mechanisms and attentional modulation of corticothalamic alpha oscillations"
"10.1159/000459859",,,"https://karger.com/jmd/article-abstract/4/4/217/181004/Ventricular-Landmarks-for-Thalamic-Stereotaxy-in?redirectedFrom=fulltext",,"Ventricular Landmarks for Thalamic Stereotaxy in Macaco"
"10.1016/0006-8993(77)90453-x",,,"https://www.sciencedirect.com/science/article/pii/000689937790453X",,"Columnar distribution of cortico-cortical fibers in the frontal association, limbic, and motor cortex of the developing rhesus monkey"
"10.1002/cne.10731",,,"https://onlinelibrary.wiley.com/doi/abs/10.1002/cne.10731","https://onlinelibrary.wiley.com/doi/pdf/10.1002/cne.10731","Cortical connections of the second somatosensory area and the parietal ventral area in macaque monkeys"
"10.1111/j.1460-9568.1997.tb01659.x",,,"https://onlinelibrary.wiley.com/doi/abs/10.1111/j.1460-9568.1997.tb01659.x","https://onlinelibrary.wiley.com/doi/pdf/10.1111/j.1460-9568.1997.tb01659.x","The recognition memory deficit caused by mediodorsal thalamic lesion in non‐human primates: a comparison with rhinal cortex lesion"
"10.1016/0168-0102(94)90069-8",,,"https://www.sciencedirect.com/science/article/pii/0168010294900698",,"Site of origin of projections from the thalamus to dorsal versus ventral aspects of the premotor cortex of monkeys"
"10.1152/jn.00738.2003",,,"https://journals.physiology.org/doi/abs/10.1152/jn.00738.2003",,"What the brain stem tells the frontal cortex. I. Oculomotor signals sent from superior colliculus to frontal eye field via mediodorsal thalamus"
"10.1007/s00429-013-0507-9",,,"https://link.springer.com/article/10.1007/s00429-013-0507-9",,"Neuronal loss in the caudal intralaminar thalamic nuclei in a primate model of Parkinson's disease"
"10.1093/cercor/bhq201",,,"https://academic.oup.com/cercor/article/21/6/1254/343888",,"Weight consistency specifies regularities of macaque cortical networks"
"10.1017/s0952523817000049",,,"https://www.cambridge.org/core/journals/visual-neuroscience/article/thalamocortical-processing-in-vision/3E276038F626B35F4DF7FAEDBFE26C07",,"Thalamocortical processing in vision"
"10.1152/jn.00235.2005",,,"https://journals.physiology.org/doi/abs/10.1152/jn.00235.2005",,"Vagal-evoked activity in the parafascicular nucleus of the primate thalamus"
"10.1111/j.1460-9568.2005.04450.x",,,"https://onlinelibrary.wiley.com/doi/abs/10.1111/j.1460-9568.2005.04450.x","https://onlinelibrary.wiley.com/doi/pdf/10.1111/j.1460-9568.2005.04450.x","Projections from the hippocampal region to the mammillary bodies in macaque monkeys"
"10.1017/s0952523800171056",,,"https://www.cambridge.org/core/journals/visual-neuroscience/article/abs/burst-and-tonic-firing-in-thalamic-cells-of-unanesthetized-behaving-monkeys/C2E671E18B84923356CADF457C32F292","https://citeseerx.ist.psu.edu/document?repid=rep1&type=pdf&doi=55488151fe8f16fdd575d5e804f934730a6a0ee3","Burst and tonic firing in thalamic cells of unanesthetized, behaving monkeys"
"10.1016/0165-0173(83)90015-2",,,"https://www.sciencedirect.com/science/article/pii/0165017383900152",,"Distribution of cerebellar terminations and their relation to other afferent terminations in the ventral lateral thalamic region of the monkey"
"10.1523/JNEUROSCI.2419-07.2007",,,"https://www.jneurosci.org/content/27/43/11573.short","https://www.jneurosci.org/content/jneuro/27/43/11573.full.pdf","Efferent association pathways from the rostral prefrontal cortex in the macaque monkey"
"10.1002/cne.10659",,,"https://onlinelibrary.wiley.com/doi/abs/10.1002/cne.10659","https://onlinelibrary.wiley.com/doi/pdf/10.1002/cne.10659","Localization of [3H]nicotine, [3H]cytisine, [3H]epibatidine, and [125I]α‐bungarotoxin binding sites in the brain of Macaca mulatta"
"10.1093/brain/106.3.655",,,"https://academic.oup.com/brain/article/106/3/655/271937","https://watermark.silverchair.com/106-3-655.pdf?token=AQECAHi208BE49Ooan9kkhW_Ercy7Dm3ZL_9Cf3qfKAc485ysgAAA3AwggNsBgkqhkiG9w0BBwagggNdMIIDWQIBADCCA1IGCSqGSIb3DQEHATAeBglghkgBZQMEAS4wEQQM_Nui4LPz7CKg-bHxAgEQgIIDI-Mn39Z_G4_RKQSnkxffMYGa_af-THDgWANN-YGdvfImgrZ1PpLJGD_NRKxc-9aQxz9U9RE4fP807bRUQqbewjiSJScVlxjI1Z85IRjpTo7GM6D2VoW-lQZGDH32N8Z30uoNi_n-3oZoApvNhkLqvxMECpgGhp9TIPiLtl9s6SNYaS4mPCHHyOAYbmYIHh7XEb1oABpqXd6JApi3rC6PkeHM-ie9ZoKpAqXl_rrq9AQWAAs2bPXjP7mJ2S2s6aWslpy5IFXLRCcdyd_u7rUCdj21CLJ2QuGUB-RB76Hn8Ey59IT64IV-fNhwn7znNzduzKpZ4qoSu-fh_YdF92ZoMelxCkRM4CI_WBKbWGgB4QNPuV5K0bqgo8rkpK-vYekdwuvzbRHlNPj-VgdM7gp8wrp29INzVUDwD39q6AyrGZZHrKS-FYgb0Hh6Eg8LlCqLoQTf7qHe2vtLKfFAfETtlMW72raLzQagjhlKmzOC656X-2a6Mad_GNfnZ6FSbOVsAGfVIjun9M1QpJkUcGgfBEd0qudXJVYYfciSRq-V4p-unCX71UCNiwMK41zPgbI6zmp9hzSdt6Uw8LD7OOKgAOHSm0NQKLIgfhvYZx4nWcB8V4wsNk6rURvaE2VPW2h6hUSraO7EyQlaPzIksRuOYsCNd-t65CfSmBKfd48aHDlEgHrPi99jchQ09cEqz1S4n4VqwTFo7m5YL8W_erVyn_twsivm_Llo_WvGM0ZeCmbxPGH-C-rVCdGgH2befqvm5IjkgPSOqtH6Cu7mSC6vefBQa1nNfJzyKP5Qe3WOIeYdn60wtEpwlz0y6MVESeuWjg2Jj_OwxveNTxyISLqNZBPziMI7d7jcnpTp1nv8kSVGUI-cmq72XSw5PmuFpJT9AzhjVj556JQXyE9WZTXJhRcjj7FZP9OIbooWUV3aJZyfFhYepXGXTyIO51A92Occ_Ma86t25AxDFcjcqrEHmOPGnU2qVamLtcmu5MMHMvK-FBHoWeHlYrYzCHUiiZP3t2YydkJxs9pbPhXC96jiI88nNkmAwOkKzjAyBOv0Y4E4xOw-3","Deficits in attention and movement following the removal of postarcuate (area 6) and prearcuate (area 8) cortex in macaque monkeys"
"10.3109/08990229109144748",,,"https://www.tandfonline.com/doi/abs/10.3109/08990229109144748","https://www.tandfonline.com/doi/pdf/10.3109/08990229109144748","Immediate expansion of receptive fields of neurons in area 3b of macaque monkeys after digit denervation"
"10.1111/j.1749-6632.2009.04534.x",,,"https://nyaspubs.onlinelibrary.wiley.com/doi/abs/10.1111/j.1749-6632.2009.04534.x","https://nyaspubs.onlinelibrary.wiley.com/doi/pdfdirect/10.1111/j.1749-6632.2009.04534.x","Synchrony in the interconnected circuitry of the thalamus and cerebral cortex"
"10.1016/s0387-7604(00)00139-x",,,"https://www.sciencedirect.com/science/article/pii/S038776040000139X",,"Neural circuits and topographic organization of the basal ganglia and related regions"
"10.1007/s002210000464",,,"https://link.springer.com/article/10.1007/s002210000464","https://link.springer.com/content/pdf/10.1007/s002210000464.pdf","Bilateral receptive field neurons in the hindlimb region of the postcentral somatosensory cortex in awake macaque monkeys"
"10.1523/JNEUROSCI.2344-19.2020",,,"https://www.jneurosci.org/content/40/33/6367.abstract","https://www.jneurosci.org/content/jneuro/40/33/6367.full.pdf","Organization of corollary discharge neurons in monkey medial dorsal thalamus"
"10.1016/j.cortex.2012.07.006",,,"https://www.sciencedirect.com/science/article/pii/S0010945212002389",,"The influence of preterm birth on the developing thalamocortical connectome"
"10.1016/0149-7634(94)00053-4",,,"https://www.sciencedirect.com/science/article/pii/0149763494000534",,"Anatomic basis of cognitive-emotional interactions in the primate prefrontal cortex"
"10.1016/j.neuroscience.2004.06.071",,,"https://www.sciencedirect.com/science/article/pii/S0306452204006244","https://simonyanlab.meei.harvard.edu","Afferent subcortical connections into the motor cortical larynx area in the rhesus monkey"
"10.1371/journal.pbio.3000639",,,"https://journals.plos.org/plosbiology/article%3Fid%3D10.1371/journal.pbio.3000639?revisionLink=/plosbiology/article%3Fid%3D10.1371/journal.pbio.3000639%26rev%3D2",,"Organization of primate amygdalar–thalamic pathways for emotions"
"10.1093/cercor/5.6.518",,,"https://academic.oup.com/cercor/article/5/6/518/309841","https://watermark.silverchair.com/5-6-518.pdf?token=AQECAHi208BE49Ooan9kkhW_Ercy7Dm3ZL_9Cf3qfKAc485ysgAAA2swggNnBgkqhkiG9w0BBwagggNYMIIDVAIBADCCA00GCSqGSIb3DQEHATAeBglghkgBZQMEAS4wEQQMviNfmY9HAGbvCxopAgEQgIIDHigO6Z-NYgMey6F2DGouDdavxJBA6bjQY14TidD3LdHpNy8tmv8WV4oMuvtZOkq12BptZPshJI9u2nVkc2jt7WVAxyko_FkCM9laNes1AloWxFt4Uq16xofWNwk6h_oILSQi4LegNJ7pvtVqssxyQHiHIz45E22tP6ylpc4AIroBsDB_qU0yCUBsr168VlmtkCbGIewTpNOytRXSiI67W0I256P7r5whlwLM0M5T5Chw23qGVFKftdsscDgHGGLgeCwA0tD09I80D-UZ03GwZcPbTgJPDwzuhjeOXp9ZKSW3mXUkYU7RR8X7hQwZZDOH41f5aS6gb7yp51xk3BKtqUwuHWHpmPPg3EKbd4UmFy1QnP9oPAjmtg5yqyYlgDovRIymAXXdel5uRzqy6NHuoFMDS05ebzm1BxTuaYAVTjrbLSIOdfKr1ziJR2MpKXVPTx5olu-hqIfjoOpZYP_G6tYb7KqnYy41gnTELfjlqNmeruGPGWiLFiSbcOoaqx63Vf7rVx2_ZBcNDe4gprTn8ZGr26naLt2oy264JrKK2gt1sDV_idUd5Ge276manX0WNmc17maHNcLZLeZRm2f9FOMOr6iqCNwHGWNSVDwnitZW9E62fH8rMrazdY1KGOLaD7tQj7k2QcKT1f2gmTr-lKD3pAxtIk57pgss0llVGWDkYEyFQ_0rd98Hc8evF-KiFQV7xAUIwwiOlQrpDJx_KJ4MI4idN_F4pbUx-lbG5fHke1Zd8-0-jXpqYpUz_fOd3Oa1ALjmcjOEkpDwGbXyZLMQdtDS8U0gr81HIDM2JjaGe5MdxMGm4n8bYJSNNuJmlbg6DqAT-NqoullULfBQ9_uDDi7M6XOAINfNFJN_fT5fuwWXq_VRcwanVOZEJ0oU1kUhHvQK_DvxJXDOKWVlu_VxuRk7NwRMZRLWJ11dG3Up5NhyTyUFJvEcLll3yeejyLe93576SZQmxpk-9doEVRstqYxYJjEaV_woGAWTjwuiWQsyjSZme4L2Jy7ZbGPHTJXDQaOI7zz1ZAdQfNB_AWo0qUxPL7Hh5sqwRugtYg","Postnatal maturation of the direct corticospinal projections in the macaque monkey"
"10.1111/j.1460-9568.1996.tb01581.x",,,"https://onlinelibrary.wiley.com/doi/abs/10.1111/j.1460-9568.1996.tb01581.x","https://onlinelibrary.wiley.com/doi/pdf/10.1111/j.1460-9568.1996.tb01581.x","Synaptogenesis in the occipital cortex of macaque monkey devoid of retinal input from early embryonic stages"
"10.1016/0014-4886(59)90032-9",,,"https://www.sciencedirect.com/science/article/pii/0014488659900329",,"Brain damage in the monkey, Macaca mulatta, by asphyxia neonatorum"
"10.1002/ana.410130405",,,"https://onlinelibrary.wiley.com/doi/abs/10.1002/ana.410130405","https://onlinelibrary.wiley.com/doi/pdf/10.1002/ana.410130405","Intermittent thiamine deficiency in the rhesus monkey. II. Evidence for memory loss"
"10.1093/cercor/bhi124",,,"https://academic.oup.com/cercor/article/16/4/447/382152",,"Distribution of activity across the monkey cerebral cortical surface, thalamus and midbrain during rapid, visually guided saccades"
"10.1002/1096-9861(20000108)429:2<321::aid-cne11>3.0.co;2-a",,,"https://onlinelibrary.wiley.com/doi/abs/10.1002/1096-9861(20000108)429:2%3C321::AID-CNE11%3E3.0.CO;2-A","https://onlinelibrary.wiley.com/doi/pdf/10.1002/1096-9861(20000108)429:2%3C321::AID-CNE11%3E3.0.CO;2-A","Organization of thalamostriatal terminals from the ventral motor nuclei in the macaque"
"10.1002/cne.902000309",,,"https://onlinelibrary.wiley.com/doi/abs/10.1002/cne.902000309","https://onlinelibrary.wiley.com/doi/pdf/10.1002/cne.902000309","Organization of afferent input to subdivisions of area 8 in the rhesus monkey"
"10.1016/0006-8993(78)90464-x",,,"https://www.sciencedirect.com/science/article/pii/000689937890464X",,"Patch-like termination of thalamic fibers in the putamen of the rhesus monkey: an autoradiographic study"
"10.1016/0006-8993(79)90132-x",,,"https://www.sciencedirect.com/science/article/pii/000689937990132X",,"Regional distribution of monoamines in the cerebral cortex and subcortical structures of the rhesus monkey: concentrations and in vivo synthesis rates"
"10.1002/cne.903070405",,,"https://onlinelibrary.wiley.com/doi/abs/10.1002/cne.903070405","https://onlinelibrary.wiley.com/doi/pdf/10.1002/cne.903070405","Primate supplementary eye field. II. Comparative aspects of connections with the thalamus, corpus striatum, and related forebrain nuclei"
"10.1523/JNEUROSCI.03-07-01389.1983",,,"https://www.jneurosci.org/content/3/7/1389.short","https://www.jneurosci.org/content/jneuro/3/7/1389.full.pdf","Termination of afferent axons in macaque striate cortex"
"10.1523/JNEUROSCI.3795-09.2010",,,"https://www.jneurosci.org/content/30/2/661.short","https://www.jneurosci.org/content/jneuro/30/2/661.full.pdf","Functional interaction of medial mediodorsal thalamic nucleus but not nucleus accumbens with amygdala and orbital prefrontal cortex is essential for adaptive …"
"10.1016/0361-9230(84)90237-5",,,"https://www.sciencedirect.com/science/article/pii/0361923084902375","https://deepblue.lib.umich.edu/bitstream/handle/2027.42/24629/0000040.pdf;sequence=1","Proopiomelanocortin peptide immunocytochemistry in rhesus monkey brain"
,,,,"https://synapse.koreamed.org/upload/synapsedata/pdfdata/0069ymj/ymj-55-709.pdf","Thalamocortical connections between the mediodorsal nucleus of the thalamus and prefrontal cortex in the human brain: a diffusion tensor tractographic study"
,,,,"https://www.cell.com/cell-reports/pdf/S2211-1247(23)00855-0.pdf","The non-specific matrix thalamus facilitates the cortical information processing modes relevant for conscious awareness"
"10.1007/978-1-4613-1051-8_12",,,"https://link.springer.com/chapter/10.1007/978-1-4613-1051-8_12",,"Structure and connections of the cingulate vocalization region in the rhesus monkey"
,,,,"https://www.cell.com/current-biology/pdf/S0960-9822(15)01419-0.pdf","Primate thalamus: more than meets an eye"
"10.1002/cne.902970309",,,"https://onlinelibrary.wiley.com/doi/abs/10.1002/cne.902970309","https://onlinelibrary.wiley.com/doi/pdf/10.1002/cne.902970309","Developmental history of the transient subplate zone in the visual and somatosensory cortex of the macaque monkey and human brain"
"10.1159/000123780",,,"https://karger.com/bbe/article/15/3/210/44837/An-Autoradiographic-Analysis-of-the-Efferent",,"An Autoradiographic Analysis of the Efferent Connections from Premotor and Adjacent Prefrontal Regions (Areas 6 and 9) in Macaca fascicularis; pp. 210–234"
"10.3389/fnsys.2013.00056",,,"https://www.frontiersin.org/articles/10.3389/fnsys.2013.00056/full",,"Cognitive control of movement via the cerebellar-recipient thalamus"
"10.1101/398917",,,"https://www.biorxiv.org/content/10.1101/398917v1.abstract","https://www.biorxiv.org/content/10.1101/398917v1.full.pdf","Thalamo-cortical interactions define functional dissociations across the macaque attention network"
"10.1002/(sici)1096-9861(19990405)406:2<221::aid-cne7>3.0.co;2-k",,,"https://onlinelibrary.wiley.com/doi/abs/10.1002/(SICI)1096-9861(19990405)406:2%3C221::AID-CNE7%3E3.0.CO;2-K","https://onlinelibrary.wiley.com/doi/pdf/10.1002/(SICI)1096-9861(19990405)406:2%3C221::AID-CNE7%3E3.0.CO;2-K","Single axon analysis of pulvinocortical connections to several visual areas in the macaque"
"10.1002/cne.901780206",,,"https://onlinelibrary.wiley.com/doi/abs/10.1002/cne.901780206","https://onlinelibrary.wiley.com/doi/pdf/10.1002/cne.901780206","Intratrigeminal and thalamic projections of nucleus caudalis in the squirrel monkey (Saimiri sciureus): A degeneration and autoradiographic study,"
"10.1016/0006-8993(77)90066-x",,,"https://www.sciencedirect.com/science/article/pii/000689937790066X","https://bpb-us-e1.wpmucdn.com/sites.northwestern.edu/dist/7/2577/files/2018/08/9-Mesulam-1c3b9by.pdf","Limbic and sensory connections of the inferior parietal lobule (area PG) in the rhesus monkey: a study with a new method for horseradish peroxidase histochemistry"
"10.1002/cne.902410309",,,"https://onlinelibrary.wiley.com/doi/abs/10.1002/cne.902410309","https://onlinelibrary.wiley.com/doi/pdf/10.1002/cne.902410309","The thalamic relations of the caudal inferior parietal lobule and the lateral prefrontal cortex in monkeys: divergent cortical projections from cell clusters in the medial …"
"10.3109/00016487609107480",,,"https://www.tandfonline.com/doi/abs/10.3109/00016487609107480","https://www.tandfonline.com/doi/pdf/10.3109/00016487609107480","Vestibular Evoked Potentials in Thalamus and Basal Ganglia of the Squirrel Monkey (Saimiri Sciureus)"
"10.1016/0006-8993(94)90641-6",,,"https://www.sciencedirect.com/science/article/pii/0006899394906416",,"Dendritic orientation of thalamocortical projection neurons in the ventrobasal complex of macaques"
,7424595,,"https://europepmc.org/article/med/7424595",,"Relationships of precentral premotor and prefrontal cortex to the mediodorsal and intralaminar nuclei of the monkey thalamus."
"10.1016/s0165-0173(99)00006-5",,,"https://www.sciencedirect.com/science/article/pii/S0165017399000065",,"Efferent connections of the anteromedial nucleus of the thalamus of the rat"
"10.1016/0006-8993(77)90761-2",,,"https://www.sciencedirect.com/science/article/pii/0006899377907612",,"An experimental study of the efferent connections of the superior cerebellar peduncle in the rhesus monkey"
"10.1017/s0952523801185068",,,"https://www.cambridge.org/core/journals/visual-neuroscience/article/abs/cortical-and-subcortical-afferents-to-the-nucleus-reticularis-tegmenti-pontis-and-basal-pontine-nuclei-in-the-macaque-monkey/E95A9D788EDEAFB716A3B90F0524BD24",,"Cortical and subcortical afferents to the nucleus reticularis tegmenti pontis and basal pontine nuclei in the macaque monkey"
"10.1016/j.neuroscience.2006.06.027",,,"https://www.sciencedirect.com/science/article/pii/S030645220600858X",,"Interactions among the medial prefrontal cortex, hippocampus and midline thalamus in emotional and cognitive processing in the rat"
"10.1016/0166-4328(95)00188-3",,,"https://www.sciencedirect.com/science/article/pii/0166432895001883",,"Anatomical substrates for early stages in cortical processing of visual information in the macaque monkey"
,,,,"https://www.cell.com/current-biology/pdf/S0960-9822(20)30734-X.pdf","Long-term value memory in the primate posterior thalamus for fast automatic action"
"10.1016/s0006-8993(99)01531-0",,,"https://www.sciencedirect.com/science/article/pii/S0006899399015310",,"Corticostriatal and corticosubthalamic input zones from the presupplementary motor area in the macaque monkey: comparison with the input zones from the …"
"10.1152/jn.00207.2002",,,"https://journals.physiology.org/doi/abs/10.1152/jn.00207.2002",,"Dissociation of spatial-, object-, and sound-coding neurons in the mediodorsal nucleus of the primate thalamus"
"10.1002/cne.903020211",,,"https://onlinelibrary.wiley.com/doi/abs/10.1002/cne.903020211","https://onlinelibrary.wiley.com/doi/pdf/10.1002/cne.903020211","Afferent and efferent connections of the oculomotor region of the fastigial nucleus in the macaque monkey"
"10.1002/cne.21325",,,"https://onlinelibrary.wiley.com/doi/abs/10.1002/cne.21325","https://onlinelibrary.wiley.com/doi/pdf/10.1002/cne.21325","Multisensory convergence in auditory cortex, I. Cortical connections of the caudal superior temporal plane in macaque monkeys"
"10.1523/JNEUROSCI.0953-10.2010",,,"https://www.jneurosci.org/content/30/25/8650.short","https://www.jneurosci.org/content/jneuro/30/25/8650.full.pdf","Pulvinar inactivation disrupts selection of movement plans"
"10.1523/JNEUROSCI.1607-09.2009",,,"https://www.jneurosci.org/content/29/28/8936.short","https://www.jneurosci.org/content/jneuro/29/28/8936.full.pdf","Vestibular signals in macaque extrastriate visual cortex are functionally appropriate for heading perception"
"10.1097/00001756-199412000-00071",7696634,,"https://europepmc.org/article/med/7696634",,"The lateral geniculate nucleus projects to the inferior temporal cortex in the macaque monkey."
,3538286,,"https://europepmc.org/article/med/3538286",,"Relations between the basal ganglia and the thalamus of the primate. New morphologic data. New physiopathologic interpretations"
"10.1002/cne.903110209",,,"https://onlinelibrary.wiley.com/doi/abs/10.1002/cne.903110209","https://onlinelibrary.wiley.com/doi/pdf/10.1002/cne.903110209","Parallel thalamic activation of the first and second somatosensory areas in prosimian primates and tree shrews"
"10.1038/s41467-020-14368-z",,,"https://www.nature.com/articles/s41467-020-14368-z",,"Transcriptomic and open chromatin atlas of high-resolution anatomical regions in the rhesus macaque brain"
"10.1523/JNEUROSCI.1835-07.2007",,,"https://www.jneurosci.org/content/27/44/11888.short","https://www.jneurosci.org/content/jneuro/27/44/11888.full.pdf","Dissociable performance on scene learning and strategy implementation after lesions to magnocellular mediodorsal thalamic nucleus"
,13974330,,"https://europepmc.org/article/med/13974330",,"Insular and opercular cortex and its thalamic projection in Macaca mulatta."
"10.1016/0006-8993(75)90529-6",,,"https://www.sciencedirect.com/science/article/pii/0006899375905296",,"Delayed matching after selective prefrontal lesions in monkeys (Macaca mulatta)"
"10.1016/s0166-4328(05)80016-6",,,"https://www.sciencedirect.com/science/article/pii/S0166432805800166",,"The human cerebro-cerebellar system: its computing, cognitive, and language skills"
"10.3389/fnsys.2014.00083",,,"https://www.frontiersin.org/articles/10.3389/fnsys.2014.00083/full",,"Intralaminar and medial thalamic influence on cortical synchrony, information transmission and cognition"
"10.1016/s0306-4522(97)00486-7",,,"https://www.sciencedirect.com/science/article/pii/S0306452297004867",,"Calretinin-immunoreactive neurons in the human thalamus"
"10.1002/cne.902210206",,,"https://onlinelibrary.wiley.com/doi/abs/10.1002/cne.902210206","https://onlinelibrary.wiley.com/doi/pdf/10.1002/cne.902210206","The intrinsic architectonic and connectional organization of the superior temporal region of the rhesus monkey"
,,,"https://onlinelibrary.wiley.com/doi/abs/10.1002/cne.902530402","https://onlinelibrary.wiley.com/doi/pdf/10.1002/cne.902530402","Frontal eye field as defined by intracortical microstimulation in squirrel monkeys, owl monkeys, and macaque monkeys: I. Subcortical connections"
,,,,"https://citeseerx.ist.psu.edu/document?repid=rep1&type=pdf&doi=688606a4c63ae8b859bf38b75ccc1ea96d5c5111","Connexions of the somatic sensory cortex of the rhesus monkey: I.—Ipsilateral cortical connexions"
"10.1002/cne.903120102",,,"https://onlinelibrary.wiley.com/doi/abs/10.1002/cne.903120102","https://onlinelibrary.wiley.com/doi/pdf/10.1002/cne.903120102","Serotoninergic innervation of the thalamus in the primate: an immunohistochemical study"
"10.1111/j.1460-9568.2012.08033.x",,,"https://onlinelibrary.wiley.com/doi/abs/10.1111/j.1460-9568.2012.08033.x","https://onlinelibrary.wiley.com/doi/pdf/10.1111/j.1460-9568.2012.08033.x","Unveiling the diversity of thalamocortical neuron subtypes"
"10.1159/000315985",,,"https://karger.com/bbe/article/19/3-4/117/45476/On-the-Question-of-the-Ventral-Intermediate",,"On the Question of the Ventral Intermediate Nucleus in Primate Thalamus (Part 2 of 2) A study of the Lesser Bushbaby, Galago senegalensis"
"10.1152/jn.00475.2002",,,"https://journals.physiology.org/doi/abs/10.1152/jn.00475.2002",,"Effects of high-frequency stimulation in the internal globus pallidus on the activity of thalamic neurons in the awake monkey"
