1004,10.1016/j.brainres.2006.02.135,16631142.0,,https://linkinghub.elsevier.com/retrieve/pii/S0006899306007207,linkinghub.elsevier.com,://linkinghub.elsevier.com/,linkinghub.elsevier.com,Chronic ethanol drinking reduces native T-type calcium current in the thalamus of nonhuman primates,Chronic ethanol use is known to disrupt normal sleep rhythms but the cellular basis for this disruption is unknown An important contributor to normal sleep patterns is a low-threshold calcium current mediated by T-type calcium channels The T-type calcium current underlies burst responses in thalamic nuclei that are important to spindle propagation and we recently observed that this current is sensitive to acute low doses of ethanol MethodsWe used a combination of current clamp and voltage clamp recordings in an in vitro brain slice preparation of the dorsal lateral geniculate nucleus LGN of macaque monkeys that have chronically self-administered ethanol to determine whether chronic ethanol exposure may affect T-type currents ResultsCurrent clamp recordings from the LGN of ethanol naive macaques showed characteristic burst responses However recordings from the LGN in macaques that self-administered ethanol revealed a significant attenuation of bursts across a range of voltages n   Voltage clamp recordings from control LGN neurons n   and neurons n   from brain slices from chronically drinking macaques showed no significant differences P   in T-type current kinetics or in the membrane resistance of the thalamic cells between the two cohorts However mean T-type current amplitude measured in the chronically drinking animals was reduced by  P   ConclusionsWe conclude that chronic ethanol self-administration reduces calcium currents in thalamic relay cells without altering underlying current kinetics which may provide a mechanistic framework for the well-documented disruptions in sleepwake behavior in subjects with chronic ethanol exposure,cynomolgus macaque; alcoholism; sleep; burst; in vitro; LATERAL GENICULATE NEURONS; ADMISSION PREDICTS RELAPSE; SYNCHRONIZED OSCILLATIONS; PRIMARY ALCOHOLISM; EEG SLEEP; VOLTAGE; RAT; CAT; CHANNELS; NUCLEUS
1011,10.1016/s0006-8993(02)04212-9,12644259.0,,https://linkinghub.elsevier.com/retrieve/pii/S0006899302042129,linkinghub.elsevier.com,://linkinghub.elsevier.com/,linkinghub.elsevier.com,The associative striatum: cortical and thalamic projections to the dorsocentral striatum in rats,Corticostriatal projections to the dorsocentral striatum DCS were investigated using retrograde fluorescent axonal tracing The DCS is of interest because of its role in directed attention and recovery from multimodal hemispatial neglect following cortical lesions of medial agranular cortex AGm an association area that is its major source of cortical input A key finding was that the multimodal posterior parietal cortex PPC also contributes substantial input to DCS This is significant because PPC and AGm are linked by corticocortical connections and are both critical components of the circuitry involved in spatial processing and directed attention Other cortical areas providing input to DCS include visual association areas lateral agranular cortex and orbital cortex These areas also have reciprocal connections with AGm and PPC Less consistent labeling was seen in somatic sensorimotor areas FL HL and Par  Thalamic afferents to DCS are prominent from the intralaminar ventrolateral mediodorsal ventromedial laterodorsal LD and lateral posterior LP nuclei Collectively these nuclei constitute the sources of thalamic input to cortical areas AGm and PPC Nuclei LD and LP are only labeled with injections in dorsal DCS the site of major input from PPC and PPC receives its thalamic input from LD and LP We conclude that DCS receives inputs from cortical and thalamic areas that are themselves linked by corticocortical and thalamocortical connections These findings support the hypothesis that DCS is a key component of an associative network of cortical striatal and thalamic regions involved in multimodal processing and directed attention,Corticostriatal; thalarnostriatal; cerebral cortex; thalamus; retrograde; fluorescent; POSTERIOR PARIETAL CORTEX; DORSOMEDIAL PREFRONTAL CORTEX; TIME-DEPENDENT CHANGES; CORTICOSTRIATAL PROJECTIONS; UNILATERAL LESIONS; MOTOR CORTEX; THALAMOSTRIATAL PROJECTIONS; TOPOGRAPHICAL ORGANIZATION; SENSORY NEGLECT; RHESUS-MONKEY
1017,10.1179/174313206x153851,17439707.0,,https://www.tandfonline.com/doi/full/10.1179/174313206X153851,www.tandfonline.com,,,Thalamic hypometabolism on 18FDG-positron emission tomography in medial temporal lobe epilepsy,Objectives Degree of hypometabolism in the thalamus on Fluorodeoxyglucose-positron emission tomography FDG-PET was compared with those of medial and lateral temporal lobes in patients with medial temporal lobe epilepsy mTLE and its relationship with post-operative seizure outcomes was investigated,FDG-PET; TEMPORAL LOBE EPILEPSY; THALAMIC HYPOMETABOLISM; POST-OPERATIVE SEIZURE OUTCOME;
1022,10.1016/j.neurobiolaging.2023.02.002,36917864.0,,https://linkinghub.elsevier.com/retrieve/pii/S0197458023000283,linkinghub.elsevier.com,://linkinghub.elsevier.com/,linkinghub.elsevier.com,Brain volumetrics across the lifespan of the rhesus macaque,The rhesus macaque is a long-lived nonhuman primate NHP with a brain structure similar to humans which may represent a valuable translational animal model in which to study human brain aging Previous magnetic resonance imaging MRI studies of age in rhesus macaque brains have been prone to low statistical power unbalanced sex ratio and lack of a complete age range To overcome these problems the current study surveyed structural T-weighted magnetic resonance imaging scans of  animals  females aged - years and  males aged - years Differences observed in older animals included enlargement of the lateral ventricles and a smaller volume in the frontal cortex caudate putamen hypothalamus and thalamus Unexpected greater volume were measured in older animals in the hippocampus amygdala and globus pallidus There were also numerous differences between males and females with respect to age in both white and gray matter regions As an apparent model of normative human aging the macaque is ideal for studying induction and mitigation of neurodegenerative disease,Rhesus Macaque; Magnetic Resonance Imaging; Aging; Frontal Cortex; AGE-RELATED-CHANGES; RECOGNITION MEMORY IMPAIRMENT; ANTERIOR CINGULATE CORTEX; REGIONAL GRAY-MATTER; ADULT HUMAN BRAIN; SEX-DIFFERENCES; PREFRONTAL CORTEX; HIPPOCAMPAL NEUROGENESIS; ALZHEIMERS-DISEASE; NONHUMAN-PRIMATES
1044,10.1016/j.brs.2015.07.041,26298643.0,,https://linkinghub.elsevier.com/retrieve/pii/S1935861X15010864,linkinghub.elsevier.com,://linkinghub.elsevier.com/,linkinghub.elsevier.com,Potential Protective Effects of Chronic Anterior Thalamic Nucleus Stimulation on Hippocampal Neurons in Epileptic Monkeys,Stimulation of the anterior nucleus of the thalamus ANT is effective in seizure reduction but the mechanisms underlying the beneficial effects of ANT stimulation are unclear To assess the beneficial effects of ANT stimulation on hippocampal neurons of epileptic monkeys Chronic ANT stimulation was applied to kainic acid-induced epileptic monkeys Behavioral seizures were continuously monitored Immunohistochemical staining and western blot assays were performed to assess the hippocampal injury and the effects of ANT stimulation The frequency of seizures was  lower in the stimulation group compared with the sham-stimulation group Immunohistochemical staining and western blot analyses indicated that neuronal loss and apoptosis were less severe and that neurofilament synthesis was enhanced in the stimulation monkeys compared with the sham-stimulation group These data showed that the hippocampal injury was less severe in monkeys in the stimulation group than in those in the sham-stimulation group Our data suggest that chronic ANT stimulation may exert protective effects on hippocampal neurons and boost the regeneration of neuronal fibers These effects may be closely related to the mechanisms of ANT stimulation in epilepsy treatment,Anterior nucleus of the thalamus; Deep brain stimulation; Epilepsy; Neuronal injury; Rhesus monkey; TEMPORAL-LOBE EPILEPSY; DEEP BRAIN-STIMULATION; HEAT-SHOCK-PROTEIN; ELECTRICAL-STIMULATION; HIGH-FREQUENCY; KAINIC ACID; RAT-BRAIN; EXPRESSION; SEIZURES; HSP70
1051,10.1016/j.jchemneu.2017.04.006,28445782.0,,https://linkinghub.elsevier.com/retrieve/pii/S0891061816302472,linkinghub.elsevier.com,://linkinghub.elsevier.com/,linkinghub.elsevier.com,The immunohistochemical distribution of the GABAA receptor α1; α2; α3; β2/3 and γ2 subunits in the human thalamus,The GABAA receptor is the most abundant inhibitory receptor in the human brain and is assembled from a variety of different subunit subtypes which determines their pharmacology and physiology To determine which GABAA receptor subunit proteins are found in the human thalamus we investigated the distribution of five major GABAA receptor subunits α α α β and γ using immunohistochemical techniques The α- β- and γ- subunits which combine to form a benzodiazepine sensitive GABAA receptor showed the most intense levels of staining and were the most common subunits found throughout the human thalamus especially in the ventral and posterior nuclear groups The next most intense staining was for the α-subunit followed by the α-subunit The intralaminar nuclear group the mediodorsal nucleus and the thalamic reticular nucleus contained α- β- and γ- subunits staining as well as the highest levels of the α- and α- subunits The sensory dorsal lateral geniculate nucleus contained very high levels of α- and β- and γ-subunits The highest densities of GABAA receptors found throughout the thalamus which contained the subunits α β and γ included nuclei which are especially involved in the control or the modulation of the cortico-basal ganglia-thalamo-cortical motor circuits and are thus important in disorders such as Huntingtons disease where the GABAergic projections of the basal ganglia are compromised In addition the majority of receptors in the thalamic reticular nucleus contain α and γ subunits whilst the intralaminar nuclei contain high levels of α and α subunits,AMINOBUTYRIC ACID(A) RECEPTOR; LATERAL GENICULATE-NUCLEUS; ELECTRON-MICROSCOPIC OBSERVATIONS; ADULT-RAT BRAIN; RETICULAR NUCLEUS; BASAL GANGLIA; BENZODIAZEPINE-RECEPTORS; GABAERGIC NEURONS; MOTOR THALAMUS; RHESUS-MONKEY
1057,10.1016/j.neubiorev.2020.01.005,31972202.0,,https://linkinghub.elsevier.com/retrieve/pii/S0149763418307991,linkinghub.elsevier.com,://linkinghub.elsevier.com/,linkinghub.elsevier.com,Pulvino-cortical interaction: An integrative role in the control of attention,Selective attention is a fundamental cognitive function that guides behavior by selecting and prioritizing salient or relevant sensory information of our environment Despite early evidence and theoretical proposal pointing to an implication of thalamic control in attention most studies in the past two decades focused on cortical substrates largely ignoring the contribution of subcortical regions as well as cortico-subcortical interactions Here we suggest a key role of the pulvinar in the selection of salient and relevant information via its involvement in priority maps Prioritization may be achieved through a pulvinar-mediated generation of alpha oscillations which may then modulate neuronal gain in thalamo-cortical circuits Such mechanism might orchestrate the synchrony of cortico-cortical interaction by rendering neural communication more effective precise and selective We propose that this theoretical framework will support a timely shift from the prevailing cortico-centric view of cognition to a more integrative perspective of thalamic contributions to attention and executive control processes,Selective attention; Thalamo-cortical circuit; Pulvinar; Priority maps; Alpha oscillations; Neural gain; VISUAL-SPATIAL ATTENTION; LATERAL INTRAPARIETAL AREA; SALIENCE-BASED PROGRESSION; HUMAN BRAIN; NEW-WORLD; FUNCTIONAL-ORGANIZATION; SUPERIOR COLLICULUS; PARIETAL CORTEX; MACAQUE MONKEY; PRIORITY MAPS
1064,10.1016/j.neuroscience.2007.03.054,17570597.0,,https://linkinghub.elsevier.com/retrieve/pii/S0306452207003570,linkinghub.elsevier.com,://linkinghub.elsevier.com/,linkinghub.elsevier.com,Thalamic connections of the dorsal and ventral premotor areas in New World owl monkeys,Thalamic connections of two premotor cortex areas dorsal PMD and ventral PMV were revealed in New World owl monkeys by injections of fluorescent dyes or wheat-germ agglutinin conjugated to horseradish peroxidase WGA-HRP The injections were placed in the forelimb and eye-movement representations of PMD and in the forelimb representation of PMV as determined by microstimulation mapping For comparison injections were also placed in the forelimb representation of primary motor cortex M of two owl monkeys The results indicate that both PMD and PMV receive dense projections from the ventral lateral VL and ventral anterior VA thalamus and sparser projections from the ventromedial VM mediodorsal MD and intralaminar IL nuclei Labeled neurons in VL were concentrated in the anterior VLa and the medial VLx nuclei with only a few labeled cells in the dorsal VLd and posterior VLp nuclei In VA labeled neurons were concentrated in the parvocellular division VApc dorsomedial to VLa Labeled neurons in MD were concentrated in the most lateral and posterior parts of the nucleus VApc projected more densely to PMD than PMV especially to rostral PMD whereas caudal PMD received stronger projections from neurons in VLx and VLa VLd projected exclusively to PMD and not to PMV In addition neurons labeled by PMD injections tended to be more dorsal in VL IL and MD than those labeled by PMV injections The results indicate that both premotor areas receive indirect inputs from the cerebellum via VLx VLd and IL and globus pallidus via VLa VApc and MD Comparisons of thalamic projections to premotor and M indicate that both regions receive strong projections from VLx and VLa with the populations of cells projecting to M located more laterally in these nuclei VApc VLd and MD project mainly to premotor areas while VLp projects mainly to M Overall the thalamic connectivity patterns of premotor cortex in New World owl monkeys are similar to those reported for Old World monkeys,motor thalamus; ventral lateral nucleus; motor cortex; primate; frontal cortex; AChE; acetylcholinesterase; CL; central lateral nucleus; CM; centromedian nucleus; CO; cytochrome oxidase; DY; Diamidino Yellow; FB; Fast Blue; FR; fluororuby; ICMS; intracortical microstimulation; IL; intralaminar nuclei; MD; medial dorsal nucleus; M; primary motor area; Mc; primary motor area; caudal subdivision; Mr; primary motor area; rostral subdivision; Pc; paracentral nucleus; PMD; dorsal premotor cortex; PMDc; dorsal premotor cortex; caudal subdivision; PMDr; dorsal premotor cortex; rostral subdivision; PMV; ventral premotor cortex; PMVc; ventral premotor cortex; caudal subdivision; PMVr; ventral premotor cortex; rostral subdivision; SMA; supplementary motor area; VA; ventral anterior nucleus; VAmc; ventral anterior nucleus; medial magnocellular subdivision; VApc; ventral anterior nucleus; lateral parvocellular subdivision; VL; ventral lateral nucleus; VLa; ventral lateral nucleus; anterior subdivision; VLd; ventral lateral nucleus; dorsal subdivision; VLp; ventral lateral nucleus; principal subdivision; VLx; ventral lateral nucleus; medial subdivision; VM; ventral medial nucleus; WGA-HRP; wheat-germ agglutinin conjugated to horseradish peroxidase;
1070,10.1016/j.brainres.2004.07.048,15374754.0,,https://linkinghub.elsevier.com/retrieve/pii/S000689930401203X,linkinghub.elsevier.com,://linkinghub.elsevier.com/,linkinghub.elsevier.com,Cytoarchitecture and thalamic afferents of the sylvian and composite posterior gyri of the canine temporal cortex,The composite posterior and sylvian gyri of the canine temporal cortex show cytoarchitectonic features of poorly differentiated isocortex Quantitative evaluation of connections examined with retrogradely transported fluorescent tracers indicated that both gyri received strong thalamic projections from the medial geniculate body MG and the lateromedial-suprageniculate LM-Sg complex and a weaker projection from the posterior Po nuclei On the basis of the connectivity patterns and cytoarchitectonic features we distinguished the anterior CPa and posterior CPp areas in posterior composite gyrus and the anterior SA dorsal SD and posterior SP sylvian areas Afferents from individual thalamic nuclei were focused in distinct areas forming dominant projections and diminished gradually in the adjacent areas as non-dominant projections The most prominent MG projection arose from the dorsal caudal MGdc nucleus Its ventral subdivision sent a dominant projection into the SP and CPa whereas the dorsal MGdc subdivision was connected with the SA SD and CPp areas The most substantial connections from the LM-Sg complex were directed to areas SA SD and CPp with weak connections to areas CPa and SP A gradient of density of LM-Sg afferents was distributed in the opposite direction to that sent from the MGdc The origin of the CPa and SP afferents in the ventral MGdc like connections reaching the posterior ectosylvian cortex suggest that these areas are related to processing of auditory information In contrast areas SA and CPp receive dominant projections from the polymodal LM-Sg and therefore may constitute successive steps in a hierarchy of cortical areas,temporal cortex in the dog; cytoarchitecture; thalamo-cortical connections; medial geniculate complex; lateromedial-suprageniculate nuclei; MEDIAL GENICULATE-BODY; AUDITORY FREQUENCY GENERALIZATION; RHESUS-MONKEY; PREFRONTAL LESIONS; SUPRAGENICULATE NUCLEUS; NEURONAL ARCHITECTURE; RESPONSE PROPERTIES; RECOGNITION MEMORY; MODULATED SOUNDS; MACAQUE MONKEYS
1076,10.1016/j.neuroscience.2019.06.018,31228590.0,,https://linkinghub.elsevier.com/retrieve/pii/S0306452219304245,linkinghub.elsevier.com,://linkinghub.elsevier.com/,linkinghub.elsevier.com,Implication of Anterior Nucleus of the Thalamus in Mesial Temporal Lobe Seizures,Deep brain stimulation of the anterior nucleus of the thalamus has been proposed as novel therapy to treat intractable epilepsy To optimize this approach we proposed to study the involvement of this nucleus in a non-human primate model of mesial temporal lobe seizure Two macaques were implanted with one chronic electrode into the hippocampus allowing to monitor the ictal activity Neurons of the anterior nucleus of the thalamus were recorded with a microelectrode inserted acutely To induce seizures penicillin was injected into the hippocampus and neuronal activities of the anterior nucleus were analyzed during ictal and interictal periods The effects of the chemical neuromodulation of the anterior nucleus on the ictal hippocampal activities were studied and electron microscopy analysis was carried out to study morphological modifications induced in the anterior nucleus of the thalamus Our results demonstrate that the anterior nucleus of the thalamus is directly involved in the pathophysiology of induced seizures since  Electrophysiological study showed an heterogenous excitation during seizure characterized by the appearance of  types of neuronal firing response  chemical neuromodulation of the anterior nucleus of the thalamus changed the severity of seizures  morphological modification of the ultrastructure as well as a reduction of synapse density were observed within the ipsilateral anterior nucleus of the thalamus This study demonstrates that the anterior nucleus of the thalamus is part of the epileptic network activated during temporal lobe seizures and suggests that this nucleus would be valid target for seizure control using deep brain stimulation,MTLE; Mesial temporal lobe epilepsy; MTL; Mesial temporal lobe; DBS; deep brain stimulation; HPC; hippocampus; ANT; anterior nucleus of the thalamus; NHP; non-human primate; DG; dentate gyrus; PNC; penicillin; FR; firing rate; PSTH; peristimulus histogram; BL; baseline; mesial temporal lobe epilepsy; single unit recording; anterior nucleus of the thalamus; nonhuman primate;
1116,10.1016/j.brainres.2008.04.024,18533136.0,,https://linkinghub.elsevier.com/retrieve/pii/S0006899308008883,linkinghub.elsevier.com,://linkinghub.elsevier.com/,linkinghub.elsevier.com,Spikes; synchrony; and attentive learning by laminar thalamocortical circuits,This article develops the Synchronous Matching Adaptive Resonance Theory SMART neural model to explain how the brain may coordinate multiple levels of thalamocortical and corticocortical processing to rapidly learn and stably remember important information about a changing world The model clarifies how bottom-up and top-down processes work together to realize this goal notably how processes of learning expectation attention resonance and synchrony are coordinated The model hereby clarifies for the first time how the following levels of brain organization coexist to realize cognitive processing properties that regulate fast learning and stable memory of brain representations single-cell properties such as spiking dynamics spike-timing-dependent plasticity STDP and acetylcholine modulation detailed laminar thalamic and cortical circuit designs and their interactions aggregate cell recordings such as current source densities and local field potentials and single-cell and large-scale inter-areal oscillations in the gamma and beta frequency domains In particular the model predicts how laminar circuits of multiple cortical areas interact with primary and higher-order specific thalamic nuclei and nonspecific thalamic nuclei to carry out attentive visual learning and information processing The model simulates how synchronization of neuronal spiking occurs within and across brain regions and triggers STDP Matches between bottom-up adaptively filtered input patterns and learned top-down expectations cause gamma oscillations that support attention resonance learning and consciousness Mismatches inhibit learning while causing beta oscillations during reset and hypothesis testing operations that are initiated in the deeper cortical layers The generality of learned recognition codes is controlled by a vigilance process mediated by acetylcholine,attention; learning; STDP; bottom-up filter; top-down expectation; match; prediction; mismatch; LGN; pulvinar; V1; V2; spikes; gamma oscillations; beta oscillations; synchronization; local field potentials; mismatch negativity; acetylcholine; cortical layers; Adaptive Resonance Theory; EVENT-RELATED POTENTIALS; 3D SURFACE PERCEPTION; PRIMARY VISUAL-CORTEX; TOP-DOWN; NEURAL DYNAMICS; CEREBRAL-CORTEX; STRIATE CORTEX; HORIZONTAL CONNECTIONS; FUNCTIONAL LOGIC; MACAQUE MONKEY
1118,10.1016/s0079-6123(01)34005-0,11702563.0,,https://linkinghub.elsevier.com/retrieve/pii/S0079612301340050,linkinghub.elsevier.com,://linkinghub.elsevier.com/,linkinghub.elsevier.com,Chapter 4 Thalamic relay functions,The lateral geniculate nucleus is the best understood thalamic relay Only  of the inputs to geniculate relay cells derive from retina which is the driving input The rest being modulatory derive from local inhibitory inputs descending inputs from visual cortex and ascending inputs from brainstem The nonretinal modulatory inputs which from the vast majority dynamically control the nature of the geniculate relay Among other actions these modulatory inputs regulate membrane properties of relay cells and thereby control their mode of response to retinal inputs and this dramatically affects the nature of information relayed to cortex Our studies of the lateral geniculate nucleus of the cat lead to the speculation that this dynamic control depends on the animals behavioral state and represents the neuronal substrate for many forms of visual attention The lateral geniculate nucleus is a first-order relay because it relays subcortical ie retinal information to cortex for the first time In contrast the other main thalamic relay of visual information the pulvinar and lateral posterior nucleus in carnivores is largely a higher-order relay since much of seems to relay information from one cortical are to another Much more corticocortical processing may involve these re-entry routes than has been hitherto appreciated If so the thalamus sits at an indispensable position for corticocortical processing,LATERAL GENICULATE-NUCLEUS; METABOTROPIC GLUTAMATE RECEPTORS; THRESHOLD CALCIUM SPIKES; CAT VISUAL-CORTEX; NITRIC-OXIDE; ELECTROPHYSIOLOGICAL PROPERTIES; FIELD PROPERTIES; MACAQUE MONKEY; SIMPLE CELLS; NEURONS
