10.1152/jn.2001.85.1.219,11152722,,Effect of attentive fixation in macaque thalamus and cortex,https://journals.physiology.org/doi/10.1152/jn.2001.85.1.219,journals.physiology.org,https://journals.physiology.org/doi/pdf/10.1152/jn.2001.85.1.219
,,,"The thalamus of the Macaca, mulatta. An atlas for use with the stereotaxic instrument.",https://www.cabdirect.org/cabdirect/welcome/?target=%2Fcabdirect%2Fabstract%2F19522203025,www.cabdirect.org,
10.1016/j.neuroimage.2006.07.032,17140815,,Distribution of the dopamine innervation in the macaque and human thalamus,https://linkinghub.elsevier.com/retrieve/pii/S1053811906007609,linkinghub.elsevier.com,
10.1523/jneurosci.14-05-02485.1994,7514207,PMC6577493,Medial lemniscal and spinal projections to the macaque thalamus: an electron microscopic study of differing GABAergic circuitry serving thalamic somatosensory …,https://www.ncbi.nlm.nih.gov/pmc/articles/PMC6577493/,www.ncbi.nlm.nih.gov,https://www.jneurosci.org/content/jneuro/14/5/2485.full.pdf
10.1002/cne.903130106,1761756,,Diverse thalamic projections to the prefrontal cortex in the rhesus monkey,https://onlinelibrary.wiley.com/doi/10.1002/cne.903130106,onlinelibrary.wiley.com,https://onlinelibrary.wiley.com/doi/pdf/10.1002/cne.903130106
10.1038/372770a0,7695716,,A thalamic nucleus specific for pain and temperature sensation,https://www.nature.com/articles/372770a0,www.nature.com,https://www.nature.com/articles/372770a0.pdf
10.1093/brain/93.1.37,4984909,,Connexions of the somatic sensory cortex of the rhesus monkey: III.—thalamic connexions,https://academic.oup.com/brain/article/93/1/37/257010,academic.oup.com,https://citeseerx.ist.psu.edu/document?repid=rep1&type=pdf&doi=086111ccf8db5585f16a54ba754ea75ebac97d6c
10.1002/(sici)1096-9861(19981019)400:2<271::aid-cne8>3.0.co;2-6,9766404,,Thalamocortical connections of the parabelt auditory cortex in macaque monkeys,https://onlinelibrary.wiley.com/doi/10.1002/(SICI)1096-9861(19981019)400:2%3C271::AID-CNE8%3E3.0.CO;2-6,onlinelibrary.wiley.com,https://onlinelibrary.wiley.com/doi/pdf/10.1002/(SICI)1096-9861(19981019)400:2%3C271::AID-CNE8%3E3.0.CO;2-6
10.1002/(sici)1096-9861(19960812)372:1<59::aid-cne6>3.0.co;2-l,8841922,,Thalamic input to mesial and superior area 6 in the macaque monkey,https://onlinelibrary.wiley.com/doi/10.1002/(SICI)1096-9861(19960812)372:1%3C59::AID-CNE6%3E3.0.CO;2-L,onlinelibrary.wiley.com,https://onlinelibrary.wiley.com/doi/pdf/10.1002/(SICI)1096-9861(19960812)372:1%3C59::AID-CNE6%3E3.0.CO;2-L
10.1016/0165-0173(96)00003-3,,,The primate motor thalamus,https://linkinghub.elsevier.com/retrieve/pii/0165017396000033,linkinghub.elsevier.com,
10.1038/nn.4423,27775722,PMC5791896,Gravity orientation tuning in macaque anterior thalamus,https://www.ncbi.nlm.nih.gov/pmc/articles/PMC5791896/,www.ncbi.nlm.nih.gov,
10.1002/cne.902570211,3571529,,Crossed corticothalamic and thalamocortical connections of macaque prefrontal cortex,https://onlinelibrary.wiley.com/doi/10.1002/cne.902570211,onlinelibrary.wiley.com,https://onlinelibrary.wiley.com/doi/pdf/10.1002/cne.902570211
10.1002/cne.902620207,3624554,,Cingulate cortex of the rhesus monkey: I. Cytoarchitecture and thalamic afferents,https://onlinelibrary.wiley.com/doi/10.1002/cne.902620207,onlinelibrary.wiley.com,https://onlinelibrary.wiley.com/doi/pdf/10.1002/cne.902620207
10.1002/cne.902440208,3950095,,"Projections of thalamic gustatory and lingual areas in the monkey, Macaca fascicularis",https://onlinelibrary.wiley.com/doi/10.1002/cne.902440208,onlinelibrary.wiley.com,https://onlinelibrary.wiley.com/doi/pdf/10.1002/cne.902440208
10.1007/s00429-022-02463-4,35147755,PMC9106894,Spatial–temporal topography in neurogenesis of the macaque thalamus,https://www.ncbi.nlm.nih.gov/pmc/articles/PMC9106894/,www.ncbi.nlm.nih.gov,
10.1007/bf00236173,410652,,Organization of the thalamo-cortical connexions to the frontal lobe in the rhesus monkey,https://link.springer.com/article/10.1007/BF00236173,link.springer.com,https://link.springer.com/content/pdf/10.1007/BF00236173.pdf
10.1002/cne.902620303,2821085,,Sagittal cytoarchitectonic maps of the Macaca mulatta thalamus with a revised nomenclature of the motor‐related nuclei validated by observations on their …,https://onlinelibrary.wiley.com/doi/10.1002/cne.902620303,onlinelibrary.wiley.com,https://onlinelibrary.wiley.com/doi/pdf/10.1002/cne.902620303
10.1002/cne.902360304,4056098,,Organization of the nigrothalamocortical system in the rhesus monkey,https://onlinelibrary.wiley.com/doi/10.1002/cne.902360304,onlinelibrary.wiley.com,https://onlinelibrary.wiley.com/doi/pdf/10.1002/cne.902360304
10.1152/jn.1989.61.1.1,2918337,,Neural coding of gustatory information in the thalamus of Macaca mulatta,https://journals.physiology.org/doi/10.1152/jn.1989.61.1.1,journals.physiology.org,https://journals.physiology.org/doi/pdf/10.1152/jn.1989.61.1.1
10.1016/s0168-0102(98)00021-2,9704977,,Distribution of nociceptive neurons in the ventrobasal complex of macaque thalamus,https://linkinghub.elsevier.com/retrieve/pii/S0168010298000212,linkinghub.elsevier.com,
10.1007/bf00250573,2792254,,Motor learning in monkeys (Macaca fascicularis) with lesions in motor thalamus,https://link.springer.com/article/10.1007/BF00250573,link.springer.com,https://link.springer.com/content/pdf/10.1007/BF00250573.pdf
10.1002/cne.902520305,3793981,,Thalamic connectivity of the second somatosensory area and neighboring somatosensory fields of the lateral sulcus of the macaque,https://onlinelibrary.wiley.com/doi/10.1002/cne.902520305,onlinelibrary.wiley.com,https://onlinelibrary.wiley.com/doi/pdf/10.1002/cne.902520305
10.1002/cne.901950105,7204651,,Projections of the cerebellar and dorsal column nuclei upon the thalamus of the rhesus monkey,https://onlinelibrary.wiley.com/doi/10.1002/cne.901950105,onlinelibrary.wiley.com,https://onlinelibrary.wiley.com/doi/pdf/10.1002/cne.901950105
10.1007/bf00237252,413724,,Vestibular responses in the rhesus monkey ventroposterior thalamus. II. Vestibulo-proprioceptive convergence at thalamic neurons,https://link.springer.com/article/10.1007/BF00237252,link.springer.com,https://link.springer.com/content/pdf/10.1007/BF00237252.pdf
10.1002/cne.903370102,7506270,,The organization of projections from the mediodorsal nucleus of the thalamus to orbital and medial prefrontal cortex in macaque monkeys,https://onlinelibrary.wiley.com/doi/10.1002/cne.903370102,onlinelibrary.wiley.com,https://onlinelibrary.wiley.com/doi/pdf/10.1002/cne.903370102
10.1002/cne.902950212,1694186,,Anatomical investigation of projections from thalamus to posterior parietal cortex in the rhesus monkey: A WGA‐HRP and fluorescent tracer study,https://onlinelibrary.wiley.com/doi/10.1002/cne.902950212,onlinelibrary.wiley.com,https://onlinelibrary.wiley.com/doi/pdf/10.1002/cne.902950212
10.1017/s0952523800004922,1375095,,Segregated thalamocortical pathways to inferior parietal and inferotemporal cortex in macaque monkey,https://www.cambridge.org/core/journals/visual-neuroscience/article/abs/segregated-thalamocortical-pathways-to-inferior-parietal-and-inferotemporal-cortex-in-macaque-monkey/D15415AF6BF28483F6B6676F4EA32B81,www.cambridge.org,
10.1016/0006-8993(76)90424-8,816421,,Thalamic projections from the precentral motor cortex in Macaca fascicularis.,https://linkinghub.elsevier.com/retrieve/pii/0006899376904248,linkinghub.elsevier.com,
10.1007/bf00237670,4018201,,The thalamic connections with medial area 6 (supplementary motor cortex) in the monkey (macaca fascicularis),https://link.springer.com/article/10.1007/BF00237670,link.springer.com,https://link.springer.com/content/pdf/10.1007/BF00237670.pdf
10.1523/jneurosci.2334-08.2008,18945912,PMC2613515,Large-scale reorganization in the somatosensory cortex and thalamus after sensory loss in macaque monkeys,https://www.ncbi.nlm.nih.gov/pmc/articles/PMC2613515/,www.ncbi.nlm.nih.gov,https://www.jneurosci.org/content/jneuro/28/43/11042.full.pdf
10.1523/jneurosci.0968-05.2005,15987937,PMC6725054,The primate thalamus is a key target for brain dopamine,https://www.ncbi.nlm.nih.gov/pmc/articles/PMC6725054/,www.ncbi.nlm.nih.gov,https://www.jneurosci.org/content/jneuro/25/26/6076.full.pdf
10.1002/cne.902800311,2537345,,Thalamic input to inferior area 6 and area 4 in the macaque monkey,https://onlinelibrary.wiley.com/doi/10.1002/cne.902800311,onlinelibrary.wiley.com,https://onlinelibrary.wiley.com/doi/pdf/10.1002/cne.902800311
10.1002/cne.902710402,2454970,,Frontal eye field efferents in the macaque monkey: I. Subcortical pathways and topography of striatal and thalamic terminal fields,https://onlinelibrary.wiley.com/doi/10.1002/cne.902710402,onlinelibrary.wiley.com,https://onlinelibrary.wiley.com/doi/pdf/10.1002/cne.902710402
