375,10.1016/s0079-6123(08)62677-1,2094917.0,,https://linkinghub.elsevier.com/retrieve/pii/S0079612308626771,linkinghub.elsevier.com,://linkinghub.elsevier.com/,linkinghub.elsevier.com,Chapter 5 The anatomical relationship of the prefrontal cortex with the striatopallidal system; the thalamus and the amygdala: evidence for a parallel organization,The connections among the different components of the basal ganglia the thalamus and the frontal cortex in the rat are organized in a series of parallel circuits The basic principle of a parallel organization of connections among the forebrain structures also holds for the rat This chapter focuses on the organization of basal ganglia-thalamocortical circuits that involve different parts of the PFC prefrontal cortex and on the association of the midline and intralaminar thalamic nuclei and the amygdala with these circuits in the rat The topographical organization in the corticostriatal striatopallidal pallidothalamic and MD-PFC connections recognizes at least four circuits that involve cytoarchitectonically distinct areas of the PFC The projections of individual nuclei of the nonspecific thalamic complex and of particular parts of the amygdala to the prefrontal cortical and striatal way stations of the principal circuits are in register with the parallel arrangement of these circuits The principle of a parallel organization in the basal ganglia-thalamocortical circuits cortex is diagrammatically represented in the chapter A possible way of integrating certain aspects of different parallel circuits is through the dopaminergic system,
378,10.1016/s0079-6123(08)62675-8,2094901.0,,https://linkinghub.elsevier.com/retrieve/pii/S0079612308626758,linkinghub.elsevier.com,://linkinghub.elsevier.com/,linkinghub.elsevier.com,Chapter 3 Qualitative and quantitative comparison of the prefrontal cortex in rat and in primates; including humans,This chapter focuses on the qualitative and quantitative comparison of the prefrontal cortex PFC in rats and in primates including humans Comparing the different connectivity patterns and the relative PFC size in rats and primates the evolution of the PFC is most probably a result of both an increase in cortical size and of the segregation and specialization of the cortical regions The segregation and extension of the cortical ocular dominance columns after birth which can coincide with the elimination of the neuronal structures that have become exuberant during development is reviewed in the chapter It also considers homology criteria in comparing the rat PFC with the primate PFC and the connections with the thalamus corticocortical connections and the connections with other subcortical nuclei Only those cortical areas are included in the PFC for which the reciprocal connections with the mediodorsal nucleus are stronger than are the connections with other thalamic nuclei When the criterion of heaviest reciprocal connections with MD is applied to the current data on thalamic connections the cortical areas are regarded as PFC areas The connectivity patterns of the rat and primate MDs are compared in the chapter It also tabulates the current data on reciprocal cortical connections with the different parts of the mediodorsal nucleus in the rat and primate It shows that the topographies of these cortical connections in the rat and primate are quite similar,
381,10.1016/b978-0-08-042274-9.50030-4,,,https://linkinghub.elsevier.com/retrieve/pii/B9780080422749500304,linkinghub.elsevier.com,://linkinghub.elsevier.com/,linkinghub.elsevier.com,Interspecies Comparison of Expression of GABA/Benzodiazepine Receptors and their Subunits in the Motor and Limbic Nuclei of the Thalamus,This chapter presents an overview on the current knowledge on the organization of γ-aminobutyric acid GABAergic mechanisms in the thalamus based on the literature data and findings on the motor and limbic thalamic nuclei in the cat and monkey In the monkey thalamus there is a greater variety of GABAergic synapses and the internuclear differences are more pronounced compared to the thalami of rat and cat Additionally in the monkey ventro-lateral nucleus GABAergic dendro-dendritic contacts between local circuit neurons are found commonly but in the ventral anterior nucleus they are absent The chapter also explores whether there are functional differences among the various types of GABAergic synapses found in thalamic nuclei The data described in the chapter suggests that different mechanisms of modulation of GABAergic transmission can exist in the thalami of different species and if this is the case the physiological properties of otherwise similar afferent inputs can differ as well,
398,10.1016/s1054-3589(06)54002-5,17175809.0,,https://linkinghub.elsevier.com/retrieve/pii/S1054358906540025,linkinghub.elsevier.com,://linkinghub.elsevier.com/,linkinghub.elsevier.com,Distribution of GABA Receptors in the Thalamus and Their Involvement in Nociception,This chapter discusses the distribution of γaminobutyric acid GABA receptors in the thalamus and their involvement in nociception GABA receptors are ubiquitously expressed in the central nervous system CNS including the thalamus This region is an important target for sensory information acting as a relay to several cortical areas The nociceptive input is modulated in the thalamus by intrinsic inhibitory mechanisms Because GABA mediates most inhibitory actions in the thalamus the distribution of the three currently known receptor subtypes GABA  GABAB  and GABAC  in particular nuclei of the thalamus may give some clues on its involvement in the processing of nociceptive information The chapter provides an overall picture of the distribution of GABA receptors subunits in the thalamus both during development and adulthood and also focuses on the reports that implicate thalamic GABA receptors in the modulation of nociceptive input Studies suggest that in some thalamic nuclei opioidinduced antinociception might be mediated by the GABAergic system,
404,10.1016/s0361-9230(03)00069-8,12788205.0,,https://linkinghub.elsevier.com/retrieve/pii/S0361923003000698,linkinghub.elsevier.com,://linkinghub.elsevier.com/,linkinghub.elsevier.com,Representations of motivational drives in mesial cortex; medial thalamus; hypothalamus and midbrain,We propose that neural representations of motivational drives including sexual desire hunger thirst fear power-dominance the motivational aspect of pain the need for sleep and nurturance are represented in four areas in the brain These are located in the medial hypothalamicpreoptic area the periaqueductal gray matter PAG in the midbrainpons the midline and intralaminar thalamic nuclei and in the anterior part of the mesial cortex including the medial prefrontal and anterior cingulate areas We attempt to determine the locations of each of these representations within the hypothalamuspreoptic area periaqueductal gray and cortex based on the available literature on activation of brain structures by stimuli that evoke these forms of motivation on the effects of electrical and chemical stimulation and lesions of candidate structures and on hodological data We discuss the hierarchical organization of the representations for a given drive outputs from these representations to premotor structures in the medulla caudate-putamen and cortex and their contributions to involuntary learned-sequential operant and voluntary behaviors,
405,10.1007/978-1-4615-0179-4_44,,,https://link.springer.com/chapter/10.1007/978-1-4615-0179-4_44,link.springer.com,,,Superficial and Deep Thalamo-Cortical Projections from the Oral Part of RHE Ventral Lateral Thalamic Nucleus (VLo) Receiving Inputs to the Internal Pallidal Segment (GPi) and Cerebellar Dentate Nucleus in the Macaque Monkey,Superficial thalamo-cortical T-C responses were recorded in the lateral motor area and dorsal premotor area PMd following stimulation of the cerebellar dentate nucleus in monkeys Sasaki  These responses were also recorded in the motor area following pallidal stimulation Nambu et al   An anatomical study was also carried out on the T-C projections from the motor thalamic subdivisions in monkeys using autoradiography Nakano et al  The latter fmdings demonstrated that the basal ganglia territories of the motor thalamic subdivisions give rise to superficial T-C projections whereas the cerebellar territories give rise only to deep T-C projections Recent studies using modem axonal tracing techniques have reported a possible overlap of basal ganglia and cerebellar inputs in the thalamic subdivisions Rouiller et al  Sakai et al  We have reported that the lateral parts of the nucleus ventralis lateralis pars oralis VLo receive cerebellar afferents from the ventral part of the dentate nucleus Nakano et al  These keywords were added by machine and not by the authors This process is experimental and the keywords may be updated as the learning algorithm improves,Cerebellar Nucleus; Macaque Monkey; Thalamic Neuron; Biotinylated Dextran Amine; Thalamic Input;
412,10.1016/b978-0-08-042274-9.50020-1,,,https://linkinghub.elsevier.com/retrieve/pii/B9780080422749500201,linkinghub.elsevier.com,://linkinghub.elsevier.com/,linkinghub.elsevier.com,Anatomical Organisation of Internal Neuronal Circuits in the Motor Thalamus,This chapter discusses the findings on the ultrastructure of the cerebellar and basal ganglia afferent territories in the primate thalamus There is a significant difference between the ventrolateral nucleus of the thalamus and VA regarding the density of local circuit neurons LCN however in the VL it is about three times higher than in the VA This is also reflected in staining patterns for γ-aminobutyric acid GABA or glutamic acid decarboxylase GAD in immunocytochemical preparations both at light and electron microscopic According to current views basic biophysical properties of all thalamic neurons are similar and determined by the state of ionic conductance on their membrane Yet the synaptic activity can influence these ionic conductances and if the synaptic inputs are organized differently in different regions the net effect on the firing pattern of thalamic cells can be different too The data available so far provide anatomical basis for the functional diversity within the motor thalamus At the same time functional relevance of anatomically distinct subdivisions of the motor thalamus in primates can be correlated only indirectly with some clinical findings in parkinsonian patients and experimental behavioral studies utilizing lesions or recordings in different regions of the motor thalamus in monkeys,
415,10.1016/j.neuroscience.2004.08.016,15541889.0,,https://linkinghub.elsevier.com/retrieve/pii/S0306452204007353,linkinghub.elsevier.com,://linkinghub.elsevier.com/,linkinghub.elsevier.com,Subcortical afferents to the lateral mediodorsal thalamus in cynomolgus monkeys,The mediodorsal MD nucleus of the thalamus has long been known to provide the principal source of subcortical input to the primate prefrontal cortex as well as to other areas of the frontal lobe that are thought to contribute to higher-order cognitive functions In this study we used injections of retrograde tracers in the lateral portion of the monkey MD to assess the locations of labeled cells in subcortical structures Three main patterns were identified in the distribution of subcortical connections We found that the claustrum superior colliculus and ventral midbrain regions were heavily labeled in the cases with injections in caudoventral MD In these cases labeled cells were also found in either the periaqueductal gray or zona incerta depending on the specific case In one case with an injection in anterodorsal MD labeled cells were most numerous in the structures of the ventral midbrain especially the ventral tegmental area Finally the claustrum and superior colliculus contained the largest percentage of labeled subcortical cells in cases with injections in ventrolateral MD These three patterns of subcortical label corresponded to three equally distinctive trends in the distribution of MD connections with the cortex in these same cases J Comp Neurol    Very few labeled cells were found in other areas such as the amygdala globus pallidus and deep cerebellar nuclei suggesting that pathways leading from these structures to dorsolateral and dorsomedial frontal cortices are not likely to include the lateral divisions of MD In concert these findings show that particular locales within lateral MD receive distinct profiles of subcortical afferents and project into specific neocortical domains suggesting that these different sites within lateral MD may participate in functionally distinct circuits of information processing,ventral anterior nucleus; superior colliculus; substantia nigra; claustrum; periaqueductal gray; ventral tegmental area; AP; anteroposterior; CTb; cholera toxin b; FC; frontal cortex; GPi; globus pallidus internal segment; IP; interpeduncular nucleus; MD; mediodorsal nucleus; MDmf; mediodorsal thalamic nucleus; multiform division; MDpc; mediodorsal thalamic nucleus; parvicellular division; RRA; retrorubral area; SC; superior colliculus; SNc; substantia nigra pars compacta; SNcd; substantia nigra dorsal compacta; SNlat; substantia nigra pars lateralis; SNr; substantia nigra pars reticulata; VA; ventral anterior; VAmc; ventral anterior thalamic nucleus; magnocellular division; VTA; ventral tegmental area; ZI; zona incerta;
421,10.1159/000459859,808626.0,,https://karger.com/jmd/article-abstract/4/4/217/181004/Ventricular-Landmarks-for-Thalamic-Stereotaxy-in?redirectedFrom=fulltext,karger.com,,,Ventricular Landmarks for Thalamic Stereotaxy in Macaco,The most satisfactory ventricular landmarks and coordinate system for thalamic stereotaxy in the macaque are essentially the same as for man ie from CA and CP The degree of precision achieved when using this system is markedly superior to that obtained when using bony landmarks Stereotaxy methods using ventriculographic data are described Multivariate analyses were performed to analyse interspecific differences and more specially to determine whether a single stereotaxic atlas could be used for several species which seems to be the case for M mulatta and M speciosa,Macaco; Thalamus; Cerebral ventricles; Stereotaxy; Multivariate analysis;
444,10.1016/j.neuroscience.2004.06.071,15561430.0,,https://linkinghub.elsevier.com/retrieve/pii/S0306452204006244,linkinghub.elsevier.com,://linkinghub.elsevier.com/,linkinghub.elsevier.com,Afferent subcortical connections into the motor cortical larynx area in the rhesus monkey,In three rhesus monkeys Macaca mulatta the inferior motor cortex was explored by electrical stimulation for sites yielding vocal fold adduction The retrograde tracer wheat germ-agglutinin-conjugated horseradish peroxidase was injected into the effective sites Within the forebrain retrogradely labeled cells were found in the claustrum basal nucleus of Meynert substantia innominata extended amygdala lateral and posterior hypothalamic area field H of Forel and a number of thalamic nuclei with the strongest labeling in the nuclei ventralis lateralis ventralis posteromedialis including its parvocellular part medialis dorsalis and centrum medianum and weaker labeling in the nuclei ventralis anterior ventralis posterolateralis intermediodorsalis paracentralis parafascicularis and pulvinaris anterior In the midbrain labeling was found in the deep mesencephalic nucleus ventral tegmental area and substantia nigra In the lower brainstem labeled cells were found in the pontine reticular formation median and dorsal raphe nuclei medial parabrachial nucleus and locus coeruleus The findings are discussed in terms of the possible role of these structures in voluntary vocal control,motor cortex; larynx area; vocal fold control; thalamus; phonation; neuroanatomy;
461,10.1007/978-1-4613-1051-8_12,,,https://link.springer.com/chapter/10.1007/978-1-4613-1051-8_12,link.springer.com,,,Structure and Connections of the Cingulate Vocalization Region in the Rhesus Monkey,Many primate utterances are simple vocalizations that may be associated with brainstem activity and contain limited information about the internal state of the animal Sequences of tone and amplitude modulated vocalizations which have associative content form the basis for more complex communication within a species These complex vocalizations are organized at suprabulbar levels including the cerebral cortex These keywords were added by machine and not by the authors This process is experimental and the keywords may be updated as the learning algorithm improves,Rhesus Monkey; Anterior Cingulate Cortex; Auditory Cortex; Squirrel Monkey; Supplementary Motor Area;
473,,7424595.0,,https://europepmc.org/article/med/7424595,europepmc.org,://europepmc.org/,europepmc.org,Relationships of precentral premotor and prefrontal cortex to the mediodorsal and intralaminar nuclei of the monkey thalamus.,The projections of precentral premotor and prefrontal cortical areas to the mediodorsal and intralaminar thalamic nuclei have been reexamined by means of the anterograde labelling technique in  macaque monkeys Three principles which have been already mentioned in previous reports could be confirmed within limits i The dichotomy of agranular and granular frontal cortices related to lateral and medial thalamic nuclear division respectively ii the reciprocity of fronto-thalamic connections and iii the thalamic matrix consisting of longitudinally arranged cell columns Kievit and Kuypers  from which the cortical connections originate and where they end One main exception to these principles involves the intralaminar and paralaminar nuclear continuum which seems to disrupt the nearly parallel system of thalamically relayed information channels by forming complex patterns of converging and diverging connectivities with cortical subcortical and possibly intrathalamic regions Another exception concerns the partial bilaterality of fronto-thalamic projections which is not reciprocated as far as we know by the thalamo-cortical counterparts Major emphasis is laid upon the fact that agranular frontal cortex ie precentral and premotor including supplementary motor areas not only project to the ventrolateral nuclear complex and to intralaminar nuclei but in addition to MD paralaminar zone whose efferent connections are known to be directed mainly towards the frontal eyefield and the caudate nucleus and to a lesser degree to the agranular frontal cortex,
476,10.1017/s0952523801185068,11925008.0,,https://www.cambridge.org/core/journals/visual-neuroscience/article/abs/cortical-and-subcortical-afferents-to-the-nucleus-reticularis-tegmenti-pontis-and-basal-pontine-nuclei-in-the-macaque-monkey/E95A9D788EDEAFB716A3B90F0524BD24,www.cambridge.org,,,Cortical and subcortical afferents to the nucleus reticularis tegmenti pontis and basal pontine nuclei in the macaque monkey,Anatomical findings are presented that identify cortical and subcortical sources of afferents to the nucleus reticularis tegmenti pontis NRTP and basal pontine nuclei Projections from the middle temporal visual area MT medial superior temporal visual area MST lateral intraparietal area LIP and areas a and b to the basal pontine nuclei were studied using H-leucine autoradiography The results complemented a parallel study of retrograde neuronal labeling attributable to injecting WGA-HRP into NRTP and neighboring pontine nuclei Small H-leucine injections confined to MT MST LIP area a or area b produced multiple patches of pontine terminal label distributed as follows  An injection within MT produced terminal label limited to the dorsolateral and lateral pontine nuclei  Injections restricted to MST or LIP showed patches of terminal label in the dorsal dorsolateral lateral and peduncular pontine nuclei  Area a targets the dorsal dorsolateral lateral peduncular and ventral pontine nuclei whereas area b projects additionally to the dorsomedial and paramedian pontine nuclei Notably no projections were seen to NRTP from any of these cortical areas In contrast injections made by other investigators into cortical areas anterior to the central sulcus revealed cerebrocortical afferents to NRTP in addition to nuclei of the basal pontine gray With our pontine WGA-HRP injections retrograde neuronal labeling was observed over a large extent of the frontal cortex continuing onto the medial surface which included the lining of the cingulate sulcus and cingulate gyrus Significant subcortical sources for afferents to the NRTP and basal pontine nuclei were the zona incerta ventral mesencephalic tegmentum dorsomedial hypothalamic area rostral interstitial nucleus of the medial longitudinal fasciculus red nucleus and subthalamic nucleus The combined anterograde and retrograde labeling data indicated that visuo-motor cortico-pontine pathways arising from parietal cortices target only the basal pontine gray whereas the NRTP together with select pontine nuclei is a recipient of afferents from frontal cortical areas The present findings implicate the existence of parallel direct and indirect cortico-pontine pathways from frontal motor-related cortices to NRTP and neighboring pontine nuclei,Corticopontine projections; Visual cortical areas; Frontal cortical areas; Parietal cortical areas; Nucleus reticularis tegmenti pontis; Basal pontine nuclei; Autoradiography; WGA-HRP; Anterograde  retrograde neuronal labeling;
477,10.1016/j.neuroscience.2006.06.027,16887277.0,,https://linkinghub.elsevier.com/retrieve/pii/S030645220600858X,linkinghub.elsevier.com,://linkinghub.elsevier.com/,linkinghub.elsevier.com,Interactions among the medial prefrontal cortex; hippocampus and midline thalamus in emotional and cognitive processing in the rat,The medial prefrontal cortex mPFC participates in several higher order functions including selective attention visceromotor control decision making and goal-directed behaviors We discuss the role of the infralimbic cortex IL in visceromotor control and the prelimbic cortex PL in cognition and their interactions in goal-directed behaviors in the rat The PL strongly interconnects with a relatively small group of structures that like PL subserve cognition and together have been designated the PL circuit These structures primarily include the hippocampus insular cortex nucleus accumbens basolateral nucleus of the amygdala the mediodorsal and reuniens nuclei of the thalamus and the ventral tegmental area of the midbrain Lesions of each of these structures like those of PL produce deficits in delayed response tasks and memory The PL and ventral anterior cingulate cortex AC of rats is ideally positioned to integrate current and past information including its affective qualities and act on it through its projections to the ventral striatumventral pallidum We further discuss the role of nucleus reuniens of thalamus as a major interface between the mPFC and the hippocampus and as a prominent source of afferent limbic information to the mPFC and hippocampus We suggest that the IL of rats is functionally homologous to the orbitomedial cortex of primates and the prelimbic and ventral AC cortex to the lateraldorsolateral cortex of primates and that the ILPL complex of rats exerts significant control over emotional and cognitive aspects of goal-directed behavior,infralimbic cortex; prelimbic cortex; nucleus reuniens; hippocampus; memory; working memory; AC; anterior cingulate cortex; ACC; nucleus accumbens; ACTH; adrenocorticotropic hormone; AGm; medial agranular frontal cortex; BLA; basolateral nucleus of amygdala; BST; bed nucleus of the stria terminalis; CEA; central nucleus of the amygdala; DLPFC; dorsolateral prefrontal cortex; EC; entorhinal cortex; FEF; frontal eye fields; HF; hippocampal formation; ICA; intercalated nucleus of the amygdala; IL; infralimbic cortex; LTD; long term depression; LTP; long term potentiation; MD; mediodorsal nucleus of thalamus; M; primary motor cortex; mPFC; medial prefrontal cortex; NTS; nucleus of the solitary tract; OMPFC; orbitomedial prefrontal cortex; PAG; periaqueductal gray; PFC; prefrontal cortex; PHA-L; Phaseolus vulgaris leucoagglutinin; PL; prelimbic cortex; PPF; paired pulse facilitation; PT; paratenial nucleus; PV; paraventricular nucleus; RAM; radial arm maze; RE; nucleus reuniens of thalamus; SNc; substantia nigra-pars compacta; VTA; ventral tegmental area; WM; working memory;
